start	end	text
81000	82000	control was maintained by the booster engines until booster cutoff, when lack of sustainer and vernier control caused the missile to roll clockwise, pitch up, and yaw left. Sustainer thrust decayed at 131 seconds, and the missile began tumbling at 136.6 seconds. Missile self-destructed at 146 seconds with impact point about 600 168. 193D (Leading Edge), 16 Mar 63, Response Mode 4T, Flight Phase 2: Loss of B2 pitch feedback signal at 103.5 seconds resulted in loss of vehicle stability. Missile tumbled, then self-destructed at about 270 seconds. 169. 83F (Kendall Green), 21 Mar 63, Response Mode 4, Flight Phase 2.5: A defective solder joint apparently led to two instances of erroneous velocity computations in 9/10/96 124 RTI the x and z velocity channels. As a result, the missile impacted about 12 miles short and 0.2 miles right of target. 170. 52F (Tall Tree 4), 23 Mar 63, Response Mode 4, Flight Phase 1: Missile selfdestructed at about 91 seconds for unknown reasons. Impact was near the flight line about 120 miles downrange. 171. 65E (Black Buck), 24 Apr 63, Response Mode NA, Flight Phase 2.5: Vernier hydraulic-system pressure was lost at 301 seconds, resulting in loss of vernierengine control during the vernier solo phase. The reentry vehicle impact point was not perceptibly affected by this malfunction. 176. 139D LV-3A/ Agena B (Big Four), 12 Jun 63: Response Mode 4T, Flight Phase 1: Flight appeared normal until about 88.4 seconds when, due to a hydraulic failure, the vehicle made a violent right and down maneuver. The missile broke up five 93.4 seconds. seconds later at 181. 24E (Silver Doll), 26 July 63, Response Mode 4, Flight Phase 2: Spurious voltage transients caused premature pressurization of the vernier solo tanks at 101.3 seconds, and premature sustainer engine shut down just after booster 141 seconds. separation at 187. 63D (Cool Water III), 6 Sep 63, Response Mode 4, Flight Phase 1: All systems performed satisfactorily till 110 seconds, when the sustainer/vernier hydraulic pressure dropped from 3080 to 490 psig. The failure resulted in premature shutdown of the sustainer engine at 136 seconds. Booster-engine cutoff occurred normally at 140.3 seconds, and the booster was successfully jettisoned. The impact point occurred about 620.miles downrange. 188. 84D (Cool Water IV), 11 Sep 63, Response Mode 4T, Flight Phase 2~5: Flight seemed normal through SECO, although the pneumatic precharge to the vernier solo accumulator was lost at 96.6 seconds. Due to this failure, missile stability was R/V probably failed to separate. lost near the start of the vernier solo phase. The 189. 71E (Filter Tip), 25 Sep 63, Response Mode 4T, Flight Phase 2: Visual observers in yaw, and rough running booster reported a boat-tail fire,
82000	83000	radical oscillations and sustainer engines. Failure of the sustainer hydraulic system during the staging sequence resulted in loss of missile stability at 140 seconds. Sustainer and vernier engines shut down at about 267 seconds with the impact point about 600 190. 45F (Hot Rum), 3 Oct 63, Response Mode 1, Flight Phase 1: The B-1 booster-engine fuel valve failed to open during the start sequence, so the engine did not ignite. Missile toppled over and exploded. 191. 163D (Cool Water V), 7 Oct 63, Response Mode 4, Flight Phase 1: Flight was normal up to about 73 seconds when the missile exploded. Suspected cause was intermediate bulkhead reversal/rupture due to insufficient helium pressure. 194. 136F (ABRES), 28 Oct 63, Response Mode 4T, Flight Phase 2: After a normal booster phase and staging, failure of sustainer hydraulic system resulted in loss of sustainer control and stability at 138 seconds. Sustainer and vernier engines shut down at 260 seconds, some 28 seconds early. The R/V impacted about 507 miles 196. 158D (Cool Water VI)., 13 Nov 63, Response Mode 4, Flight Phase 1: The trajectory was low throughout flight. The sustainer/vernier hydraulic pressure was lost at 112.7 seconds, followed by missile self-destruct at about 118 seconds when the vacuum impact point was about 280 miles downrange and on azimuth. 202. 48E (Blue Bay), 12 Feb 64, Response Mode 4, Flight Phase 2: The booster engine shut down at 119.5 seconds, and the sustainer engine shut down prematurely at 198.8 seconds. Impact was near the flight line about 635 miles downrange. 207. 3F (High Ball), 3 Apr 64, Response Mode 1, Flight Phase 1: Missile was destroyed on the pad when the Bl booster engine failed to ignite. 212. 135D (AC-3), 30 June 64, Response Mode 4, Flight Phase 3: The Centaur engines shut down early, apparently due to a hydraulic coupling failure that led to a failure in the propellant system. Impact was about 2340 miles downrange. 219. 57E (Gallant Gal), 27 Aug 64, Response Mode 4, Flight Phase 2: Missile experienced an early SECO with no vernier bum thereafter due to a guidancesystem malfunction. Impact was about 88 miles short and 0.4 miles right of target. 227. 289D (Mariner-3),5 Nov 64; Response Mode 4, Flight Phase 4: A short second burn of the Agena prevented attainment of the desired orbit, and resulted in a heliocentric orbit. 232. 146D., 11 Dec 64, Response Mode NA, Flight Phase 5: Flight was completely normal through Centaur first bum. During the coast phase, liquid hydrogen vented through the vent valve caused vehicle instability and tumbling. By second engine firing, insufficient liquid hydrogen remained at boost-pump· sump to sustain normal combustion. 236. 172D/ABRES (Beaver's Dam), 21
83000	84000	"Jan 65: Response Mode 4, Flight Phase 2 and 3: The Atlas apparently performed normally, except that the sustainer shut down 1.35 seconds early. The OVl""l failed to·separate from the Atlas and thus failed to put the spacecraft in orbit. 240. 156D, 2 Mar 65, Response Mode 1 Flight Phase 1: At 0.36 seconds booster fuelpump pressure dropped due to a fuel prevalve failure, booster lost thrust, fell back on launch pad, and was destroyed at 3.26 seconds. 251. 68D/ABRES (Tennis Match), 27 May 65: Response Mode 4, Flight Phase 1: A failure in the booster gas-generator loop resulted in decreasing booster performance after 116 seconds. The impact point stopped moving at 122 seconds when an explosion occurred in the thrust section. Further vehicle breakup occurred at 218 seconds. Destruct was sent at 293 seconds. Debris impacted close to the intended ground track. 257. SLV-3/ Agena D (White Pine), 12 Jul 65: Response Mode 4 & 5, Flight Phase 2 & 3: Flight was normal until booster engines cutoff at 131 seconds. As a result of a circuit board failure caused by excessive vibrations, the sustainer also shutdown at BECO. The Atlas booster engines did not separate immediately from the sustainer, but did so some 50 seconds later after the event timer recycled. The Agena subsequently separated and ignited at about 198 seconds, creating wild uprange movements on the IP display by 255 seconds. Destruct was sent at 257 seconds. 267. SLV-3 (GTV-6), 25 Oct 65, Response Mode 4, Flight Phase 3: The flight was a failure although all Atlas objectives were achieved. The Agena startup appeared normal, but the engine shut down after about one second of operation, Propellants ceased flowing but the helium pressurization system continued to pressurize the propellant tanks until they burst. 276. 303D (Eternal Camp), 4 Mar 66, Response Mode 5, Flight Phase 1: Although track and rate lock were lost at 88 seconds, missile appeared normal till about 112 seconds when skyscreen operator reported that vehicle was spiraling. A hydraulic system failure occurred during the staging sequence, resulting in loss of vehicle stability at 153 seconds and sustainer engine shutdown at 194 seconds. The impact point initially appeared to stop about 800 miles downrange, well beyond the booster impact point. At about this time or shortly thereafter, telemetry indicated rapidly varying pitch, roll, and yaw rates and shutdown of sustainer and vernier engines. Final impact was estimated to be 976 miles downrange and 3° left of the nominal track. 279. 304D (White Bear), 19 Mar 66, Response Mode 5, Flight Phase 2: The reentry vehicle impacted 82 miles beyond the target point when the head suppression valve failed to close at SECO. The LOX"
84000	85000	"tank thus vented through the sustainer chamber, adding impulse in the process. 281. 184D (AC-8),7 Apr 66, Response Mode 4T, Flight Phase 4: Flight appeared normal until second Centaur burn. Both Centaur engines started but one could not 9/10/96 127 RTI maintain thrust. 1hrust imbalance resulted in tumbling, followed by fuel starvation, and early thrust termination. 284. 208D (Crab Claw), 3 May 66, Response Mode 4T, Flight Phase 1: High enginecompartment temperatures were first noted· at 41 seconds. The sustainer pitchactuator feedback-loop failed open at 136 seconds, a few seconds before planned BECO. The flight appeared normal to the safety officer until about this time when roll and pitch rates increased. The IIP apparently stopped about 155 seconds, although General Dynamics reported that vehicle stability was not lost until 216 seconds. Shutdown of sustainer and vernier engines occurred at 235 seconds. Suspected cause of malfunction was excessive heating in·the boat-tail section. 287. SLV-3 (GTA-9), 17 May 66, Response Mode 5, Flight Phase 1: Vehicle became unstable when B2 pitch control was lost at 121 seconds. Loss of pitch control"" resulted in a pitch-down maneuver much greater than 90°. Guidance control was lost at 132 seconds. After BECO, the vehicle stabilized in an abnormal attitude. Although the vehicle did not follow the planned trajectory, SECO (at 280 seconds), VECO (at 298 seconds), and Agena separation occurred normally from programmer commands. 294. 96D (Veneer Panel), 10 Jun 66, Response Mode 4, Flight Phase 2.5: The reentry vehicle undershot the target by 20 miles when the vernier engines shut down early. Failure was caused by an abnormal decay of control-bottle helium pressure. 298. 58D/ABRES (Stony Island), 13 July 66: Response Mode NA, Flight Phase 3: Flight was regarded as a success, although one of two OV's failed to orbit when it impacted the structure door which had not been opened. 300. 149F (Busy Ramrod), 8 Aug 66, Response Mode 4, Flight Phase 2: The sustainer engine shut down 27 seconds early due to· fuel depletion caused by an unfavorable ratio of propellant usage during the booster stage. Verniers burned to fuel depletion. 306. 194D.(AC-7), 20 Sep 66, Response Mode NA, Flight Phase 5: Atlas Centaur performance was normal, but Surveyor spacecraft lost stability on the way to the moon. 308. 115F (Low Hill), 11 Oct 66, Response Mode 4, Flight Phase 1: The missile was normal till about 85 seconds when it appeared to lose thrust and breakup. Several 32 to 40 miles downrange near the intended flight line. major pieces impacted 310. 174D (AC-9), 26 Oct 66, Response Mode NA, Flight Phase 2: Although Atlas pressurization system anomaly caused decaying sustainer engine performance SECO, no mission objectives were compromised. and early 9/10/96"
85000	86000	128 318. 148F (Busy Stepson), 17 Jan 67, Response Mode NA, Flight Phase 2.5: Flight was norm.al except that reentry vehicle failed to separate. 344. 81F (ABRES/AFSC), 27 Oct 67, Response Mode 4T, Flight Phase 1: Although various anomalous events occurred early in flight, the missile appeared to follow the intended trajectory till about 24 seconds. Diverging roll oscillations actually began about 21.4 seconds, and pitch and roll stability were lost by 24.8 seconds. By 27.9 seconds, the vehicle was tumbling about 6.5 degrees per second in pitch and yaw, and 12 degrees per second in roll. By 30 seconds, the vehicle lost all thrust and began to break up. Fuel cutoff and destruct were sent at 35 and 39 seconds, respectively. - 358. 95F (ABRES/AFSC), 3 May 68, Response Mode 5, Flight Phase 1: Immediately after liftoff the telemetered roll and yaw rates indicated that the missile was erratic. During the first 10 seconds of flight the missile yawed hard to the left. It then began a hard yaw to the right, crossed over the flight line and continued toward the right destruct line. Shortly thereafter the missile apparently pitched up violently and the IIP began moving back toward the beach. The missile was destructed at about 45 seconds when the altitude was about 14,000 feet and the downrange distance about 9 miles. Major pieces impacted less than a mile offshore, indicating uprange movement of the impact point during the last part of thrusting flight. 364. 5104C AC-17 (ATS-D), 10 Aug 68, Response Mode NA, Flight Phase 4: A normal parking orbit was achieved, but when Centaur restart was attempted, thrust could not be maintained because of inoperative boost pumps. Frozen H 0 line was the apparent root cause. 2 2 365. 7004 SLV-3/Burner II/Agena D (AFSC), 16 Aug 68: Response Mode 4, Flight Phase 3: Atlas performance was norm.al. The vehicle failed to achieve orbit because th~ protective shroud surrounding the second stage failed to separate. 368. 56F (ABRES/AFSC), 16 Nov 68, Response Mode 4T, Flight Phase 2.5: Flight was norm.al through SECO. The missile then lost attitude control, executing a hard yaw rate tum throughout and beyond the vernier solo phase. 372. 5403C AC-20 (Mariner 6 Mars), 24 Feb 69, Response Mode NA, Flight Phase 1: Early Atlas BECO due to staging accelerometer failure was compensated for by extended Atlas sustainer and Centaur burns. Mission was successful. 379. 98F (ABRES/AFSC), 10 Oct 69, Response Mode 4, Flight Phase 1: The missile appeared normal until about 66 seconds when the sustainer engine shut down prematurely. The booster engine apparently continued normally to BECO. At about 255 seconds the payload SPDS engine ignited. Destruct was sent at 272 seconds.
86000	87000	388. 5003C AC-21 (OAO-B), 30 Nov 70, Response Mode 4, Flight Phase 2: Since the nose fairing failed to separate, Centaur did not have enough energy to make orbit. Payload impacted in Africa. 392. 5405C AC-24 (Mariner 8 Mars), 8 May 71, Response Mode 4T, Flight Phase 3: Mission requirements were not met. The Atlas boost phase was normal. Shortly after Centaur main-engine start, pitch stabilization was lost due to failure. of the rate gyro or an electrical failure in the pitch channel of the flight control system. The vehicle began an accelerated nose-down tumbling motion that subsequently resulted in early and erratic main-engine shutdown due to propellant starvation. 397. SLV-3A (Agena), 4 Dec 71, Response Mode 4, Flight Phase 1: Sustainer engine turbine damage during engine start resulted in hot gas leaks and eventual failure of thrust-section hardware. Vehicle broke up at 87 seconds. 419. 5015D AC-33 (Intelsat IV F-6), 20 Feb 75, Response Mode 4T, Flight Phase 2: The Atlas booster-section electrical disconnect failed at booster staging. The harness was pulled apart, so flight-control avionics was unable to maintain vehicle stability: Missile appeared normal until the IP stopped at 200 seconds. Precautionary destruct was sent at 414 seconds. 420. 71F (AFSC), 12 Apr 75: Response Mode 4, Flight Phase 1: Although an abnormal overpressure occurred at the base of the missile 620 msec before liftoff, the vehicle appeared normal until about 45 seconds when sustainer manifold and fuel-pump pressures began dropping. By 61 seconds, both the sustainer and vernier engines had shut down. Booster engines continued thrusting until about 123 seconds when the IIP stopped moving and radar operator reported multiple pieces. The breakup apparently resulted from an external explosion in the flame bucket that damaged the thrust section. Destruct was sent at 303 seconds when missile 5°. elevation dropped to 432. 5701D AC-43 (Intelsat IVA F-5), 29 Sep 77, Response Mode 4T, Flight Phase 1: A leak in the booster hot-gas generator at 2.3 seconds resulted in a fire in the thrust section at 36.5 seconds. The vehicle went into a violent maneuver at 54.9 seconds, failing the structure. The Atlas exploded at 55.8 seconds, leaving the Centaur intact. The Centaur was destroyed by the RSO at 61.7 seconds. 457. 19F (NOAA-B), 29 May 80: Response Mode NA, Flight Phase 1: Failure of turbopump seal allowed fuel to enter the gear box resulting in 21 % low thrust by the Bl booster engine. The payload was inserted into-an abnormal orbit and the mission was lost. 460. 68E, 8 Dec 80: Response Mode 5, Flight Phase 1: Flight appeared normal until 102.7 seconds when the lube oil pressure on the B2 booster engine suddenly dropped. At 120.1 seconds,
87000	88000	the engine shut down, followed 385 msec later by guidance shutdown of the Bl engine. The asymmetric thrust during shutdown 9/10/96 130 RTI caused yaw and roll rates that the flight control system could not correct. As a result, attitude control was lost and the thrusting sustainer pivoted the missile to a retrofire attitude before the vehicle could be stabilized. After the booster package was jettisoned, the missile was stabilized and decelerating in the retrofire mode by 148 seconds. The sustainer continued thrusting in this attitude until 282.9 seconds when reentry heating apparently caused sustainer shutdown and vehicle breakup. 464. 5039D AC-59 (FLTSATCOM), 6 Aug 81, Response Mode NA, Flight Phase 1 and 5: The basic mission was accomplished although three increasingly severe shock events were recorded at 56.2, 70,7, and 120.8 seconds. The structural damage sustained by the spacecraft severely limited on-orbit operations. 466. 76E (NAVSTAR VII), 18 Dec 81: Response Mode 2, Flight Phase 1: Shortly after clearing the launch tower at an altitude of about two tower heights, the thrust performance of the Bl engine began to decay. The engine was shut down 7.4 seconds. The unbalanced thrust caused the missile to pitch over completely by to the right, and travel horizontally for about one second. It then pitched toward the ground. A small explosion. occurred about one-third of the way down, followed by a larger explosion when the missile impacted the ground directly behind the launch pad about 19 seconds after liftoff. Cause of the engine failure was plugging of the gas-generator fuel-cooling parts that resulted in a gasgenerator bum-through. 477. 5042G AC-62 (Intelsat V), 9 Jun 84, Response Mode 4T, Flight Phase 4: Performance was normal until an abnormal shock event occurred at Atlas/Centaur separation. Subsequent data indicated that a Centaur oxygen tank leak resulted in a loss of 1483 pounds of LOX during Centaur first burn. The leak resulted in the LOX tank pressure falling below the LH2 tank pressure, which led to collapse of the intermediate bulkhead during the coast phase. Bulkhead collapse caused unexpected tumbling forces during coast. The Centaur engines restarted after coast, but burned for only 6 or 7 secorids of a planned 90-second bum. 489. 5048G AC-67 (FLTSATCOM F-6), 26 Mar 87, Response Mode 4T, Flight Phase 1: Vehicle performance was normal till 48.4 seconds, when the vehicle was struck by lightning. As a result, the guidance computer commanded a hard right tum which caused vehicle breakup due to inertial and aerodynamic loads. RSO sent destruct at 70.7 seconds. 498. 5050 AC-70 (BS-3H COMSAT), 18 Apr 91, Response Mode 4T, Flight Phase 3: Atlas performance was normal. Although both Centaur main engines began the start sequence properly, the C-1
88000	89000	turbo-machinery decelerated and stopped, C-1 engine thrust at the ignition level. Air entering through the stuckleaving the open check valve liquefied and froze in the LH2 pump and gear box of the C-1 9/10/96 131 RTI engine, thus preventing the engine from achieving full thrust. Due to the resulting thrust imbalance, the vehicle tumbled out of control. Destruct was sent 80 seconds after Centaur ignition. some 506. 5051 AC-71 (Galaxy lR), 22 Aug 92, Response Mode 4T, Flight Phase 3: A Centaur engine check valve stuck open allowing air into the turbopumps. Air entering LH2 pump and gear through the stuck-open check valve liquefied and froze in the box of the C-1 engine, which prevented the engine from achieving full thrust. Destruct was sent by the RSO about 193 seconds after Centaur ignition. This is the AC-70 launched on 18 Apr 91. same failure experienced by 507. 5054 AC-74 (UHF Follow On-1), 25 Mar 93, Response Mode NA, Flight Phase 2 and 5: The flight was considered successful although below normal Atlas (5000 nm vice planned 9225 nmk performance resulted in a low spacecraft apogee The perigee altitude was near nominal at 120 run. A loose screw that allowed the oxygen regulator to go out of adjustment caused booster-engine thrust to drop to 65%.of nominal at 103 seconds. The booster engines remained attached to the sustainer, which flew to propellant depletion. These events led to depletion 22 seconds early. shutdown of the Centaur stage 9/10/% 132 RTI D.3 Delta Launch and Performance History The Delta launch-vehicle family originated in 1959 with a NASA contract to Douglas Aircraft Company, now McDonnell Douglas Corporation. The Delta, using components form USAF's Thor IRBM program and USN's Vanguard launch-vehicle program, was operational 18 months later. On May 13, 1960, the first Delta was launched from Cape Canaveral with a 179-pound Echo-I passive communications satellite. In the intervening years, the Delta has evolved to meet the ever-increasing demands of its payloads - including weather, scientific, and communications satellites. Each Delta modification corresponded to an increase in payload capacity. Table 42 shows a summary of Delta configurations since the beginning of the program.1101 The Delta 7925, the latest vehicle in the series, is a three-stage liquid-propellant vehicle with nine solid-propellant strap-on booster motors. For propellants, the Delta uses RP- 1 and liquid oxygen in Stage 1, and nitrogen tetroxide and aerozine 50 in Stage 2. Stage 3 consists of a Payload Assist Module (PAM) with a solid-propellant motor. The strap-on boosters are Hercules graphite epoxy motors (GEMs) using HTPB-type solid propellant. At liftoff, the liquid-propellant Stage-1 engine and six of the nine GEMs are ignited. The remaining three GEMs are ignited some 65 seconds later. Table
89000	90000	42. Summary of Delta Vehicle Configurations Configuration Description Delta Stg. 1: Modified Thor. MB-3 Blk I engine 2: Vanguard AJl0-118 propulsion system 3: Vanguard X-248 motor 1: Erurine replaced with MB-3 Blk II A Stg. B Stg. 2: Tanks lengthened; higher energy oxidizer used C Stg. 3: Replaced with Scout X-258 motor PLF: Bulbous replaced low drag D Stg. 0: Added 3 Thor-developed SRMs (Castor I) E Stg. 0: Castor II replaced Castor I 1: MB-3 Blk III replaced Blk II Stg. 2: Propellant tank diameters increased Stg. 3: Replaced with USAF-developed FW-4 motor PLF: Fairing enlarged to 65-inch diameter J Stg. 3: TE-364-3 used L,M,N Stg. 1: Tanks lengthened, RP-1 tank diameter increased 3: Varied: FW-4 (L), TE-364-3 (M), none (N) M-6, N-6 Stg. 0: Six Castor IIs employed 900 Stg. 0: No Castor Ils employed 2: Replaced with Transtage AJ10-118F engine 1604 Stg. 0: Six Castor IIs employed 3: Replaced with TE-364-4 9/10/96 133 RTI Configuration Description 1910, 1913, Stg. 0: Nine Castor Ils employed 1914 Stg. 3: Varied: none (1910), TE-364-3 (1913), TE-364-4 (1914) PLF: 96-inch diameter replaced 65-inch 2310, 2313, Stg. 0: Three Castor Ils employed 2314 Stg. 1: RS-27 replaced MB-3 Stg. 2: TR-201 engine replaced AJ10-118F_. Stg. 3: Varied: none (2310), TE-364-3 (2313), TE-364-4 (2314) 2910, 2913, Stg. 0: Nine Castor Ils employed 2914 Stg. 3: Varied: none (2910), TE-364-3 (2913), TE-364-4 (2914) 3910, 3913, Stg. 0: Nine Castor N s replaced Castor Ils 3914 Stg. 3: Varied:none or PAM (3910),TE-364-3 (3913),TE-364-4 (3914) 3920,3924 Stg. 2: AJ10-118K engine replaced TR-201 Stg. 3: Varied: none or PAM (3920), TE-364-4 (3924) 4920 Stg. 0: Castor NA replaced Castor N Stg. 1: MB-3 replaced RS-27 5920 Stg. 1: RS-27 replaced MB-3 6925 Stg. 1: Tanks lengthened 12 feet Stg. 3: STAR 48B motor used - PLF: Bulbous 114-inch diameter used 7925 Stg. 0: GEM replaced Castor NA Stg. 1: RS:.27A replaced RS-27 9/10/96 134 RTI The entire Delta history through 1995 is depicted rather compactly in bar-graph form in Figure 38. The solid-block portion of each bar indicates the number of launches during the calendar year for which vehicle performance was entirely normal, in so far as could be determined. The clear white parts forming the tops of most bars show the number of launches that were either failures or flights where the launch vehicle experienced some sort of anomalous behavior. Every launch with an entry in the response-mode column in Table 43 falls in this category. Such behavior did not necessarily prevent the Number of Delta Missions | -rarmet Penta Normal errormance rere 0 प प 90 95 Figure 38. Delta Launch Summary D.3.1 Delta Launch History The data in Table 43 summarizes all Delta and
