start	end	text
25000	26000	may result from unequal data weighting, but primarily it is due to the obvious fact that fewer Mode 4 and 5 failures have occurred during flight phase 0 - 1 than during the longer span of flight phase 0 - 2. 5.3 Relative Probability of Tumble for Response-Modes 3 and 4 Exponential filters with values of F from 0.98 to 0.999 have been used to-estimate the percentage of Mode-3 and Mode-4 - responses that tenninate with a thrusting tumble. Results are given· in Table 18 for flight phases 0 - 2 and 0 - 5. For launch-area risk calculations, only flight phases O - 2 are of interest. The data sample was a chronological composite of all Atlas, Delta, Titan, and Thor tests and configurations shown in Appendix D. To several decimal places at least, the values in the table are determined entirely from Mode-4 responses, since the last vehicle to experience a Mode-3 response (4/25/61) is weighted out of the solution: The results in Table 18 are based ona total sample size of 1,186 flight tests. Table 18. Percent of Response Modes 3 and 4 That Tumble. Filter Factor Flight Phases O -2 Flie.:ht Phases 0 - 5 Through flight phase 2, there were 33 tumbles out of a total of 132 Mode-3 and Mode-4 responses. Through flight phase 5, there were 42 tumbles out of 168 Mode-3 and Mode-4 responses. As seen from Table 13, the smaller the filter factor, the greater the weight placed on recent test data. In view of this, it is apparent from Table 18 that the percentage of Mode-4 responses that end with a thrusting tumble has been increasing gradually. The same conclusion is reached for flight phases 0 - 2 and 0 - 5. In recognition of this gradual increase, in future studies RTI will assume that approximately one-third of Mode-3 and Mode-4 failure responses end with a thrusting tumble. 6. Shaping Constants Through Simulation Since adequate test data are not available to establish the Mode-5 shaping constants empirically, other methods are needed for this purpose. It will be recalled that, after vehicle pitchover, any malfunction with the potential to cause a substantial deviation from the intended flight line is, by definition, a Mode-5 failure response. The malfunction need not actually cause a large deviation to be classified as a Mode-5 response. One such class of failures leading to a Mode-5 response has been termed a random-attitude failure. Such responses can result from guidance and control failures that lead to erroneous orientation of the guidance platform or an erroneous spatial target. Another class of failures that can cause sustained deviation away from the flight line is the slow turn, where the engine
26000	27000	nozzle, in effect, locks in some fixed position, generally but not necessarily near null. Both types of malfunctions have been investigated in an attempt to estimate numerical values for Mode-5 shaping constants A and B. Basically, the idea is to (1) run a large sample of random-attitude and slow-tum failures, (2) calculate the percentages of impacts in five-degree sectors from 0° to 180°, (3) compare these percentages with those obtained from the Mode-5 impact density function when specific values are assigned to A and B, and (4) assign values to A and B until the best pos~ible fit is obtained between the simulated-tum impacts and the theoretical Mode-5 impacts. 6.1 Malfunction Turn Slmulatlons 6.1.1 Random-Attitude Failures A guidance and control failure leading to a fixed erroneous direction of thrust is termed a random-attitude failure. Such failures represent a subset of possible Mode-5 failure responses. Random-attitude failures can be used to establish the maximum possible region of impact, given that a vehicle has flown normally for a specified period of time. For this purpose RTI has developed a Random-Attitude Failure Impact Point (RAFIP) program written in Fortran (3900 lines of code) for execution on a personal computer. Using a Monte Carlo approach, program RAFIP first selects a starting time and then a random thrust direction on the attitude sphere, with all directions having the same chance of being chosen. Each Monte-Carlo run is begun using the nominal vehicle position and velocity at the selected start time, assuming an instantaneous change in thrust direction. Thrust is applied continuously in the selected random direction, and the equations of motion are numerically integrated until one of four conditions is satisfied: (1) final stage burnout occurs, (2) the vehicle impacts while thrusting, (3) orbital insertion occurs, (4) the vehicle breaks up due to aerodynamic forces For conditions (1) and (4), the trajectory is extended to impact using Kepler's equations. For condition (3), an impact point does not exist. The process just described is repeated 9/10/% 31 RT! for a suitably large sample so the distribution of resulting impact points will, for all practical purposes, represent all possible impact points, irrespective of the actual nature of the failure. Depending on vehicle breakup characteristics and failure time, a vehicle that experiences a random-attitude failure may break up at the instant of failure, or after a few seconds into the tum, or not at all. In making the calculations, three separate breakup thresholds and a no-breakup case were investigated. With respect to vehicle breakup, the assumption was made that the vehicle would break up if qa. exceeded a specified constant limit, where q is the dynamic pressure and a. is the total angle of attack. Although the breakup
27000	28000	"qa may well be a complicated function of Mach number and other parameters, this simplistic approach was taken. Random-attitude-failure calculations were made individually for Atlas, Delta, Titan, and LLVl starting shortly after pitchover and continuing to some convenient time such as a stage burnout when the vehicle could no longer endanger the launch area. Theoretically, the Mode-5 impact density function extends downrange until the instantaneous impact point vanishes. Since this study is concerned with evaluation of · density-function parameters for launch-area risk analysis, the random-attitude calculations were _stopped at a staging event when the vehicle no· longer had sufficient energy to return the impact point to the launch area. Using trajectory data for each vehicle, program RAFIP was run to generate 10,000 impact-point samples at each at ten-second intervals. starting time. Calculations were made 6.1.2 Slow-Turn Failures Certain types of guidance and control failures can cause the thrusting engine to gimbal to null or a near-null position: Such failures can produce what is herein called a slow tum. For various reasons, after an engine is commanded to null it may not thrust precisely through the center of gravity, e.g., structural misalignments, shifting center of gravity, canted nozzles. Since, like random-attitude failures, slow ·turns constitute a subset of Mode-5 failure responses, they have been investigated using RTI program RAFIP. The following assumptions have been made in making the calculations: (1) The effective thrust offset of a ""nulled"" engine is normally distributed with a zero mean and a standard deviation of 0.1°. (2) A fixed thrust offset results in a constant angular acceleration of the airframe, and thus a constant angular acceleration of the thrust vector. (3) For small thrust misalignments, the angular acceleration of the airframe is proportional to the angular thrust misalignment. At each time point, the angular acceleration produced by small thrust offsets was estimated from the malfunction turn data provided to the safety office by the range IIAS were provided for three gimbal angles, the user. Malfunction turns for the Atlas smallest being one degree. For each gimbal angle, the results were plotted as 9/10/96 32 RTI cumulative angle turned versus time. Since the slope of the curve (i.e., the turning rate) is greatest when the thrust (and thus airframe) is directed at right angles to the velocity vector, the average angular acceleration during the first 90° of rotation was obtained from the equation (4) so that = 2 8(deg) = 180 deg 8 (5) 2 2 t2 (sec ) t2 sec where t is the elapsed time from the beginning of the tumble tum until the airframe has rotated approximately 90°. If the assumption is made that the angular acceleration is directly proportional to the thrust offset"
28000	29000	angle (i.e., nozzle deflection), the angular acceleration 0d for any small deflection angle becomes (6) where 0 is the angular acceleration computed from Eq. (5) for deflection angle 6 (1° for IIAS), and 6d is some small deflection angle. Atlas IIAS data, angular accelerations 8 were computed at ten-second Using the Atlas intervals from the programming time of 15 seconds to 275 seconds for 6 = 1°. For each starting time, a normal distribution with zero mean and a standard deviation of 0.1° was sampled to obtain an initial thrust misalignment 6d to substitute in Eq. (6). The resulting angular acceleration 8d was applied throughout the. tum. Slow-tum calculations were made in a manner analogous to the random-attitude turns, using the reference trajectory to obtain the starting position and velocity components. The slow turn was assumed to occur in a randomly oriented plane containing the starting velocity vector. Each turn was carried out until one of the four conditions listed in 6.1.1 for random-attitude turns was met. For conditions (1) and (4), impact Section points were calculated and, along with thrusting impacts from condition (2), summed for each five-degree sector from 0° to 175°. At each starting time, 10,000 impact-point calculations were made. 6.1.3 Factors Affecting Malfunction-Turn Results Random-attitude turns and slow turns are only subsets of the totality of Mode-5 failure responses. As discussed earlier in Section 3, other types of behavior following a Modes failure are numerous and largely impossible to categorize, much less simulate. Ideally, impact distributions from all types of Mode-5 responses should be combined before results are compared with those obtained from the theoretical Mode-5 impact 9/10/96 33 RTI density function. Since this could not be done in general, impacts from only the two types of malfunction turns were considered. Several factors affect the results of the simulations: a. Weighting of tum data: Both random-attitude and slow-tum. simulations were made for Atlas HAS. In combining impacts from the two data sets, randomattitude turns were assumed to be three times as likely to occur as slow turns. A factor of three was selected· since, among the Mode-5 failure responses in the performance summaries for Atlas, Delta, and Titan, random-attitude turns appeared to occur about three times as often as slow turns. In many cases, lack of detailed information made it difficult to· decide whether a Mode-5 response should be considered as a random-attitude tum, a slow tum, or some other type of failure. The relative weighting of turns makes little difference, however, since the impact distribution for the two types of turns are similar (as shown later in Figure 5), and since the weighted composite must lie between the two. It was assumed that similar results
29000	30000	would be obtained for Delta, Titan, and LCVl, so slow-turn computations were not made for these vehicles, cutting the number of time-consuming simulations in half. b. Breakup qa: In the tum calculations, the assumption was made that vehicle qa. was reached~ In addition to the nobreakup would occur if a certain value of breakup case which is considered unrealistic, separate runs were made for three constant values of qa: 5,000, 10,000, and 20,000 deg-lb/ft2. As stated previously, in reality, much more involved than this the determination of vehicle breakup is, simplistic approach would suggest. However, to add realism to the malfunctiontum calculations, use of a simple approach seemed better than none at all. For Titan IV, allowable (but not breakup) qa.'s were provided as functions of Mach number. The maximum permissible value and corresponding Mach number for Titan/Centaur, Titan/NUS~ and Titan/lUS were, respectively, 6819 deflb/ft 2 at Mach No. 0.77, 5332 deg-lb/ft2 at Mach No. 0.815, and 17,000 deg-lb/ft at Mach No. 0.325. For Atlas, Delta, and LLVl vehicles, no breakup qa. data were available. The breakup qa.'s used in the calculations bracket the range of permissible qa.'s for the Titan vehicles. c. End time T: The simulated impact distributions from random-attitude failures and slow turns were compared with impact distributions computed from the Mode-5 theoretical impact-density function. For the comparisons to be meaningful, the value selected for T in the Mode-5 impact-density equation and the stop time for thrusting-turn simulations must be the same. To some extent, the shaping constants A and B derived by fitting the theoretical and simulated impact data depend on TJY since the percentage of impacts in each 5° sector depends on TB. However, after A and B have been established for a particular TJY using a different TB in the DAMP calculations has no effect on computed risks provided an adjustment is made in the probability of occurrence of a Mode-5 9/10/96 34 RTI response. Referring to Eq. (3), the right-hand member must be multiplied by the probability p5 of a Mode-5 response to obtain absolute probabilities. Except for TB itself (and to a slight degree, shaping constants A and B), the quantities in the equation do not depend on TB. Thus if TB and p5 are both changed so that p/(TB - Tp) remains constant, the computed risks are unchanged. If destruct action (i.e., impact limit lines) is included in the DAMP calculations, the supplemental risks* resulting from that action must be accounted for. In this case, the termination time has a minor influence on results, since it affects the number of impacts that would occur beyond the impact limit lines without destruct that are forced inside when destruct action is taken. If
30000	31000	destruct action is omitted, the value of TB is immaterial (i.e., supplemental Mode-5 risks are nonexistent) provided that the impact range along the reference trajectory at time TB exceeds the range to all targets of interest. (Except in this paragraph, supplemental Mode-5 risks are not addressed in this present report.) d. Vacuum calculations: Atmospheric effects were accounted for in determining when vehicle breakup would occur and, to some extent, during each thrusting tum by using accelerations from the nominal trajectory. To reduce computer time and cost of this study, vacuum calculations were made during free fall after vehicle breakup or burnout. Although this increased impact dispersions somewhat, vacuum results should not be drastically different from those obtainable using a maximum-beta piece. In theory at least, different mode-5 shaping constants exist for each debris class. In view of the uncertainties in vehicle breakup conditions and characteristics, and in the overall process of - simulating Mode-5 malfunctions, attempts to derive unique shaping constants for each debris class did not seem justified. 6.1.4 Malfunction-Turn Results for Atlas IIAS For Atlas IIAS,.the distribution of impacts for simulated random-attitude turns, slow turns, and a weighted combination (75% random-attitude and 25% slow tum) are shown in Figure 5. Since the impact distribution (i.e., the percentages of impacts in 5° sectors) for the weighted composite was not significantly different from that for random-attitude failures, slow-turn computations were not made for Delta, Titan, and LLVl. * See Ref. [1], Section 10. 0.1 | cts EAS Sent eb ee pe bees ORKORS SHA SEE el Breakup o-al 'deg-ibiftt~ wadeons dnteneneweSt OV Ran dom-at titude turns ot CC eerrrerr rere cerors Con tums nbined turns (( ).75 random + 0.25 s Se ankaeknotmemceneerebeenay 0 20 Figure 5. Combined Random-Attitude and Slow-Turn Results 6.2 Shaping Constants for Atlas IIAS 6.2.1 Optimum Mode-5 Shaping Constants Since the dynamic pressures that can cause the Atlas ITAS to break up were not available, random-attitude failures were simulated for a no-breakup case and for three breakup qa's: 20,000 deg-Ib/ft', 10,000 deg-Ib/ft', and 5,000 deg-Ib/ft'. For each case, 270,000 trajectories were run, giving a total of 1,080,000. It turned out that the value chosen for the breakup qa was critical in determining shaping constant A, since the lower the qa, the less the thrusting time before breakup, and the higher the percentages of impacts in sectors near the flight line. For Atlas IIAS, the effects of qa on breakup are shown in Figure 6 where, for the selected qa''s, the percentages of random-attitude turns that result in breakup before 280 seconds are plotted against failure time. 100 ae Atlas: IAS. 2 \ -é -. 80 A g-alpha in deg-lb/ft- \ | -- q-alpna= 5,000 S 70
31000	32000	"H ~ == @-alpna = 10,000 Cc 1 il ® 1 s 50 veseeas"" o. \ a 40 \- 5 4 g \ 20 \b aecetesteseceatevscbesenaneacensconreas dhesseneeeneeeenee~ 10 - Figure 6. Atlas ITAS Breakup Percentages for Random-Attitude Turns For failures between 10 and 30 seconds, most breakups do not occur at failure, but later in flight after the vehicle has built up significant velocity. For failures between 40 and 105 seconds, more than 80% breakup occurs, even for qa's as high as 20,000 deg-Ib/ft'. In this region, breakup occurs at or shortly after vehicle failure. Beyond 170 seconds, the dynamic pressure between failure and 280 seconds stays sufficiently low so that the vehicle remains intact. The dramatic differences in impact distributions that can result at certain times during flight if the vehicle is subject to aerodynamic breakup can be seen by comparing the impact footprints in Figure 7 and Figure 8. Both patterns show 10,000 impact points IIAS at 130 seconds. Figure 7 is for no from random-attitude failures of the Atlas 5,000 deg-lb/ft2. breakup, and Figure 8 is for a breakup q<rof The data in Table 19 comprise an example of a 270,000-point sample of random-attitude failures run at 10-second intervals from 15 to 275 seconds. (For brevity, only everyother failure time is shown in the table.) Ten thousand impacts are computed at each failure time. Five-degree sectors are identified in the left-hand _column. For each time, in each 5° sector is shown in·the column for that time. The total the number of impacts number of impacts for all failure times and the percentages of impacts in each sector are given in the last two columns of the table. oF.: wg ace eng tte ate oe er + cS ee Ba tee bs. tae a Tey sort ett ae SEP ap, new eer cod Random-Attitude Failures at 130 sec. No Breakup Atlas TAS Impacts Thrust to 280 sec. Figure 7, Atlas IIAS Impacts with No Breakup ttt. ee ote ley ""Eat ae ot %, "" U cu un & oe 2 + @ 6 8G \. % =} J 5S 'oa wo Ul Fos ages Seue nr ad = 5 | ery nO Ys | Secu PGES Ine Figure 8. Atlas IIAS Impacts with Breakup | 9/10/96 40 Table 19. Sample Impact Distribution for Atlas IAS with No Breakup 9/10/96 41 RTI In Figure 9, the percentages of impacts in 5° sectors from 0° to 180° have been plotted for Atlas IAS random-attitude turns out to 280 seconds. (It should be remembered that random-attitude turns are representative of combined random-attitude and slow turns.) For B = 1000, theoretical Mode-5 impact percentages are also plotted in the figure for best-fit"
32000	33000	"values of A obtained by trial and error. as liAS Random-Attitude Failures through 280-seccon Breakup-q:alpha-in-deg-ib/t- TAS breakup seb ~~ pOOd baaaee © oN 圈 пппппп g 00న్ ന ణనఇఅ hs 29-75 SG |e mg.20) ra = 3.45 QO. Figure 9. Atlas ILAS Simulation Results with B = 1,000 By observing curve shapes, it can perhaps be seen that no single value of A causes a theoretical impact distribution and a distribution of impacts from random-attitude turns to match closely over the entire range of 5° sectors. Attempts to improve the match on one end of the curve by selecting a different A merely degrades the match on 9/10/96 42 | RTI the other end. It is possible, however, to obtain fairly close agreement over sectors""' from ±80° to ±180°, as seen in Figure 9. Since for Atlas HAS there are few, if any, significant population centers in the launch area outside these sectors (i.e., within ±80° of the flight line), failure of the curves to match closely near the flight line is of little. consequence. If a better data match is considered desirable for computing risks to population centers within ±80° of the flight line (e.g., ships), either a different A can be selected for use with B = 1,000 or other values of A and B can be derived. If only a single value of B is used, no matter what the value, a good match between theoretical 180° sector for various breakup qa.'s. and simulated data is not possible over the entire Before becoming too concerned about lack of a data match between 0° and 80°, it should be remembered that many types of Mode-5 responses cannot be simulated, so that the malfunction-tum impact distributions plotted in Figure 9 are only a subset of all possible Mode-5 impacts. Based on twelve Mode-5 failure responses for. which impact data are available, it is believed that inclusion of the ''non-simulatable"" Mode-5 responses would considerably improve the match in the sector from ±10° to ±80°. Another mitigating factor is that risks near the flight line are totally dominated by Mode-4 failure responses. To see how data matching is affected by selecting widely differing values of B, the theoretical Mode-5 impact distributions were computed for B =50,000, 100,000, 500,000, and 5,000,000. Best-fit values for A were again determined by trial and error. Results are shown in Figure 10 through Figure 13 along with the same impact distributions for random-attitude turns plotted in Figure ""' For other values of B and qa, close agreement is possible from ±60° to ±180°. las TAS -Random-Att Pere ernest i coy ""Break rererey up O=al ha indeg-tb/t bameeeeateennmnmeee 20,000 annennd Angle From Fiight Path (deg) Figure 10."
33000	34000	"Atlas ITAS Simulation Results with B = 50,000 tas liAS-Random-Attitude Failures through 386-see"""" abv owe sneer eon Pe 2. eaipha in-degab/t- POP res EPPS Sees Pee eer eres eas no breakup | 50,000 resesanduennorsuneuacsnsverfurwustnnnuncnauenesspascsvesraseners: 10;000~ 5,000 a ee ane wits Xe 340 ""22 AS 4.30 reerery ""EAS 475 sop. A.=.5.00 7 en Snes atson:: i ghAnresh fe 20 40 60 80 120 140 Figure 11. Atlas ILAS Simulation Results with B = 100,000 Wyerreerere tery dnaceaver Aeeeeee ke tatal pcccAtlas HAS Random-Attitude Failures throug! § Br reakup ¢qraipha in.deg-ib/t DR PREERKEKERT NORA e re ho breakup *°20;00 a | 5,000 oaree 3222 WE 4.80 PEEK OAS SN BOR Tews sanvend Figure 12. Atlas ITAS Simulation Results with B = 500,000 46 RTI las IAS Random-Attitude F through 280:secae Breaku p.qzalpha.in.degel saxremreongnd Aft. no breakup 20,00 10.00 go ©& ©: 4 5,000 B= 5,000 O00 ee te me hee 0.69 =A 6-10 6.30 fone, te, Figure 13. Atlas ILAS Simulation Results with B = 5,000,000 The five values of B and the corresponding best-fit values of A used to compute the Mode-5 distributions shown in Figure 9 through Figure 13 are tabulated in Table 20. It is apparent that the value of A is dependent on both qa and B. In general, if a larger value of B is selected, a larger value of A is required to effect a fit with the randomattitude-turn data. On the other hand, if the breakup ga is increased, the required value of A must be decreased. Only qa is critical since, as shown later, any value of B, together with its corresponding value of A, can be used in the launch-area risk computations if significant targets do not lie within +80° of the flight line. Table 20. Shaping Constants for Atlas IIAS Breakup ga (deg-Ib/ ft') B A none 1,000 1.90 20,000 | 2.75 10,000 3.20 5,000 3.45 none 50,000 3.15 20,000 4.10 10,000 4.50 5,000 4.75 none 100,000 3.40 20,000 4,30 10,000 4.75 5,000 5.00 none 500,000 4.00 20,000 4.85 10,000 5.30 5,000 5,55 none 5,000,000 4,75 20,000 5.65 10,000 6.10 5,000 6.30 * interpolated 9/10/96 48 RTI Because of the uncertainties in breakup conditions, the values of A for each B in Table 20 have been plotted against qa in Figure 14. By reading from the plots, a value of A for the five values of B can be obtained for any breakup qa deemed appropriate between 5,000 and 20,000 deg-Ib/ ft'. 6.5, | < mn € 5.0 wort ee eee4 g ta,B = 100,000 ~ o en ae Oo 4. مة ~ ~ ws a 8 4° TS S 4.0 L i: 3.5 PB = 1,000 Atlas IIAS |: 2.5 Breakup"
