start	end	text
0	1000	"RESEARCH TRIANGLE INSTITUTE Contract No. FO4703-91-C-0112 RTI Report No. RTI/5180/77-43F September 10, 1996 Modeling Unlikely Space-Booster Failures in Risk Calculations Final Report Prepared for 45th Space Wing (AFSPC) Safety Office - 45 SW/SE Patrick AFB, FL 32925 and 30th Space Wing (AFSPC) Distribution authorized to US Government agencies and their contractors to protect administrative/ operational use data, 10 September 96. Other requests for this document shall be referred to the 30th Space Wing (AFSPC) Safety Office (30 SW/SE), Vandenberg AFB, CA 93437, or 45th Space Wing (AFSPC) Safety Office (45 SW/SE), Patrick AFB, FL 32925. ""pric QUALITY INSPECTED 2 3000 N. Atlantic Avenue « Cocoa Beach, Florida 32931-5029 USA Contract No. FO4703-91-C-0112 RTI Report No. RTI/5180/77-43F Task No. 10/95-77, Subtask 2.0 September 10, 1996 Modeling Unlikely Space-Booster Failures in Risk Calculations Final Report Prepared by James A. Ward, Jr. Robert M. Montgomery Research Triangle Institute Center for Aerospace Technology Launch Systems Safety Department Prepared for 45th Space Wing (AFSPC) Safety Office - 45 SW/SE Patrick AFB, FL 32925 and 30th Space Wing (AFSPC) Safety Office - 30 SW/SE Vandenberg AFB, CA 93437 Distribution authorized to US Government agencies and their contractors to protect administrative/ operational use data, 10 September 96. Other requests for this document shall be referred to the 30th Space Wing (AFSPC) Safety Office (30 SW/SE), Vandenberg AFB, CA 93437, or 45th Space Wing (AFSPC) Safety Office (45 SW/SE), Patrick AFB, FL 32925. REPORT DOCUMENTATION PAGE Form Approved 0MB No. 0704-0188 Public tel)Ort1ng burden for this collection of information is estimated to average 1 hour per response. induding the time for reviewing instructions, searching exi5ting data sources. in!,! the data needed, and completing and rev,ew,ng the collection of Information. Send comments r~ardlng tlils burden estimate or any other aspect of this gathering and maintain collection of Information, including suggestions tor reducing this burden. tO Washington Headquarters Services, Directorate or Information Operations and Reports, 1215 Jefferwn Davis Highway, Suite 1204, Arlington, VA 12202-4302, and to the Office of Management and Budget. Paperwork Reduction Project(0704-0188), Washington. DC 20503. 1. AGENCY USE ONLY (Leave blank) ~.- REPORT DATE 3. REPORT TYPE AND DATES COVERED. eptember 10, 1996 1 Final 4. TITLE AND SUBTITLE 5. FUNDING NUMBERS f.1odeling Unlikely Space-Booster Failures in Risk Galculations C: F04703-91-C-o112 6. AUTHORW - James A. ard, Jr. 7. PERFORMING ORGANIZATION NAME(S) AND ADDRESS(ES) 8. PERFORMING ORGANIZATION Research Triangle Institute * ACTA, Inc. ** REPORT NUMBER 3000 N. Atlantic Avenue · Skypark3 RTl/5180m-43F 11 23430 Hawthorne Blvd., Suite 300 Cocoa Beach, FL 32931 Torrance, CA 90505 9. SPONSORING/MONITORING AGENCY NAME(S) AND ADDRESS(ES) 10. SPONSORING/ MONITORING Department of the Air Force (AFSPC) Department of the Air Force (AFSPC) AGENCY REPORT NUMBER 30th Space Wing 45th Space Wing r\~'1~.1"
1000	2000	"-m.-t1<a-a Vandenberg AFB, CA 93437 Patrick AFB, FL 32925 - - -Mr. Martin Kinna (30 SW/SEY) Louis J. Ullian, Jr. (45 SW/SED) 11. SUPPLEMENTARY NOTES *Subcontractor "" Prime Contractor 12a. DISTRIBUTION/AVAILABILITY STATEMENT 12b. DISTRIBUTION CODE Distribution authorized to US Government agencies and their contractors to protect administrative/operational use data; 10 September 96. Other requests for this document shall be referred to the 30th Space Wing (AFSPC) Safety Office (30 SW/SE),Vandenberg AFB, CA (!__, 93437, or 45th Space Wing (AFSPC) Safety Office (45 SW/SE), Patrick AFB, FL 32925. 13. ABSTRACT (Maximum 200 words) Missile and space-vehicle performance histories contain many examples of failures that cause, or have the potential to cause, significant vehicle deviations from the intended flight line. In RTl's risk-analysis program, DAMP, such failures are referred to as Mode-5 failure responses. Although Mode--5 failure responses are much less likely to occur than those that result in impacts near the flight line, risk-analysis studies are incomplete without them. This report shows how Impacts from Mode-6 failures are modeled in program DAMP. The impact density function used for this purpose contains two shaping constants that control the rate at which the density function drops In value as the angular deviation from the flight line and the impact range increase. Certain Mode--5 -malfunctions are simulated, and the two shaping constants then chosen by trial and error so that impacts from the simulated malfunctions and the theoretical density function are in close agreement. An appendix to the report contains alisting and brief narrative failure history of the A~as, Delta, and Titan missile and space-vehicle launches from the Eastern and Western Ranges from the beginning of each program through August 1996. Each entry gives the vehicle configuration, whether the flight was asuccess, the flight phase in which any anomalous behavior occurred, and aclassification of vehicl~ behavior in accordance with defined failure-response modes. 14. SUBJECT TERMS 15. NUMBER OF PAGES· launch risk, unlikely failure modeling, booster failure probabilities 180 17. SECURITY CLASSIFICATION 18. SECURITY CLASSIFICATION 19. SECURITY CLASSIFICATION 20. LIMITATION OF ABSTRACT OF REPORT OF THIS PAGE OF ABSTRACT Unclassified lJnclassified lnclasslfled SAR NSN 7540-01-280-5500 Standard Form 298 (Rev. 2-89) Prescribed by AIIISI Std. Z39-18 298·102 Abstract Missile and space-vehicle performance histories contain many examples of failures that cause, or have the potential to cause, significant vehicle deviations from the intended flight line. In RTI's risk-analysis program, DAMP, such failures are referred to as Mode-5 failure responses. Although Mode-5 failure responses are much less likely to occur than those that result in impacts near the flight line, risk-analysis studies are - incomplete without them. This report shows how impacts from Mode-5 failures are modeled in program DAMP. The impact density function used for this purpose"
2000	3000	contains two shaping constants that control the rate at which the density function drops in value as the angular deviation from the flight line and the impact range increase. Certain Mode-5 malfunctions are simulated, and the two shaping constants then chosen by trial and error so that impacts from the simulated malfunctions and the theoretical density function are in close agreement. An appendix to the report contains a listing and brief narrative failure history of the Atlas, Delta, and Titan missile and space-vehicle launches from the Eastern and Western Ranges from the beginning of each program through August 1996. Each entry gives the vehicle configuration, whether the flight was a success, the flight phase in which any anomalous behavior occurred, and a classification of vehicle behavior in accordance with defined failure-response modes. Various filtering or data weighting techniques are described. The empirical data are then filtered to estimate (1) failure probabilities for Atlas, Delta, and Titan, and (2) percentages of future failures that will result in Mode-5 (and other Mode) responses. Appendix A. Failure Response Modes in Program DAMP........sessesesessseccasssaceavecsenasessnsnes 2D Appendix B. Shaping-Constant Effects on Mode-5 Impact Distributions...81 Appendix C. Filter Characteristics PEEEAREE TEN DREN HHHSE RPRHEV EHR EOEE ANGER ESES EER ESREROERELEREHTUSEERHESERSPOMERSO ESHER OED 90 Appendix D. Launch and Performance Histories Le ddRHEREEECERERHEHEEOTHHEDTEEREREERERERYMOREREOTH OR RR aRE 96 D.1 Basic Data Seow eseanHOCORPES GR EREHTAS HSER DWOCHOKEERERASES RET E EEEFRASER EOE EEARERHARERORHERECEEERE ETEHECHT EOHD ERE DEDat 96 D.1.1 Data Sources PEERS EREPE SH ESERESFEESCERO SSS PE HAE HERE VEE EA EET ER EDRERDSRRORESTSPESAEESTEERPEMEP RARE KOEESELAR ATE DRT 96 D.1.2 Assignment of Failure-Response Mode......:sosssessereeeeesesaneeseaseneessseressvere 98 D.1.3 Assignment of Flight Phase...........ss+soneteneonsesensenssseneneesecerseneneneeonsnentasene 98 D.1.4 Representative Configurations......cssecesesesenatsenesresseacnerenesseeseseusteseacees 100 D.2 Atlas Launch and Performance History...........ss008sesneeensssseacersanssesseeeeesseaesenees 101 D.2.1 Atlas Launch HIStory...SeeeetenuaunPOT ERE EDERAL ASR EREHOERHR HERE RRA REDEHRESHSE CHORES KEHRERSEeeee 103 D.2.2 Atlas Failure Narratives aecasesucsscevanovecnsoreraeRESET ESCRATATOREEH OEDAHHHESETERTFTATEFADEHE RH HH EHH TE 115 D,3 Delta Launch and Performance History........:ssscscsssseesecensnersrsseesensseeeeesssaeseees 133 D.3.1 Delta Launch History...seaneateaceesenssseresessecseesenseenesanstsevessursenenenss 136 D.3.2 Delta Failure Narratives..........seeseneseseseceeseessecaesessasssnsesaveneseeesseessusveasenenees... 142 D.4 Titan Launch and Performance History...........00seatasseneeeuessesevanessenenansesseseesees 146 D.4.1 Titan Launch History.........ccsessssessesssssssesenssessenseseseeessesevesesssvesceesstenssvsees 149 D.4.2 Titan Failure Narratives.........0s00sessenseseseenorenessesevacunsasusveesoreorsaensacseenecaenss 157 D.5 Thor Launch and Performance History (Not Including Delta) 0... 164 D.5.1 Thor and Thor-Boosted Launch History..........seaseseenenereoeessesesscesevensceneswere 164 D.5.2 Thor and Thor-Boosted Failure Narratives [REESE SESE EES SES SYMAHESH EHETTERPESHHRERERTEHHDE 167 References.SHRERRHE EDHERE RARE ROR EHSOE EREDSEOCOHOMEREREREREEESERREAEEERGDRERDE DE ORDHOTPESFEH ER NSCHEROH EHSSURFERS ERA DANE DCeo eaened 171 pene fom pete Table of Figures Figure 1. Joust Impact Trace Showing a Mode-5 Failure Response....................................6 2. Atlas IIAS Risk Contours for Inner-Ear Injury with A = 3.0.............................. 11 Figure Figure 3. Atlas IIAS Risk Contours for Inner-Ear Injury with A = 3.5.............................. 12 Figure 4. Filter Factor Results for Representative Configurations of Atlas...................... 23 Figure 5. Combined Random-Attitude and Slow-Tum Results........................................
3000	4000	36 Figure 6. Atlas IIAS Breakup Percentages for Random-Attitude Tums........................... 37 Figure 7. Atlas HAS Impacts with No Breakup........................................................~........ 39 Figure 8. Atlas IIAS Impacts with Breakup......................................................................... 40 Figure 9. Atlas IIAS Simulation Results with B = 1,000..................................................... 42 Figure 10. Atlas IIAS Simulation Results with B = 50,000.................................................. 44 Figure 11. Atlas HAS Simulation Results with B = 100,000................................................ 45 Figure 12. Atlas HAS Simulation Results with B = 500,000................................................ 46 Figure 13. Atlas HAS Simulation·Results with B = 5,000,000.............................................47 Figure 14. Effects of Breakup q-alpha on A for Atlas IIAS................................................ 49 Figure 15. Mode-5 Density-Function Values at Three Miles............................................. 51 Figure 16. Atlas IIAS Mode-5 Ship-Hit Contours with A= 3.00....................................... 53 Figure 17. Atlas IIAS All-Mode Ship-Hit Contours with A = 3.00.................................... 54 Figure 18. Atlas IIAS Mode-5 Ship-Hit Contours with A= 3.45.......................................55 Figure 19. Atlas IIAS All-Mode Ship-Hit Contours with A= 3.45.................................... 56 Figure 20. Atlas IIAS Mode-5 Ship-Hit Contours with A = 6.30....................................... 57 Figure 21. Atlas IIAS All-Mode Ship-Hit Contours with A = 6.30.................................... 58 Figure 22. Impact-Range Distributions.................................................................................. 59 Figure 23. Delta-GEM Breakup· Percentages....................................................................... 61 Figure 24. Delta-GEM Simulation Results with B ==-1,000.................................................. 62 Figure 25. Delta-GEM Simulation Results with Best-Fit Shaping Constants................... 63 Figure 26. Titctn·IV Breakup Percentages................................................................................ 65 Figure 27. Titan·Simulation Results with B = 1,000............................................................ 66 Figure 28. Titan Simulation Results with Best-Fit Shaping Constants.............................. 67 Figure 30. LLVl Simulation Results with B = l,000............................................................ 70 9/10/96 iv RTI Figure 31. LLVl Simulation Results with Best-Fit Shaping Constants............................. 71 Figure 32. £-Ratios for Ranges from 1 to 25 Miles.............................................................. 86 Figure 33. Percentage of Impacts Between Flight Line and Any Radial.......................... 87 Figure 34. Percentage of Impacts in 5-Degree Sectors........................................................ 88 Figure 35. Exponential Weights for Fading-Memory Filters............................................. 93 Figure 36. Recursive Filter Factor for Last Data Point........................................................ 94 Table of Tables Table 1. Effects of Mode-5 Shaping Constant A on Atlas IIA Risks.................................. 10 Table 2. Predicted Failure Probabilities for Representative Configurations.................... 17 Table 3. Predicted Failure Probabilities for All Configurations........................................ 18 Table 4. Comparison of Weighting Percentages................................................................. 19 Table 5. Filter Factor Influence on Weighting Percentages................................................ 21 Table 6. Failure Probabilities for Atlas, Delta, and Titan................................................... 24 Table 7. Number of Atlas Failures - All Configurations (532 Flights).............................. 25 Table 8. Number of Delta Failures-All Configurations (232 Flights).............................. 25 Table 9. Number of Titan Failures - All Configurations (337 Flights).............................. 25 Table 10. Number of Eastern-Range Thor Failures (85 Flights)........................................ 25 Table 11. Number of Failures for All Vehicles (1186 Flights)............................................ 26 Table 12. Date of Most Recent Failure................................................................................. 26 Table 13. Percentage Weighting for Sample of 1186 Launches......................................... 27 Table 14. Response-Mode Occurrence Percentages............................................................ 27 Table 15. Recommended Response-Mode Percentages for Flight Phases O -2................ 28 Table 16.
4000	5000	Recommended Response-Mode Percentages for Flight Phases O - 1................ 29 Table 17. Absolute Failure Probabilities for Response Modes 1 -5.................................. 29 Table 18. Percent of Response Modes 3 and 4 That Tumble.............................................. 30 9/10/96 V Table 19. Sample Impact Distribution for Atlas TAS with No Breakup.........sssssssseeees 41 Table 20. Shaping Constants for Atlas ITAS.........ccscssssssseseecesssesesesssssaescsssseecsecsessssasssanenees 48 Table 21. Shaping Constants and Related Risks for Atlas TITAS.......ssssssessssnssseseesserensesees 50 Table 22. Best-Fit Conditions for Atlas IAS... sssssssssssssssesssesssssssesssscenersessesesensnsoseens 52 Table 23. Shaping Constants and Related Risks for Delta-GEM.........cscssssssssssesesssessesesees 64 Table 24. Shaping Constants for Titan IV........csssssssssssssssssseseeeccessssstsessesessescecscvesseeeneesserens 68 Table 25. Shaping Constants for LLV1........ssssssessssssessscessscssesesssesesssssesessesecceseesenseeseesenees 72 Table 26. Summary of A Values for B = 1,000.0... sssecssseescsssseseesscesecsaseesersesseessseseeeees 72 Table 27. Failure Probabilities for Atlas, Delta, and Titani..........cccccscscssssssssessssssscssesssevsees 75 Table 28. Recommended Response-Mode Percentages for Flight Phases 0 -2............000+ 75° Table 29. Recommended Response-Mode Percentages for Flight Phases 0 - 1............04 75 Table 30. Absolute Failure Probabilities for Response Modes 1-5......cssssssssesesseneeneees 76 Table 31. Summary of A Values for B = 1,000..........ssccscssssessssesssstsessscessccerseressessserseseeswa Z7 Table 32. Summary of Optimum Mode-5 Shaping Comnstant......cscsssssscessseseeessscessesees 77 Table 33. Effect on f-Ratio of Varying Mode-5 Constant A (B = 1000) - Part 1......ssssese 82 Table 34. Effect on f-Ratio of Varying Mode-5 Constant A (B = 1000) - Part 2.........+ 83 Table 35. Effect on f-Ratio of Varying Mode-5 Constant B (A = 3) - Part Loess 84 Table 36. Effect on f-Ratio of Varying Mode-5 Constant B (A = 3) - Part 2....sssssssscesseees 85 Table 37. Filter Application for Failure Probability...........ccscscssessesssssssessseeeetseenensensenes 95 Table 38. Flight-Phase Definitions...........cssssscssssssecsessneersessssssssssssssensessssssssesessssssesseesesenss 99 Table 39. Flight Phases by Launch Vehicle...........ssssssssssssscscesssssssesecsscsesenssesesssesesseceseers 99 Table 40. Summary of Atlas Vehicle Configurations......cccsscssssesescssssesssesessssssesseesens 101 Table 41. Atlas Launch History.0.....ccsescssssssesssssessessssssssssssssesessesssessessssessscesssenssenssseesenees 103 Table 42. Summary of Delta Vehicle Configurations..........cccssssssssssesescsssserscesseeneeee 133 Table 43. Delta Launch History....ccssscsssssesecesssessesssessesssnssssssesssessessssssensseeseenseeeeceesaes 136 Table 44. Summary of Titan Vehicle Configurations.......ccsssssssssesssssersccsssesssasesstsnseenes 147 | Table 45. Titan Launch History.......ccscccsssessesssscesssecsseesssssssassccsnsssseseassseessseeesenssssessseseesees 149 Table 46. Thor Launch History... ccssssssssesssssssseessssssssssssesessssscscssssassseesesenereesseseeesseees 165 9/10/96 vi RTI 1. Introduction The debris from most launch vehicles that fail catastrophically tend to impact close to the intended flight line. Typical failures that produce such results are premature thrust termination, stage ignition failure, tank rupture or explosion, or rapid out-of-control tumble. Less likely malfunctions may cause a vehicle to execute a sustained turn away from the flight line. Examples are control failures that cause the rocket engine to lock in a fixed position near null, or failures leading to erroneous orientation of the guidance platform. Such failures should not be ignored, since they may produce nearly all or a significant part of the risks to population centers that are more than a mile or so uprange or RTI has been tasked to estimate the many miles away from the flight line. Consequently, probabilities
5000	6000	"of occurrence of these less-likely failures, and to determine optimum values for the shaping constants of the associated impact-density function RTI has developed a prototype risk-analysis program (1) to analyze the level of risk in the launch area when ballistic missiles and space vehicles are launched, and (2) to provide guidelines for launch operations and launch-area risk management. This program, ""facility DAMage and Personnel injury"" (DAMP), uses information about the launch vehicle, its in the launch area to estimate trajectory and failure responses, and facilities and populations hit probabilities and casualty expectations. When a missile or space vehicle malfunctions, people and facilities may be subjected to significant risks from falling inert debris, or from overpressures and secondary debris produced by a stage, component, or large propellant chunk that explodes on impact. Although fire, toxic materials, and radiation may also subject personnel to significant danger, these hazards are not addressed in program DAMP. Hazards are greatest in the launch area and along the intended flight line, but lesser hazards exist throughout the area inside the impact limit lines. Small hazards exist even outside these lines if the flight termination system fails or other unlikely events occur. In computing launch-area risks, DAMP makes no attempt to model vehicle failures per se. A list of possible failures for any vehicle would be extensive, and variations in failures from vehicle to vehicle would complicate the modeling process. Instead, DAMP models failure responses. Regardless of the exact nature of the failures that can occur, there are only six possible response modes that affect risks on the ground, five for failure responses, and one to model the behavior of a normal vehicle. The six modes are described in Appendix A. It can be seen from the descriptions that impacts resulting from failure-response Modes 1, 2, and 3 occur at most a mile or two from the launch point, while those from Mode 4 can only occur near the flight line, even though the vehicle may tumble before breakup or destruct. Although the hazards outside the launch area and away from the flight line may be small, vehicle flight tests through the years have demonstrated that finite hazards do exist in these areas. Such hazards are due almost entirely to Mode-5 failure responses, even through the probability of a Mode-5 failure may be only a small part of the total failure probability. The Mode-5 failure-response, theoretical though it is, was developed to reflect the facts that: (1) unlikely vehicle failures 9/10/96 1 RTI can cause impacts uprange or well away from the intended flight line, and (2) some vehicle failures cannot logically be classified as Response Modes 1, 2, 3, or 4. In-keeping with the above, the"
6000	7000	"Mode-5 impact-density function was developed with the characteristics listed below. The function, which fills the void left by Modes 1 through 4, is sufficiently robust to include all possible impacts, yet seemingly comports with observed test results. (1) Impacts can occur in any direction from the launch point and at any range within the vehicle's energy capabilities. (2) At any given impact range from the launch point, the likelihood of impact decreases as the angular deviation from the flight line increases, becoming least. likely in the uprange direction. For any fixed angular deviation from the flight line, the likelihood of impact decreases as the impact range increases. (3) At fixed impact ranges near the launch point, the impact density function changes gradually as the impact direction swings 180° from downrange to uprange. As the impact range increases, the decrease in the density function becomes progressively more and more rapid with change in impact direction. In other words, the greater the impact range, the more rapidly the density function changes with angular deviation from the flight line. - As modeled in DAMP, the effects of destruct action on the Mode-5 density function are accounted for in the launch area by supplementing impacts inside the impact limit lines with those that would occur outside the impact limit lines if no destruct action were taken. The Mode-5 failure-response methodology was fully developed in an earlier RTI report11 As pointed ·out there, the shape of the impact density function can be controlled somewhat through the selection of shaping constants that appear in the defining equation Intuition suggests that the constants should be vehicle dependent, since (1) ruggedly built missiles would, after a malfunction, be more likely to impact well away from the flight line than would a fragile space vehicle that tends to break up before deviating significantly; and.(2) certain vehicles, after a malfunction, tend to stabilize and - continue thrusting at large angles of attack, while other vehicles that experience similar malfunctions tend to tumble. DAMP for targets located more than two miles or Hit probabilities computed by-program so uprange from the pad or more than a few miles from the flight line, are due almost entirely to the Mode-5 impact-density function Thus, the assumed probability of occurrence of a Mode-5 response as well as the selected Mode-5 constants are of considerable importance. The tasking for this. study is set _forth as Task No. 10/95-77, Paragraph 2.0, of Contract FO4703-91-C-0112. The primary purpose of the tasking is: ""Perform a study to determine the best values for Mode-5 failure probability and the Mode-5 densityfunction shaping constant A."" Although not explicitly included in the statement of work, the study also develops absolute failure probabilities for"
