start	end	text
0	1000	"Subject Passat We took Eile Wu mbes ___ bd - £3£ 74 al ""of { "" d -. ° DEPARTMENT OF THE AIR RCo ly) a A- ( _ WASHINGTON, D.C. 20330: FEDERAL GOVESNMENT 14 JAN G7 por Dear Mr. Malmfeldt: This office recently received a public inquiry regarding UFOs, referred to us from the Bukeau. As the inclosed fact sheet indicates, the Ai Project Blue Book"" investigation of UFOs was terminated on cember 17, 1969, and all related documentation was turned o to the National Archives and Records Service, The inquirer referred to us has been apprised of these events. Hopefully, the inclosed fact sheet will be of help in responding to any future inquiries on this Subject. H. A. McCLANAHAN, Lt Col, USAF Chief, Civil Branch Cormunity Relations Division Office of Information Attachment * &7¢ Federal Bureau of Investigation wer FBT Attention: Mr, Malmfeldt, Room 7825 Washington, D. C. 20535 REC-26 we OK- 2359 S- 183 UFO FACT SHEET On December 17, 1969 the Secretary of the Air Force announced the termination of Project Blue Book, the Air Force program for the investigation of UFOs. The decision to discontinue UFO investigations was based on an evaluation of a report prepared by the University of Colorado entitled, ""Scientific Study of Unidentified Flying Objects;"" a review of the University of Colorado&#39;s report by the National Academy of Sciences; past UFO studies; and Air Force experience investigating UFO reports during the past two-decades.. As a result of these investigations and studies, and experience gained from investigating UFO reports since 1948, the conclusions of Project Blue Book are: l! no UFO reported, investigated, and evaluated by the Air Force has ever given any indication of threat to our national security; ! there gs. has been no evidence submitted to or discovered by the Air 92 Force that sightings categorized as ""unidentified"" represent technological developments or principles beyond the range of present day scientific knowledge; and ! there has been no evidence indicating that sightings categorized as ""unidentified ¬L! are extraterrestrial vehicles. with the termination of Project Blue Book, the Air Force regulation establishing and controlling the program for investigating and analyzing UFOs was rescinded. All documentation regarding the former Blue Book investigation has been permanently transferred to the Modern Military Branch, National 1 Archives and Records Service, 8th and Pennsylvania Avenue, Washington, D.C. 20408, and is available for public review 5 and analysis. Attached for your information is the Project Blue Book sighting summary for the period 1947-1969. Also included is a listing of UFO-related materials currently available. Since the termination of Project Blue Book, no evidence "".1 has been presented to indicate that further investigation of UFOs by the Air Force"
1000	2000	"is warranted. In view of the considerable Air Force commitment of resources in the past, and the I extreme pressure on Air Force funds at this time, there is no likelihood of renewed Air Force involvement in this area. *2 T 9PT 696T € SLE 896T __ 6T LEG LO6T 5 Ze ZTU'T 996T me 9T £88 S96T. 6T Z9S p96T rT 66£ €96T f ST PLE Z96T ET. TéS T96T oT LSS 096T ZT O6E 6S6T OT Lz9 8S6T tA! 900'T LS6T OT 0L9 - -9S6T vz «Ses SS6T OF L8y PS6T Zp 60S ESET EOE Tos'T ZS6T i ZZ 69T TS6T. ot Lz TZ OS6T - 98T 6P6T L 9ST 8h 6T z ZZT LY6T Qa Td ILNAGINnA SONILHSIS IWLOL UWaA 696T - LP6T ""SONILHOIS O4N TWLOL. ') ' "" am |; ':,, UFO MATERIALS Scientific Study of Unidentified Flying Objects. Study conducted by the University of Colorado under contract F44620-76-C-0035. Three volumes, 1,465 p. 68 plates. Photoduplicated hard copies of the official report may be ordered for $6 per volume, $18 the set of three, as AD 680:975, AD 680:976, and AD 680:977, from the National Technical Information Service, U.S. Department of Commerce, Springfield, VA 22151. Review of University of Colorado Report on Unidentified Flying objects. Review of report by a panel of the National Academy of Sciences. National Academy of Sciences, 1969, 6p. Photoduplicated hard copies may be ordered for $3 as AD 688:541 from the National Technical Information Service, U.S. Department of Commerce, Springfield, VA 22151. bo,. | »}., ~ i There are a number of universities and professional scientific organizations such as the American Association for the Advancement of Science, which have considered UFO phenomena during periodic meetings and seminars, In addition, a list of private organizations interested in aerial phenomena may be found in Gale's Encyclopedia of Associations (Edition 8,. Vol I, pp. 432-3). Such timely review of the situation by private groups insures that sound evidence will not be overlooked by the scientific community. FEDERAL G9 January 24, 1977 Lieutenant Colonel H. A.\McClanahan, USAP Community Relations Division 7 ""Urfice o ""Information - Departuens.. of the Afr Force ae, Kes arcane غا to Mr. Maimfeldt has brought your letter of January 14th, with enclosure, to my attention. I join him in thanking you for sendina us a copy of your UFO Fact Sheet and for apprising us of the termination of your project. Sincerely yours,. / b7< onald W, Moore, Jr. ""\4 Assistant Director External Affairs Division 8 2-5 BLY SY REC-26 @2Z JAN 27% 1977 eee Ce Assoc. Die. Bep. AD Ada, Dep. AD tav. Ascot. Dlv.: MAILED 10 Adm, Serv, SS [iter fg ea ey +e Ident Se | - L7e"
2000	3000	"on Ay g Labererery ___. - 4! PELETYPE UNIT (J is Lega! Caun, ¢ GPO: 1976 % Pian. & Evel. _. Spec. Inv. ry Training <- ""bane Rm. ""MAIL M The NEW | PROJECT BLUE -BOOK SB7c can 0 O - Off. Lisisen & int. Affe. $SFn3ne and name-approved, by the United States Air Force. aad 'elephons hm. a tember 12, 198 } P 9 1989 b7 - William S, Sessions Director Federal Bureau of Investigations U.S. Department of JUSC ICE WS - sme ren sey Washington, D.C. 20535 ooo Dear Mr. Sessions: (7S poun letter of Ceptember 1 has been received, and I am very (appreciative of hearing from you. Your letter presented information that I had already mentioned to you, in my letter of July 24; so this was information I knew. I had given this to you as ""advance"" information - that you would probably receive from other Government agencies, and departments, and which is the standard release material. Again, the new Project Blue Book is a civilian continuation of the original Froject Blue Book, which did close in 1969. Here, twentyyears later, some of the same original Blue Book, Pentagon, and other persons are, still, looking for the real answer to the UFO phenomenon. That is the reason, tco, I gave you the information I did - about J. Edgar Hoover, President Carter, Senator Barry oe. may Tay Goldwater, etc. I was hoping to go ""deeper"" into the intelligence- 3 gathering agencies -which received some of t e ""bettern ie reports YJ. which never did go to Project Blue Fook. 3- Q A 377 x ~1O) I hve been to the National Archives, and have looked at Some &f the original Blue Book material that is there....I met with persons at NASA's headquarters, in Washington, following their receipt of the request fran President Carter....I met with President Carter's chief Seientific Advisor's personnel, at the New Executive Offices of the President....I sent reports to the original Project Blue ook, and know some of it's former personnel, etc. So, I know the whole scheme of things, pertaining to UFO's - except for the hidden Intelligence~ gathering agency participation with regard to the better UFO sighting reports, and whichare, to this date, real, hard anegns's Your response is appreciated and please accept my very best wishes. Sincerely, No acl bie Lvarianwk & = Ree eek /-: Inspired, and name-approved, by the United States Air Force. mA W. pr-aeee | Telechens A July 24, 1989 jm awe an Sakuemtes gس | ' Oprentisaoen + Now oho a Director's C2: Mr. William S, Sessions, Director U..5. Department of Justice Federal Bureau. of Investigations Washington, D.C. 20535 سمة Dear Mr. Sessicns: 'You"
3000	4000	"may recall that, while you were in Fort Smith visiting your sath¢r called and, briefly, mentioned a esire to mee W you* and to discuss.the phenemenon. of 4 in general, and the role of U. S. Government participation, in particular. I said Spat I wished to issue a ""challenge"" to you (not that you do not"" challenges ona daily basis) pertaining to UFO's. You Stated that you were interested, and to write you - and whith I am now doing. Imuld write ""pages"" on the matter, but rather than to do so - it will be lengthy enough for me to endeavor to give you information I wish to convey in this letter. In any event, the U.-S. Government has played important roles in the evaluation of UFO reported sightings. The new Project Blue Book is a ""continuation"" of the original Project Blue Book, established by the Air Force, and was located at Wright-Patterson Air Force Base, Dayton, Ohio. Some of the most important sighting ""announcements"" came from the Air Force, and which were, later, Stated to be sanething not in the original announcements - in a cover-up of the initial announcement. This repeatedly happened much to the chagrin of the Air Force. Original members of the Project Blue Book found that many reports never were received by this group, but went to intelligence-gathering agencies. 7190 'While Director of the F.B.I., Mr. J. Edgar Hosgse Pshose personnel (reported some of the sightings themselves and who were, otherwise, ' brought in to some of the cases) repeatedly asked the Air Force ' for complete information about the UFO's - to no avail. They (the 'Air Force) would not release certain case reports to Mr. Hoover. Even with the present F.0.I., mostly sanitized version/copies are received and with information requested completely blocked-out. o3 -O ""AD | Lie ""@ ee (dtd. 9/1184) b7C_ aii. ra . Mp, William Ses. ng - PBI. - 2 ""While Chairman of the Senate Committee on Science, Senator Barry Goldwater asked for information and was told that he was not on a ""need to know"" basis, This request, of Goldwater, had to do with an initial announcement from the Air Force that a ""saucer"" had crashed and that dlien bodies were (at tit point in time) located ina hanger, or other building, at Wright-Patterson Air Force Base, at Dayton, Ojo. Senator Goldwater was refused any information in this matter, along wit not being allowed to personally look inside of the alleged tuilding. Before taking office as President, Jimmy Carter announced to the public that, if elected, he would give the American people the Government's information about UFO's, This did not happen, and Mr. Carter was given a complete"
4000	5000	"run-around - and I could tell you more about this, because I was contacted by the Pentagon on the matter. 'The new Project Blue Book has 148 present, and/or former, Air Force, NC 'NASA, and intelligence-gathering agency personnel, among others, acting as advisor-consultants to PBB - anonymously. These are persons who, fo the most part, have/had been actively engaged in earlier UFO reports fo their respective agencies, and who are still muchly interested. So, with this brief back-ground of information about me and about Gover ment participatim, the ""challenge"" I have mentioned - would be to have you make inquiries at the highest levels of ""officialdom""TM about what ou Government really knows, whether or not there ARE alien bodies located ANYWHERE, what happened to the crashed ""flying saucers"", where are the photo's taken by Air Force personnel through on-board gun cameras, and Similar questioning. I am positive you would find that even you would be getting a general run-around and could not receive satisfactory answ to the above. I think you will/would find that you are not receiving all the information you should be receiving and which should be very evident to you after making several inquiries. You may tend to drop th 'matter, thinking you are receiving answers to your questions, but this will not be the case, Iassure you. 0 s &#39; /1 MI. A&#39;1{ &#39; FQBQIQ  3 I-Lr. Sessions, I will not take more of your time in this matter, but, if you are interested, I would appreciate your looking into the matter. You may wish to appoint one of our office; personnel to start making inquiry about UFO &#39;s, in general, and see which Agencies to which you would be directed. Keep in mind, however, that some present office personnel, in the other agencies, may not know what you would be inquiring about - and will tell you that the Air Force Project Blue Book closed it&#39;s ""doors"" in 1969, and that the Air Force no longer investigqtes UFO Sightini reports - this I already know. The important key is to go beyond the ir Force and into the other agencies; such as the Office of Defense, C.I.A., etc. President Bush, when asked about UFO&#39;s, told the gerson askirg ""You do not know the half of it"". As ym know, President ush was formerly with the C.I.A@ His comments are on tape, by the way.. Well, I think this should suffice for this time. I appreciate your patience in reading this letter, and should you desire any additional infonnation, please do not hesitate to let me know. I would like, ver; much, to work through you, and with you, to endeavor to bring the matte"
5000	6000	"of UFO&#39;s to a conclusion - if that conclusion is an honest one. I hope you had a nice visit,with your Dad, and c ome back for a visit again, soon. Very sincerely, P.S. As sort of an ""ultimate"" challenge - why not ask President Bush, himself? /""Wired. and amg-3 Unlled sum 4353111 by the SEP 4 1988 I have received your July 24th letter in which you ask for my help in secur information relative to investigations of unidentified flying object (UFO) sightings. I have discussed your request with my colleagues, and I would first like to explain that the investigation of UFOs is not now nor has it ever been the responsibility of the FBI. The Department of the Air Force conducted investigations and studies of UFO reports from 1947 to 1969. On December 17, 1969, the Secretary of the Air Force announced the termination of ""Project Blue Book,"" and the Air Force has furnished all documents regarding its investigations of UFOs to the Modern Military Branch, National Archives and Records Administration, Eighttr Street and Pennsylvania Avenue, N.W., Washington, D.C. 20408. I understan@ this data is available for public review and analysis. You may wish to make an inquiry of the Modern Military Branch for the answers to some of your questions. Also of possible interest, the National Aeronautics and Space Administration was asked by President Carter to look into the possibility of resuming UFO estigations in 1977. After studying all the facts available, it decided that nothing would be gained by further investigation, and the Department of the ~. Air Force agreed with that decision... You may also want to check with the National Aeronautics and Space Administration in connection with your research.,, » 3- 0-2/7 « on I am not aware of any Federal agency tasked with the > a responsibility of investigating UFOs and hope this information ay gill be of help to you and your organization. < i Sincerely yours, eres AD Adm, -_. - William S. Sessions Exec AD 123 - Anet Ole: William S. Sessions eae ae Director ne 1 - Little Rock ~ Encl 3-0 va n - ock ~ Enclosure _ as |: we 5042, TL 233) | i Coun. -. on cme \g hI Public Alfs. Ree. Mgnt 6) SEE NOTE PAGE TWO Tech. Serve. Training Off. Liaison & Int, Affe, Telephone Am. __ Virectar's Sec*y 1. ROOM (""J ay... NOTE; iho 'now identifiable in Bufiles,. DE nnn gE appears to bea brief bic', phone conversation he had with the Director while the Director, was visiting his father in Fort Smith. He says he wants to discuss UFOsand the role. of U.S. Government participation in particular, and he indicates"
6000	7000	"the Director sia د п غاoءgo oوσгبيةะपבيدooمة д ove r) a t He asks e Dire 'e ea we _ make Tt eas au. '3 ore gest levels of Government~-about what our Government really knows about' UFOs, whether or not there are alien-bodies located anywhere, what happened ta the crashed ""flying saucers,"" where are the photos taken by Air Force personnel through ongun c as and similar questioning. Above response reviewed by ssh QUE Violent Crimes Unit, CID. Substance of paragraphs 2 and 3 of response previously provided to other inquiries on the investigation of UFOs. Sens. Off. of Cong. ""pee oun trey. & Pts AMS. ee. tt 3 ae OM sofia Sis aby Siractoe ETE IT GT. ee ee *!; ""42C ALRAtM ol. ot tnt, -_- Foe higmt. a ge lactis ERECT a ae a a fsqn Suva. -ae - 2 = b7&"
