start	end	text
4492280	4498580	naive to think that everything would be written down well i've also seen his diaries which are now
4498580	4504980	in a safe place and they're backed up so don't mess with them and i have seen a lot of meetings
4504980	4511560	between harold malmgren and richard bissell oh wow in the diary richard bissell who founded area 51
4511560	4518540	mayor of area 51 and it was key to harold malmgren's claims that he was read into the existence of the
4518540	4524600	legacy uap retrieval program by richard bissell there you go yeah so who went on to become a deputy
4524600	4530520	director of the cia that's right he went on to become the number two at the cia so fascinating
4530520	4536380	what you know along the lines of what we were talking about earlier you've probably met more
4536380	4542220	people in and around these programs than anybody else alive in the from the outside please don't
4542220	4549960	say that too loudly you know it's funny when i came through on the weekend to come here um i was
4549960	4555100	actually nervous i've never been nervous coming into the u.s before but there's been a lot of
4555100	4561440	stories in the australian press about young people who were just turned away by border protection for
4561440	4566860	no good reason and harassed for no good reason and there's been a change of culture at the border
4566860	4575520	and uh i have to admit i had my computer on auto delete if it was opened yeah uh wow when i came
4575520	4582820	through customs wow and um i was ready to go live on national television if i was detained by border
4582820	4588340	protection wow which actually happened to me after i did the grush story really yeah i did the grush
4588340	4595820	story i was detained and held by cbp oh my god and um a mutual friend of ours made some inquiries and
4595820	4602600	confirmed that there'd been some kind of a flag put on my um on my file and unfortunately it was so
4602600	4608700	high level they couldn't access it but basically somebody i suspect from the agency had flagged we
4608700	4614540	want to know when cool tart comes through next and let's cause them some mischief and i have to admit
4614540	4621160	i um we have a euphemism in australia tearing somebody a new asshole i i just wasn't going to put
4621160	4628000	up with it and i i very i summoned my anger and basically yelled at border protection and said
4628000	4635120	i strongly advise that you get on the phone whoever it is that's flagged me contact them now
4635120	4641660	or tell them i will be going live on television in about 10 minutes to talk about the fact that i'm
4641660	4646700	being illegally held i have a valid visa you have no good reason to hold me if you want to fight you
4646700	4653160	can have one and i was let out good for you man well i think you're hopefully you're protected and
4653160	4657780	you're protected by the by the public because i think well it's funny i look i must confess i've
4657780	4663360	been quite humbled coming to where we are which is everybody here knows who you are i've been mobbed
4663360	4668600	yeah i believe it and and it's funny my my wife and children think it's hilarious that there is this
4668600	4675480	fandom uh there's even a guy god bless him in germany who's done a three-dimensional model of me
4675480	4680160	with far too much hair which is quite flattering it doesn't show the gut and it doesn't show the lack
4680160	4685000	of hair and um my wife and children just wanted to know whether it had a bobblehead like this so we
4685000	4691160	could stick it on the front of the car oh my god that's amazing that's hilarious but you know i'm
4691160	4696780	really touched by the fact that people care about this issue and and just to make it serious for a
4696780	4707760	moment um the issue is still ridiculed in much of the british style english language australasian press
4707760	4712600	you know i get mocked and ridiculed by my journalist colleagues because i take ufos seriously
4712600	4719180	you know and people will pejoratively sneer how's your ufo obsession ross or there's actually a national
4719180	4728120	broadcaster the abc in australia and one pompous twat on that broadcaster said oh ross cools out he's
4728120	4736400	been investigating ufos he's either completely crazy or he's the best journalist ever that's the best
4736400	4741920	but it was a snide it was deliberately snide because the clear inference was i was you can't
4741920	4746860	be the best i was a shithouse journalist and i was obviously going crazy but the thing i'm really
4746860	4756840	heartened by is the degree of interest that sparked me getting hired by news nation is incredible when
4756840	4762560	we did the david grush interview news nation admittedly not at the time a very high rating
4762560	4771340	news chat no you brought it on the map it escalated its ratings by 990 percent that was written up in
4771340	4777140	the industry press it's amazing and they still say to me that ufos ufos is the issue that saved the
4777140	4783420	network yeah and it's a really interesting issue because the audience no matter what the mainstream
4783420	4788820	media do to ignore this issue you know you've got the doctrinaire attitude of the new york times
4788820	4794540	we're not going to do ufo stories we're going to reject the david grush story you know the the jake
4794540	4799500	the jake barber story wouldn't fly in any of the national media sure i don't think it's had a
4799500	4806660	coverage anywhere i don't think it's had a coverage um yes and yet the public they make it clear they
4806660	4812600	really want this story that's right and they can smell another journalistic euphemism i'll give you
4812600	4820600	they can smell a smelly turd when they smell one and this story stinks to high heaven yeah and they
4820600	4828900	can smell bullshit and what fascinates me is particularly the younger generation i'm amazed
4828900	4835240	i've never had a story i've always been the kind of old fart of journalism you know and doing
4835240	4839460	investigative stories that not many people are really that interested in but they matter because
4839460	4845260	they're sort of interesting points of principle this one really captures the imagination of the
4845260	4851660	millennials and the x generation it's amplifying what i do on news nation and i don't know how to
4851660	4856820	use instagram or tiktok but there are kids that are making a living out of repackaging my stories
4856820	4861660	on instagram and tiktok and my daughters are constantly coming to me saying dad have a look at
4861660	4866600	this this guy's making a fortune over doing your stories on tiktok and i go look i don't know how to do it
4866600	4871520	i haven't got time to do it good luck to them you know it's great but what it's done is it's
4871520	4879100	generated this massive audience and i'm not trying not to sound boastful but you know we're routinely
4879100	4885100	getting millions of views for stories that frankly i'm genuinely surprised and excited and interested
4885100	4890460	that people are watching them well you're doing an amazing job and just a recent one which i i was
4890460	4897000	watching in preparation for this and i i was so fascinated by is you were um in sedona arizona
4897000	4904540	oh yeah and it was like if you watch watch this video it is the most mind-blowing video
4904540	4910320	let me tell you let me tell you i am in no doubt whatsoever jesse that there is a deep underground
4910320	4916800	military bunker that was built in the 1950s under secret mountain that's what it's called it's the
4916800	4922180	hilarious thing it's named secret joke it's called secret mountain unbelievable near sedona it's within
4922180	4929400	five seven kilometers of sedona and more importantly there's a place called secret canyon where there's
4929400	4934900	allegedly a portal some kind of interdimensional portal and i thought all of this was just crazy
4934900	4943360	nonsense but there are incredibly brave and super super interesting people jeremiah horstman and his
4943360	4951140	wife alexandra particularly who live in sedona and they've been doing some really clever on the ground
4951140	4957940	research and one of the things we did a lot of the stuff we got as so often happens you can't put it in
4957940	4963640	the story because you can't get these people to go on camera but there was a number of people who
4963640	4971380	would privately admit that they'd been walking in what is public land public parkland and they'd be
4971380	4977660	stopped by men with guns men in uniform with with automatic weapons clearly highly trained elite
4977660	4982820	soldiers probably tier one operatives from the way they moved and they would basically order people
4982820	4991280	go away or we will kill you no no mucking around and there are sightings numerous sightings of what we
4991280	4998600	saw i saw it with my own eyes i was told that the best time of night is around about 1 30 in the morning
4998600	5007160	and if you looked at a particular place over secret mountain you would see this big orb being escorted
5007160	5013940	by helicopters rising from behind secret mountain so i was skeptical but we went out with a local lady
5013940	5022160	melinda leslie who has some good quality military grade night vision goggles and we watched at 1 30 in
5022160	5030280	the morning and sure enough up comes this beautiful golden orb gigantic it pulses it's plasmatic
5030280	5038280	it slowly moves off and the way it moved you couldn't tell if it's because it got smaller or
5038280	5044520	it went so fast that it just disappeared so quickly but it just disappeared and they were they were being
5044520	5053600	escorted by military blackhawk helicopters dozens of them i mean the helicopter fuel bill alone for the
5053600	5060360	evening that we're watching them must have been somewhere between 50 to 100 000 somebody is paying
5060360	5070600	huge money to operate orbs with no visible means of propulsion over secret mountain in sedona
5070600	5079640	and it's funny because um one of the people told us that um if you want to hide something you hide it
5079640	5086560	in plain sight and that's the best way to describe what's going on in what i think is happening in
5086560	5092920	sedona and i think that's nhi non-human do you think it's i don't know made or i mean there are
5092920	5099340	allegations that that base is nhi i've had people who are psionic tell me that they have detected nhi
5099340	5106540	in that area sedona is also a strange place it's a place everybody says when you go weird stuff
5106540	5115300	happens yeah no it does and and i i never expected to see such overt displays of obviously anomalous
5115300	5126040	technology in company with obviously military style aircraft and you show footage it's which is amazing
5126040	5130280	and then you also show all these sort of logical fallacies of the cover story where it's like
5130280	5134720	i think there's like a contract between northern arizona university yeah but like none of the
5134720	5140400	professors ever show up and it's and it's funny because um what we're talking about is the bradshaw
5140400	5148400	ranch and there's allegedly a portal in the bradshaw ranch that was seen by the former owner of the
5148400	5154480	ranch linda bradshaw and she actually took photographs of it and um it opened up in a
5154480	5161600	particular area of the ground around that ranch which just so happens to be the area that's fenced
5161600	5168800	off and we noticed that there is a tower in the middle of that area this is supposedly a deserted ranch
5168800	5176000	there's nobody there there's no electrical power and there's solar panels on this post that has
5176000	5182880	a camera now if you're protecting the security of what is supposedly an academic research institution
5182880	5189420	you have the camera pointed out so that you can see people coming from the outside yeah but you know
5189420	5194160	where the camera is pointing where it's pointing exactly at the point where linda bradshaw says she
5194160	5199820	saw the portal and then the other thing we noticed when we were there and this was picked up by my
5199820	5208900	friend paul who's an australian ground penetrating radar operator he um he heard a humming and he kicks
5208900	5216160	a bush aside and there's this gigantic three-phase power power box with a cable definitely going into
5216160	5222280	the ground wow three-phase power and it's humming and then we walk a bit further around and there's
5222280	5232500	another one and there's massive amounts of electrical power going into the ground under bradshaw ranch and
5232500	5239880	we didn't put this in the um feature-length film that we put to air on primetime but it runs in the
5239880	5247940	full-length interview with paul my friend he did a ground penetrating radar check on the road around
5247940	5255780	bradshaw ranch and we found a 50 foot wide reinforced steel concrete highly visible on ground penetrating
5255780	5261640	radar literally just under the ground whoa i mean i'm in no doubt whatsoever it's there can you get
5261640	5267260	down there no i mean i was half tempted to get a shovel and start digging but the the interesting
5267260	5274000	thing is um the other thing we we learned about was there's an egress point into this whole secret
5274000	5281220	facility called the clarkdale cement plant and the weird thing about it is it's nowhere near secret
5281220	5288280	mountain it's halfway between two mountain ranges but it if you run a direct line between those two
5288280	5293260	mountain ranges and put it through bradshaw ranch where we know there's a tunnel or at least we picked
5293260	5300420	up the tunnel and if you match the walls of the tunnel with where it goes it goes directly wow to
5300420	5307260	the clarkdale cement plant and one of the things we heard about from locals was that 20 years ago
5307260	5312500	the drilling was so intense that things were shaking on their bookshelves and they were obviously
5312500	5319060	tunneling underneath the village at clarkdale where these people live and people were even compensated
5319060	5328100	for damage wow and you know i mean the i don't understand as a journalist i mean i've been taught
5328100	5335660	journalism to do the work on the ground and go and ask the question don't accept what you're told by
5335660	5343600	some defense pr flunky go and check and do the basic checking and i think the interesting thing is
5343600	5350440	that this is all coming out at a time in journalism where sadly investigative journalism is in serious
5350440	5356660	decline because even the great masthead newspapers like the new york times the wash post the la times the
5356660	5363220	boston globe the baltimore sun papers i grew up like i didn't have bay city rollers on my wall i used to
5363220	5370520	paste up big newspaper investigations that's what i always wanted to be and um it's sad because that
5370520	5376040	era of great big budget investigative journalism where they would deploy teams of people to go and
5376040	5382280	investigate stuff it's well and truly over and the big unspoken secret about the new york times is even
5382280	5387440	the new york times doesn't have the resources to do this kind of journalism but all you need to do if
5387440	5394900	i was the editor of a newspaper today i would put 10 days into deploying a couple of investigative
5394900	5403060	journalists to go up from phoenix and have a look at what i saw in sedona and you will find a deep
5403060	5409680	underground military facility that is highly protected has hydraulically operated doors in the side of
5409680	5415840	mountain sides and is secretly operating what i suspect is non-human technology it's amazing and
5415840	5421360	it corroborates uh you know uh larry saunders who wrote a book about deep underground military
5421360	5427120	richard saunders richard saunders sorry thank you and uh katherine austin fitz who talks about large
5427120	5432320	you know trillions of dollars missing from the the federal budget from the dod budget to to go towards
5432320	5438400	these these projects so uh and then nat kobitz's story another story randy anderson's story so
5438400	5443040	at what point though do i mean this is the thing i don't get i really don't get it it's almost like
5443040	5449140	there's a willful blindness in because why do we expect the mainstream media to follow this
5449140	5454740	because they should yeah but they know that they really should it's like the most interesting
5454740	5460440	important thing and it's if you talk about like an archimedes lever like the point of most leverage
5460440	5467700	i mean you can cover like local griffs right but why don't you cover like the trillions of dollars
5467700	5472580	missing from the from the dood's budget or why don't you you know this stuff no i love that quote
5472580	5476520	and it's a true quote i actually dug it out when i was writing my book that donald rumsfeld admitted
5476520	5481700	that there was something is it 23 trillion dollars missing from the budget i think he said 2.1 trillion
5481700	5487760	missing in an audit the day before 9 11 happened yeah the day before 9 11 trillions of dollars
5487760	5493660	are disappearing from the american defense budget documented that's actually one thing i really liked
5493660	5500520	about what doge was doing yeah yeah musk was basically saying why the hell do you not have
5500520	5507400	the acquittal numbering that allows you to reconcile what this money is for yeah with where it's being
5507400	5512400	spent well there was an amazing i think it was like babylon b like headline or something and it was
5512400	5519380	elon musk leaves job of making government more efficient for easier job of allowing humans to occupy more
5519380	5526760	which is like this guy doesn't give up on anything you know a successful car company hadn't been built
5526760	5533240	in the u.s since like the 1910s or something and you haven't built tesla you haven't single-handedly
5533240	5541120	resuscitate you know a version of nasa with spacex and and and he gives up with government efficiency
5541120	5548240	i had to interview elon in 2015 that's amazing i didn't know 60 minutes wow how was that well it
5548240	5553700	was funny because i honestly genuinely had the feeling that like one percent of his brain was
5553700	5559800	answering my questions and the other 99 was working on another problem but the thing i was really
5559800	5567000	impressed with was he he was excited to show me around the spacex factory in la because that was
5567000	5573180	where they were building the new rockets and a lot of the people in spacex but particularly in the
5573180	5579260	tesla factory right next door are aussies because the australians had laid off all of their car industry
5579260	5585860	we completely destroyed in an act of utter stupidity our entire car industry and so a lot of those
5585860	5591520	engineers went to work for elon and he loved aussie engineers but the thing i was really impressed with
5591520	5600400	was he knew more about every aspect of the production line than anybody that he was showing
5600400	5607340	us that day and it wasn't some big performance he really did know and he was asking about metal
5607340	5614260	tolerances and you know he really knew his stuff every aspect of that production line he knew intimately
5614260	5620300	and you could see he had everybody on his toes and frankly that's if you're going to be running a
5620300	5626040	rocket business or an electric car business that's exactly the kind of propriety you want yeah no
5626040	5632380	it's it's he's incredibly impressive he has a unique mind and ability to to make things happen
5632380	5637980	albeit albeit i'm sure he's probably highly annoying to live with i'm sure and probably hiding something
5637980	5642860	when it comes to the ufo issue because why i think he's been read in i think he has to i've been told
5642860	5648800	he's been read in uh yeah i i think so too um speaking of which speaking of high level people that
5648800	5654740	you've spoken to you were interviewed by don jr by the son of the sitting president before you broke
5654740	5660940	the jake barber story what was that like and did it give you any hope as far as american movement on
5660940	5666740	disclosure at the highest level if if don trump senior listens to his son don trump jr is very
5666740	5674820	engaged and interested in ufos and in a really well-informed way as well i mean uh he's been
5674820	5681300	briefed by a lot of people and there's been a lot of well not a lot but there's been multiple
5681300	5688120	secret briefings of the trump camp before they came into government and it's interesting because
5688120	5694260	i am persuaded not at the moment though i'm seeing any action but i am persuaded that people like
5694760	5701580	tulsi gabard nash patel and the fbi tulsi of course is the dni the director of national intelligence
5701580	5708440	um john ratcliffe at the cia these are all people who've previously expressed a strong desire
5708440	5717000	to get to the truth of the uap mystery and i don't think it's any coincidence that um representative
5717000	5723900	anna paulina luna when she was tweeting earlier this week about what a hopeless cause arrow is that's
5723900	5729500	the pentagon yeah ufo investigation office good for her she made the observation that they were
5729500	5734260	obviously a waste of money and should be defunded she implied that the money should go to someone
5734260	5739320	else and i think that's the fbi she's talking about yeah because i'm told that the briefing that
5739320	5749380	the fbi gave in congress really blew people away and watch that fbi ongoing investigation i've dealt
5749380	5756600	with some of the people on the investigation team yeah and i like g-men they're they're like dogs on a
5756600	5762460	phone yeah and they're looking at crimes yeah yeah because ultimately if what we're talking about
5762460	5771360	here is true david grush jake barber they have insinuated and alleged outright in jake's case that
5771360	5778140	people have been murdered that's right to protect this secret yeah it's a capital crime yeah there are
5778140	5784560	people who i suspect are very nervous right now in the legacy program because they are under active
5784560	5792440	fbi investigation yeah i wonder what the mentality uh is arrogance or yeah probably arrogance i have
5792440	5797520	no doubt they think they're going to get away with it uh-huh and you know what why they probably will
5797520	5805240	oh no don't say that no i'm pretty bleak i i i'm not i actually had an argument earlier on today
5805240	5811580	actually well not an argument but a free and frank exchange of views with a lawyer who's been liaising
5811580	5817920	with congress um and they were having a bit of go at me because i talked about how i'm talking to
5817920	5824000	legacy program whistleblowers who want to come forward yeah but they're wary of coming forward
5824000	5829560	and they took a swipe at me and basically said we've got all these protections in congress you should
5829560	5834500	bring them in and encourage them to come in and i said well hang on a bloody moment look at what
5834500	5840380	they've done with david grush's allegations that's right sweet fa yeah you know david gave them first
5840380	5848180	hand direct information from his sources of where to look where to find the spacecraft yes where to
5848180	5853640	literally go and open the door oh by the way there's a there's a spacecraft recovered from aztec yeah
5853640	5858640	open this door oh yeah that's the one from kingman that's right you know who's the person in charge
5858640	5864200	what's the title of the program what's the code name he gave them chapter and verse how many
5864200	5869200	subpoenas have been issued senate select committee for intelligence for any of that information
5869200	5876800	nada so crazy fucking nada and so i don't think congress is doing its job and frankly i do get
5876800	5882500	the impression that congressional staffers are captive to the defense establishment yeah i mean
5882500	5887560	that feels right i mean the last time around the uapda was killed by mike turner yeah like you know
5887560	5892200	his largest donors were all no but i mean it's funny because i mean a lot of the work is done
5892200	5898840	in this preliminary investigation of allegations made by people like david grush by people like
5898840	5905560	lou elizondo people like jake barber when they've gone in and given evidence in camera in skiffs as
5905560	5910900	they all have done to the congress the people that have been sitting there have been staffers
5910900	5917360	yeah and they're good people they're well-intentioned good people but one of the things jake
5917360	5925000	barber told me when he was um giving his direct evidence of the legacy program first person evidence
5925000	5930440	i mean people say where's the evidence yeah the first person evidence of jake barber was given
5930440	5939180	to the senate select committee for intelligence yes and um one of the staffers on that committee
5939180	5947080	was concerned for his own safety yep and asked jake are you able to help me get security because
5947080	5952000	somebody from the defense department is ordering helicopters to fly across and over my home they're
5952000	5957040	harassing my home and that's the kind of thing that the defense department was doing they were buzzing
5957040	5963360	a guy with black hawk helicopters just hovering over his home as an act of intimidation
