start	end	text
1535920	1542800	proceedings with documents that are maybe procured but not necessarily tended in a court case
1543680	1549840	and um they're often tangential to what you're trying to discover to prove the case that you're
1549840	1555200	mounting but there's some really juicy stuff in there and so i don't want to go into too much detail
1555200	1561440	but there were some very helpful lawyers and so i built up a name base of people that i thought might
1561440	1569920	be interesting who'd been involved in litigation at area 51 and in a layering and iterative process of
1569920	1575680	doing what i do which is basic investigative journalism where you you build up a chronology
1575680	1581680	and you think who might know something about advanced aerospace or who might have been working in
1582240	1586880	a security role or a support role at that time in this area that might know something
1587600	1593600	you build up a name base and so i wrote letters to people and one of the glorious things about america
1593600	1601040	is how ridiculously open every database is and i could procure the home addresses of everybody that
1601040	1608960	i wanted to write to including some of the most important scientists in america wow and what shocked me
1608960	1618000	was one of the letters i wrote was to a guy called nat kobitz and um he was the former head of science
1618000	1624720	technology development for the u.s navy and i'd written to him and as an act of brazen cheek to be
1624720	1631520	perfectly honest i honestly did not expect that somebody like him would respond what did kobitz say
1631520	1641920	he rang me and i didn't talk ufos with him for three months and i realized sadly one of the reasons he
1641920	1648080	wanted to talk to me was because he was a lonely elderly man who god bless him was dying slowly of
1648080	1656560	cancer and he was in his daughter's home and she was nursing him and he was bored and i was interested in
1656560	1662480	talking to him and he was talking to me about developing early drone technology and and how
1662480	1668000	one of their drones had crashed in george bush the president's ranch because the secret service had um
1668880	1673600	frequency blockers and you know they'd spent millions of dollars on building this drone and
1673600	1679200	the first time they flew it because they flew into the secret service envelope it crashed and he went
1679200	1686000	went there went a few million bucks you know and uh and he had this wonderful jewish brooklyn sense of
1686000	1692320	humor and i became very friendly with him and i loved i used to really enjoy talking to him there
1692320	1698080	were things like he'd been involved in developing things on the the lunar lander and i knew somebody
1698080	1704160	who'd worked on the lunar lander and they told me something about the lunar lander and because
1704160	1709200	nate knew about that we bounced off that and it just got more and more interesting and then
1710960	1712800	one day i rang him and he was getting really ill
1714720	1720640	and i could hear a kind of a um a change in his voice and i i felt really sad because it was obvious
1720640	1727920	he was ill and he went why don't you ask me the question no way he was the guy who suggested i ask
1727920	1733680	it oh wow he kind of knew you were oh yeah he knew he knew why i was there yeah i'd made no secret
1733680	1739680	that i was writing a book about ufos uh-huh you know how we're always diving into the edge of science
1739680	1745040	and consciousness on this show lately i've been thinking a lot about aging not just in terms of
1745040	1751040	years but in how it actually feels in the body slow recovery lower energy that middle-aged fog that
1751040	1756320	sneaks up on you i feel like i can barely go out and drink alcohol anymore that's why i started using
1756320	1762960	something called qualia senolytic and it's been a major shift for me let me explain as we age our bodies
1762960	1769760	accumulate what scientists call senescent cells also known as zombie cells these are worn out cells
1769760	1775680	that stop dividing but don't die they hang around in your body draining your energy clogging up your
1775680	1781680	recovery and generally making you feel older than you are qualia senolytic is a first-of-its-kind
1781680	1787520	supplement formulated with nine plant-based compounds designed to help your body naturally
1787520	1793520	eliminate these zombie cells it's not something you take every day just two days a month but it
1793520	1799520	supports your body and aging better at the cellular level since i've started taking it i've felt sharper
1799520	1806400	lighter and like my body's resilience has come back online it's vegan non-gmo and grounded in serious
1806400	1814560	research experience the science of feeling younger go to qualialife.com jesse for up to 50 off your
1814560	1825920	purchase and use code jesse again that's j-e-s-s-e for an additional 15 off that's q-u-a-l-i-a-l-i-f-e dot
1825920	1834720	com slash jesse j-e-s-s-e for an extra 15 off your purchase thanks so much to qualia for sponsoring this
1834720	1840320	episode why don't you ask me the question and i was nervous i was actually slightly nervous
1840320	1847760	and i've never released it but i've actually got a recording of this oh my god and he had
1847760	1854880	authorized me to record it of course um and i went i've been agonizing about how to ask you this question
1856880	1865680	and he went third time why don't you just ask me the question and so i went have you ever been
1865680	1876240	read in to any kind of program involving unidentified aerial phenomena alien technology
1876800	1883360	and before i finished answering the question he went yes wow and he obviously made a decision to
1883360	1891680	answer the question and i actually didn't hear him the first time he said it uh-huh i was expecting
1891680	1895040	him to go no i don't know it because everybody was saying no i don't know anything about what
1895040	1899520	you're talking about and you know well actually no that wasn't true i'd already had people confirm
1900160	1909760	the retrieval program but there was a kind of a beat one two and then i went what
1912320	1919600	and and i i i out of respect to nate and that and his family i'm not going to go into a lot of
1919600	1927680	detail of the remaining parts of the conversation because what he then did for me was incredible he
1927680	1936960	facilitated introductions to people and that was my big breakthrough wow and um will that conversation
1936960	1944000	ever come out i i think i'd want his family's okay about it sure you know because it's an emotional
1944000	1950480	thing i think for a family to hear a father's voice after he's been passed for so long yeah but um
1951760	1958000	he was a beautiful guy and and it was an act of courage on his part and i remember one of the
1958000	1961680	conversations i had with him was do you think there's any good reason because this is the thing
1961680	1968720	i wrestle with i know you do as well what's the dirty secret right why why can't we know this you
1968720	1976960	know if the us has recovered technology why can't we know and he hadn't been told that and and he had
1976960	1982960	that rigid doctrinaire thing about how he wasn't read into that part of it and um that was a
1982960	1988160	compartmentalized issue he wasn't entitled to know about what he told me was that he'd been told that
1988160	1994960	the united states had recovered multiple craft wow multiple craft and he implied very strongly that
1994960	2003280	roswell and another case i'm interested in aztec and kingman are all real incidents and that really
2003280	2011600	rocked my world view and um but what what happened was he also told me that he because oh there was
2011600	2019760	another time i asked him i said oh have you have actually seen evidence of alien technology and he went
2019760	2025280	no and kind of i was kind of disappointed because he's implied that he had yeah and then he gave me
2025280	2035520	this cheeky look and because we were talking on zoom and um and i said have you ever been given
2036960	2047120	anomalous technology that defied prosaic explanation uh-huh and he went like he had the first time yes
2047120	2055360	wow and he told me this amazing story about how he was an expert in a particular type of welding called
2055360	2064240	electron beam welding okay and apparently they his company had done the the nose wheel for the c47 one
2064240	2069440	of the big cargo planes these by the u.s military and they need really tough worlds and this is one of
2069440	2075840	the strongest worlds you can do of metals and he was like the world expert with his company in that type
2075840	2081520	of welding and it's an indistinguishable bead unlike i don't know if you've ever welded but it's it
2082080	2089520	welds leave a big bead this type of welding didn't and so he was contacted on his own admission by
2089520	2096320	wright patterson air force base and i think it was even whatever the technology division is known as now
2096320	2105440	i think it might be the foreign technology exploitation something and he um he was flown to wright pat yeah and
2105440	2109920	he did go underground i remember i giggled and i said did you go underground he went yo yeah
2111120	2118640	oh yeah it was obviously a long way down and he was taken into a room under heavy guard
2119920	2127520	and shown what he described to me as the piece of a bulkhead and he said it looked like it should
2127520	2133200	have been incredibly heavy but it was almost light almost lightweight you know like a feather yeah
2133600	2139600	and he said what blew him away was and he i don't know enough about metal metallurgy to know this but
2140400	2144880	he said there were two types of metal and he wouldn't tell me what types of metal they were
2145680	2152480	that had been bonded and he asked to look at it i think under an electron scanning microscope
2152480	2162160	mm-hmm and the scientist in him couldn't resist giving that sense of awe about what he saw that
2162160	2171600	he said it was bonded at the atomic level whoa whoever had built this had layered it atom by atom and he
2171600	2177600	said i i know for a fact that's not a technology certainly that i'm aware of and i would have thought
2177600	2183280	that i would have known yeah i think like semiconductors you can do little amounts of
2183280	2189760	atomic layer deposition but you can't fabricate at scale materials that are atomically you know where
2189760	2197040	you're deliberately placing atoms you just can't do that that's amazing so i think for me the the big
2197040	2204320	aha moment where i stopped being the skeptic and went oh fuck this is real i can't believe this
2204320	2209680	and i remember i actually spent days just going for walks because i was writing my book and it had
2209680	2215760	it had actually altered i had a conformational bias yeah i was writing a book to debunk all this nonsense
2215760	2221200	yeah and and this guy is telling me it's true is this in plain sight by the way that you were writing
2221200	2229200	at the time yeah and the great thing about it was um i was doing a lot of traveling for 60 minutes and
2229200	2236160	channel 7 to big networks in australia and i was often in america and as part of cost cutting they'd
2236160	2241680	often leave you in a hotel for a few days while you shared the crew with another reporter and so
2241680	2246560	you'd have done time when really all you wanted to do was be with your family and you're sitting in
2246560	2251760	a hotel in washington or new york and it sounds like fun i know and once you've tried on the fluffy
2251760	2257200	dressing gown and used the bath salts once you're just a bit bored yeah and so i would um
2257200	2263840	i'd research things and i was going to the national archives and reading a lot of the old archives on
2263840	2269600	ufos and then that organized for me to start meeting people and that was like
2271520	2279280	uap 101 and there was just this conga line of people coming through the apartment i rented
2279280	2290480	that were brave amazing people it's amazing well it's amazing how deeply embedded you became
2291040	2296320	because if i remember correctly grush had come out and you guys had had some mutual contacts before he
2296320	2300960	came out yeah that's true and with jake barber i believe you knew him for like a couple of years
2300960	2305840	before he came out i can't say how long i knew i have a man but okay it's just to protect them but
2305840	2311280	basically yeah i i learned about david grush from people in the program i just think that's
2311280	2316000	important for the audience to hear because you know they think it's some like choreographed thing
2316000	2320720	or whatever it's like you know people have always got this idea that all that happens is these people
2320720	2325840	come to you and you interview them and it's a really lazy job yeah and they have no idea honestly i
2325840	2330480	like i used to have a full head of hair and and the the the the job of
2330480	2336560	it's a bit like you i really admire the way you do your stuff because you actually know
2336560	2343120	a lot of science and a lot of physics and you do and i love the way you demonstrate that knowledge
2343120	2349840	in the shows that you do thank you whereas i honestly am not a scientist but what i do is i'm
2349840	2356320	really good and i learned this at law school at absorbing huge amounts of information complex
2356320	2361440	information and analyzing it and understanding it and and making sure i understand it because
2361440	2366960	at law school we had the socratic method where you were tested orally about your understanding
2366960	2372080	of something and you were put on the spot by the lecturer and questioned in front of 300 other
2372080	2376960	students and if you didn't know your stuff you were humiliated and vilified and i was never going
2376960	2382320	to let that happen and i was humiliated and vilified on constant occasions and um so you're
2382320	2388480	like pavlovian conditioned yeah yeah it's a great terror terror training yeah that's right and um
2388480	2395360	and so i learned subjects so that i could hold conversations with people and i'd read scientific
2395360	2401200	american articles and try and understand them and i for the life of me couldn't and i i'd get friendly
2401200	2409840	physicists or um neuroscientists to explain things to me and it's by demonstrating a knowledge or an
2409840	2416000	understanding or just enough to be able to have a conversation with somebody that increases the flow
2417360	2424480	and so sometimes i'd come out of a conversation and i'd go i think i've got what they're talking
2424480	2430000	about and there's a lot of ideas that people were discussing with me that frankly now that i'm into
2430000	2436320	consciousness and psionics and stuff like that i'm now only now beginning to understand and it's um
2436320	2442640	it's seven years since i had those conversations it's it's wild how much your kind of aperture
2442640	2450240	opens up getting i mean i'm curious as to like how you feel now because you've broken all these stories
2450960	2454720	you can't really argue with the substance of a lot of the stories you can't argue with the people's
2454720	2461360	backgrounds you know their credentials like you can't really do that and so i imagine you feel like
2461360	2467520	you're on this like remote island and then like you have you know i feel this at least you have
2467520	2474400	like mainstream media or news and they just it's like they can't even comprehend like where you are
2474400	2478720	you know it's funny i'm so glad you've led me into this path because i'm going to give you my rant
2479520	2487200	i think there will come a time in the not too distant future where there will be a bloody reckoning
2487200	2494560	with the failure of the mainstream media in the main to deal with the greatest disinformation
2494560	2503920	operation in human history yes yeah it has been the most effective psyop ever yeah yeah but you you
2503920	2510320	also realize when talking to a lot of these people the psyop maybe it's at the top like okay i'll tell
2510320	2518720	give you a crazy story sure a friend of mine was planning an op-ed with a former cabinet member
2518720	2524240	in the u.s the cabinet member wanted to know where they were they were expressing frustration about
2524240	2532080	their lack of access to ufo stuff i decided to help him out because he was having trouble with
2532080	2536960	the wall street journal getting this published which is just prima facie crazy if you take that claim
2536960	2542080	at face value even just the fact that the cabinet member is claiming it well look i mean what made
2542080	2547840	the new york times publish it in 2017 the mere fact that the pentagon was looking at ufos was a story
2547840	2554320	it's it's there you go which is that is a story right and so um and then you get into all these
2554320	2559440	questions of like why did the new york times reject the grush story it's crazy but in this case i'm
2559440	2563200	talking to this journalist at the wall street journal trying to help my friend out
2563200	2566760	and she's actually somewhat open-minded but like she just
2566960	2572240	you know it's one of these things where it's like it seems so beyond the pale and if you don't
2572240	2577840	understand the the deeper research and you haven't gone down the rabbit hole it's kind of like in one
2577840	2584880	ear at the other and she then says i don't know we have this um we have this like consultant that we
2584880	2591120	talked to about ufos here uh and his name is david spurgle and you know where i'm going with this
2591120	2597280	and david spurgle tells me that it's all uh space trash uh temperature inversions and light
2597280	2602640	reflections and in my head i'm thinking that's exactly what don menzel would say in the 50s to
2602640	2608160	throw people off the trail and david spurgle not only did the nasa uap review panel in 2023 but he
2608160	2616080	happens to run the simons foundation you know uh um and uh you know as a scientific advisor and is very
2616080	2622160	embedded in like you know doe research and that's where if you both if you know what we both know
2622160	2627600	that's where the bodies are buried absolutely no and it's it's funny i i one of the things in my line
2627600	2633680	of work is we have a vulgar expression which is always assume a fuck up before a conspiracy like
2633680	2641760	conspiracies happen so rarely and invariably it's the it's the screw-ups that that are the explanation
2641760	2647680	rather than active conspiracy in this case i have been led reluctantly to the conclusion
2648320	2657040	this is a conspiracy that there really is a group a cabal a leadership cabal that is actively
2657040	2662320	conniving to deceive the public why do why do you think that going back to your earlier question of
2662320	2668640	like what's the big deal why do you think they hide it i think they've convinced themselves because
2668640	2674160	i i actually asked somebody from lockheed martin this perfect what's up guys i want to tell you
2674160	2679520	about my new favorite boots these things are epic i've been wearing these everywhere they're called
2679520	2684400	brunt they're insanely comfortable and durable these things last for years and they're super
2684400	2689280	versatile i wear them for hiking for hanging out they look pretty swaggy if you're going out they
2689280	2694560	even look good in work meetings they feel incredibly comfortable there's no annoying break-in
2694560	2699440	period they just kind of form fit to your foot right off the bat they're lightweight you don't
2699440	2704480	have to lug them around but they're also super weather resistant waterproof and durable brunt is
2704480	2710480	committed to making sure you're 100 satisfied with your new gear with over 500 000 customers
2710480	2716160	already on board these boots are the best in the category take it from me brunt makes the most epic
2716160	2721840	durable and comfortable work boots for a limited time our listeners get ten dollars off at brunt
2721840	2728640	by using code jesse at checkout just head to bruntworkware.com and use code jesse and you're
2728640	2736400	all set even better brunt lets you try all their products on the job risk-free just go to bruntworkware.com
2736400	2743760	and use code jesse for ten dollars off again that's bruntworkware.com code jesse after you purchase
2743760	2749840	they will ask you where you heard about them please support our show and tell them that we sent you so
2749840	2754320	so somebody rang me out of the blue from lockheed martin i won't say who they are and convey who they
2754320	2760160	are but they were they were an executive a very senior executive and we were playing a delicate
2760160	2767920	dance they heard me say something and they were thanking me for not putting them in it and for
2767920	2772480	more accurately reflecting the true state of events about something and essentially it was an implicit
2772480	2777520	acknowledgement by that lockheed martin executive that they are holding alien technology
2778640	2783360	and i just blurted it out i said look can i ask you a question i said i promise you i'm not recording
2783360	2792800	you why yeah why not just come out and say it's not us yeah he said it's the agency interesting he said
2792800	2799840	we want to do it and then that's how i found out about the attempt by bigelow aerospace right there's
2799840	2805520	this bullshit story about metamaterials that god bless them leslie and ralph put in the new york
2805520	2812080	times story that was always nonsense it wasn't metamaterials it was a spacecraft right lockheed
2812080	2819760	martin was going to pass on control of an alien spacecraft to bigelow aerospace that's the real story
2820880	2825760	and you hear rumors that maybe it was the kingman craft and yeah three yeah and so the the
2825760	2832080	interesting thing is the um the cia intervened to stop that from happening or at least the office
2832080	2836720	of global access as it was once known and it was it was glenn gaffney right it was now it's
2836720	2841520	interesting i'm not a hundred percent sure it was glenn gaffney people have denied that from the inside
2841520	2846400	but i don't know if that's disinformation okay glenn gaffney's definitely been involved in the cover
2846400	2852080	up right yeah no for sure yeah and australia i remember when i first met you it was at the soul
2852080	2857360	foundation a couple years ago and australia has its own fascinating history that i remember
2857360	2862400	asking you about at the time you have this guy named harry turner i love harry turner tell us
2862400	2866480	about harry turner well good friend of mine bill chalker who's probably australia's preeminent
2866960	2872240	uap researcher he got to know harry really well while harry was alive and harry had been
2873120	2879680	in his youth as a young 20 something a young physicist recently qualified from melbourne university
2879680	2886800	and he expressed an interest in investigating ufos to the then government and they'd invited
2886800	2891600	him to come on board back in those more learned and insightful days when governments didn't try
2891600	2897600	and hide evidence of ufos they invited this young physicist in to analyze ufo sightings because they
2897600	2902720	were like the americans trying to investigate them and we were involved in a collaborative relationship
2902720	2907520	with america providing information to project blue book handing over some of the more interesting
2907520	2913280	new australian and new zealand sightings cases and there was a collaborative exchange of data and
2913280	2918800	information which there still is secretly but i won't get to that until later but the um the
2918800	2927680	interesting thing is harry turner somehow fell into the maralinga nuclear test program and when the
2927680	2934240	british were developing their nuclear weapon god bless the british they let their bombs off in the
2934240	2939600	middle of australia and uh i've been involved in doing stories about what a dreadful scandal that
2939600	2946000	was and how the woomera aboriginal people died in their droves from horrible cancers and so did the
2946000	2952800	servicemen who were involved in supervising the tests but there's two ranges there's the maralinga
2952800	2958880	range where the bombs were tested and there's the woomera range where they tested the icbms and woomera
2958880	2964080	is still very active it's where the americans have secretly been testing hypersonic missile technology
2964720	2969040	and there's a huge level of collaboration secretly between australia and the us where
2969520	2974720	a lot of your dirty aerospace gets brought out to australia and funnily enough it's neither here nor
2974720	2980160	there i've had many aboriginal communities that are often the only communities out there in these
2980160	2987440	remote parts of australia who've described black triangles flying over their communities silent black
2987440	2993920	triangles wow something is i'm sure being tested in the australian outback wow but harry
2993920	3003120	in the 19 whenever the nuclear tests started i think it was in the 1950s and into the 60s he was the
3003120	3012800	supervising physicist on the range at maralinga and he was invited to investigate multiple uap sightings
3012800	3020240	that took place at maralinga during the sightings and there are still reports in the archives of those
