start	end	text
0	6640	and if you looked at a particular place over secret mountain you would see this big orb
6640	12720	being escorted by helicopters rising from behind secret mountain and we watched at 1 30 in the
12720	21600	morning and sure enough up comes this beautiful golden orb gigantic it pulses it's plasmatic
21600	26960	and so where my mind might go with that is that this is some sort of global control system
27760	33040	but an object about a mile behind us and it's following us let's hope they're friendly one of
33040	40560	the first things that one of my sources in that georgetown pub back in probably 2018 told me was
41680	47520	it's all about consciousness you've probably met more people in and around these programs than
47520	54480	anybody else alive you are saying to the human race we are not alone we're definitely not alone
54480	62400	anyway he chuckled and i remember he just let something like yeah the americans wanted that
62400	70240	one shut down pretty quickly whoa it's a multi-minute long video of this thing flying in the air and
70240	78400	there are symbols around the top i showed photos of the symbols to mario woods and to randy anderson
79280	87760	and both of them freaked out we went to his home and saw this sphere apparently move under its own
87760	94960	power people have been murdered because i'm told that the briefing that the fbi gave in congress really
94960	99600	blue people away i have no doubt they think they're going to get away with it uh-huh
99600	102000	and you know what why they probably will
105680	112960	i'm here with ross colthart who um i have just so much gratitude to express first of all uh we've
112960	116720	been waiting to do this for a very long time i'm grateful you're in the us i haven't been avoiding you
116720	122000	i know you haven't um but i'm also i just want to express my gratitude because we were talking before
122000	128240	when the you know cameras weren't rolling i feel like i am aerodynamically drafting behind you i feel
128240	136320	like you uh have done so much leg work in getting all these amazing scoops and uh you know often i'll
136320	142640	do you know a follow-up interview where you know i have a lot of fun but it's really i just have so much
142640	147040	i i owe you a debt and i think humanity owes you a debt as well and so i'm grateful for you uh
147040	153120	sitting down it's a mutual admiration society jesse because i often say to my family how the hell does
153120	160000	he do it you seem like a jackrabbit everywhere i see i mean you have you just come back from
160000	164240	columbia or something you're doing a bugosphere story i was in yeah i was well i was in this is
164240	169760	what's crazy and i know you've experienced i'm sure all sorts of stories where like it starts a
169760	174800	certain way and then you have another story come up so i was investigating these peruvian mummies
174800	180640	these tridactyl you know three toad and fingered mummies from peru and then on the way back up to
180640	185840	the us i stop in mexico city to meet with jaime musan who's a big proponent of this and two days
185840	193280	before he happened to get this bugosphere sent to him or whatever and so i happened to be there um
193280	198960	i've got to know what's your preliminary assessment is it real it's so hard to say you know what do
198960	205040	you see what my friend roni verney posted on twitter repeat it for the audience a fuel tank
205040	211760	and so so there's a particular shape of fuel tank that is exactly nine liters and it's got similar
211760	221200	holes to the one that yaime is relying on and it does have the same seam running along the side it looks
221200	228160	like a direct visual match with a few changes if somebody's cosmetically altered it it's definitely
228160	235520	remarkable just the fact pattern so as you know very well whenever you take a stance a hard stance
235520	241520	in this world you get a ton of flack so i'll just give you my fact pattern of what i've experienced and
241520	246400	then people can sort of decide for themselves so jaime musan was given this thing it was taken in
246400	254160	buga colombia that's why it's called the bugosphere um it was given by a guy so this video was taken by this
254160	261680	guy who is um i guess he like does like uh mining and and metal detection underground and it's a it's
261680	268320	a very long it's a multi-minute long video of this thing flying in the air you've seen the video and
268320	273360	then he picks it up in the forest and there is a little gap in the video so that does beget a question
273360	279200	of like you know provenance and why is there a gap in the video and then he has it for a while in his
279200	285840	possession he ends up giving it to jaime musan and there are symbols around the top apparently
285840	291120	it's an aluminum alloy that's you know three times the hardness of what we generally use in
291120	297200	conventional aerospace and then maybe the most interesting fact i can give you uh that is new to
297200	304160	the audience as well is i showed photos of the symbols to mario woods and to randy anderson
304160	309840	mario woods 1977 ellsworth air force base experiencer and then randy anderson is this
309840	315600	guy who was taken underground you know at um crane naval surface warfare crane and was possibly
315600	321600	shown some off world technology and both of them freaked out because it was like that these were
321600	325840	the symbols that they had both seen mario inside the craft i want to give you something because i'm
325840	333120	not sure and again again i am not avowing that this is my opinion neither of us are endorsing the
333120	338400	boogie sphere we are just these are facts that we are endorsing nor debunking that's right um but i
338400	343760	did what i'm increasingly doing these days i took a photograph of the sphere and i uploaded it to ai
344400	350000	and i asked ai in this case i think it was groke and i said can you please decipher these symbols for
350000	358880	me and it came back very quickly and said the circuit and that i have to admit made me think it was a
358880	367280	hoax now i'm not saying it's a hoax okay but what i am saying is that came back when i put it through ai
367280	374000	but ai is often wrong but uh what i love about ai is that its ability to draw on symbology and
374000	380480	numerology and all of these ideas and it came back with this one phrase the circuit well if you look at
380480	385600	the top it looks like a little semiconductor or a chip yeah and then you have you know this begets all
385600	390880	these ontological questions of like you have i think his name is patrick jackson yes who has
390880	396480	you've done an amazing story everybody go watch ross's story with this and i have seen one of these
396480	404480	spheres in a different domain in the home of a beautiful man in texas who is a good soul and i can
404480	412000	tell you it may be the case that his sphere is now in the possession of brandon fugal and the skinwalker
412000	418080	ranch show is going to be paying to have that sphere properly investigated there's a scoop for
418080	424160	you that is i was going to run it on my show yeah so jim marlin is a former um rock promoter who worked
424160	433680	with willie nelson and uh he has a house in texas and uh we went to his home and saw this sphere
433680	444400	i have to be careful apparently move under its own power and i mean we were sitting with jim for hours
444400	450800	talking and he was in a home where the floor had just been fixed so it's perfectly level and we
450800	460960	verified that with a level and the ball is sitting stationary on the floor and then all of a sudden it
460960	467920	starts moving and there's a bar which has a pole coming down onto the floor it goes up to the bar
467920	472240	and from memory it might have even circled the pole and then come back again part of the way
472880	480240	and there was no movement we were all just sitting in a chair talking and then jim chortles and goes
481680	486560	and it moves yeah was there something that came up in the conversation was it aligned with anything
486560	496480	synchronous no and so when i ran that story on um channel 7 australia they as usual as tv networks
496480	501760	or want to do beat the living daylight side of it which is a journalistic term for flogging the story
501760	510720	until it bleeds and um it um you know there were all the promos were fancy and it made it look like we
510720	517440	we were saying for sure that it was an anomalous object we truly don't know for sure and the great
517440	527360	frustration for me for the past few years since i did that story in 2021 is every time i went to jim
528160	534400	and asked him could we take it to go and get it tested there was a lot of resistance and it made me
534400	541280	suspicious but then he agreed to go and let it get tested but the problem was when i was trying to
541280	547600	find an x-ray place that does industrial x-rays the first thing they want to know is well what's inside
547600	555040	it and i'm going well that's why we want to x-ray it and um and i i was expressing this dilemma only
555040	563280	very recently on a show somewhere and this gentleman rang me from chicago and said that he would x-ray
563280	570800	it in his industrial x-ray machine and he had some other type of machine um can't remember what it was
570800	577040	might have been a ct i'm not sure yeah and he would run it through that as well and it was for free and
577040	584000	i went to jim and i said to jim jim i finally found a place that can test the ball for you the sphere for
584000	588720	you because one of the things i get most a lot of the inquiries about from our audience is what happened
588720	594880	to the sphere you know why haven't you told us the story about the sphere and i was finally about
594880	598880	to announce that we've got somebody who will allow us to do the testing on the sphere because jim won't
598880	607040	let us to cut into it for obvious reasons and um he told me i'm sorry ross brandon fugles agreed
607040	612880	to fly up in his private jet to utah where he's going to have it tested in the lab and look frankly i'm
612880	620320	really happy if that's going to be the case for patrick who i know and um and for jim who's a
620320	626000	beautiful guy uh to finally get an answer and brandon i've spoken to brandon about it and i've
626000	633520	encouraged him to to do it and so hopefully it's all going to happen um fingers crossed yeah let's hope
633520	639600	that's amazing and i think patrick because you were talking about the chip and so where my mind might go
639600	645760	with that again i don't know if it's real is uh that this is some sort of like global control
645760	651680	system or something well patrick's theory is that these spheres are part of a global defense system
651680	659540	by some alien civilization to keep the bad guys out of earth right and i quite like patrick he's a very
659540	666000	clever man yeah he has an eclectic intelligence and he's fun uh i honestly don't know how he could know
666000	672220	that right so i mean a lot of it is speculation and he's got type one spheres and type two spheres and
672220	680180	often there'll be a photograph of a plane and you do you see these spheres around planes in uap events
680180	687500	so there's often a big let's call it object rather than a craft there's a big object that's clearly
687500	694980	anomalous sometimes beside an aircraft and then if you look really closely you'll see these dots that
694980	702760	are these metallic spheres and when i did that story i did that in 2021 for australian tv it just went
702760	709080	nuts it's been seen that particular story if you add the two iterations of the story because we
709080	715900	we had to take one down because of copyright issues with music um it's been seen over 43 million
715900	723820	times and so i was getting phone calls messages emails from people all over the world including i
723820	732140	remember a beautiful guy in africa who who told me that they were seeing these spheres and what i i can
732140	740460	report is whatever they are i do think i can say they're real they're a real phenomenon whatever they
740460	749420	are they're metal spheres with no visible means of propulsion dozens of people have told me that
749420	756260	they've seen them flying or moving under their own locomotive power there's no visible way in which
756260	764920	they're moving and i don't honestly know what to conclude about them because i mean i expressed the
764920	772520	enigma by telling the story but like so much of this whole story jesse i don't know about you but i
772520	777020	often feel like i've got my eyes closed and i'm kind of feeling in the dark and trying to get an idea
777020	782080	about what it is and then as soon as i've got the texture and the feel of what's been in front of
782080	787480	me here i realized there's a whole other room over here of stuff that i've never got my brain around
787480	796260	and it's it's it's mind-bogglingly complex whatever it is this episode is brought to you by my favorite
796260	803040	new product masa chips here's a quick history lesson before the 1990s all chips and fries were cooked in
803040	808700	beef tallow then the big food companies swapped this ingredient out for cheap highly processed seed
808700	815300	oils today seed oils make up 20 of the average american's calories and they're linked to all sorts
815300	821380	of bad things like chronic inflammation and metabolic issues masa decided to rewind the clock
821380	828440	they make tortilla chips with just three simple ingredients organic corn sea salt and a hundred percent
828440	834540	grass-fed beef tallow no seed oils no weird additives and honestly they taste way better too
834540	840400	masa chips are crunchier more flavorful and they don't disintegrate in guac like the usual ones but
840400	847940	the real difference is how you feel light satisfied no crash no bloat and no weird craving spiral an hour
847940	853260	later i've been snacking on them non-stop while working on these shows and they actually keep me sharp
853260	858240	masa chips are beloved by tens of thousands of customers and have been endorsed by
858240	863720	industry-leading health and nutrition experts like ben greenfield and gary brecca so ready to give masa
863720	873300	a try go to masa chips.com jesse michaels michaels with no a and use code jesse michaels for 25 off your
873300	881560	first order that's masa chips.com jesse michaels and use code jesse michaels for 25 off your first order
881560	887120	you're really helping the channel out when you use that code and this is a product i love and consume just
887120	892960	about every day part of what i want to do in this interview is so many people are used to seeing you
892960	900300	in the context of breaking these bombshell stories i want to get to know the man behind that because
900300	906760	you you are often the interviewer and so how did you were you know exposing corruption and stuff with
906760	910860	the surveillance state in australia right how did you get into ufos to begin with
910860	920580	like every kid i was obsessed with doctor who and i i i loved a show called ufo that was on tv
920580	926520	it was a british series um about malevolent aliens invading earth and there was this secret
926520	931260	organization called shadow that was defending earth but i'll be honest i always saw that as fiction
931260	938120	and i accepted it was fiction i never believed it was true and even when in new zealand where i was
938120	948680	living as a kid i um there was a really big ufo incident in 1978 when i was 16 years old in a place
948680	955460	called kaikura on the east coast of the south island of new zealand and there was a cargo aircraft flying
955460	963120	up that coastline in 1978 in the middle of the night and the pilot and the co-pilot had these objects
963120	970240	clearly in their view elliptical metallic disc shaped objects come right up to the cockpit window
970240	979120	glowing but clearly metallic and then go away again and um what was interesting was that it was
979120	986200	another kind of nimitz story because you had sensor systems i found the guy in wellington across cook
986200	993640	strait who was the radar operator on the night who'd seen these things on radar and as the two guys who
993640	1000320	were the journalists on the aircraft were describing the objects say going to the west the radar operator
1000320	1007920	john cordy was seeing them go to the west i have a strong target uh at 12 o'clock to you at two zero miles
1007920	1014320	uh right do we have that one also and uh quite a quick uh visual display at the moment
1014320	1016240	showing light
1016240	1028960	so you had this contemporaneous real-time confirmation of solid objects moving or at least objects that
1028960	1033600	registered on radar moving in the directions that these witnesses were saying that they were seeing
1033600	1039280	these objects moving and they were seeing objects that were plasmatically glowing but at the same time
1039280	1043600	clearly solid structured in their words craft
1043600	1048480	you just heard from wellington radar that we've uh got an object about a mile behind us and it's
1048480	1050800	following us let's hope they're friendly
1050800	1053760	i see ralph reko uh the
1055360	1062400	strong target uh right in formation with you now uh could either be left or right but your target has
1062400	1069040	doubled its size and for each of those people it was a transformative moment but what was really
1069040	1076800	interesting for me as a journalist was i bought as a teenage boy the official government explanation
1078080	1084160	and i was doing my exams i was really focused on my studies there'd been the valentich story of a
1084160	1090000	young boy called frederick valentich who had disappeared in his cessna aircraft flying over bass
1090000	1095920	strait in australia just a few months before and as somebody who was really already very interested in
1095920	1102160	the media i kind of bought into the idea that this is all a big media beta because there's a big
1102160	1109600	problem in the december january period it's the christmas holiday period the news is pretty boring
1109600	1115360	and so this was obviously a story that the media had leapt onto and i just thought yeah this is just
1115360	1121120	a big media beat up what was interesting also was that the government had come out with an official
1121120	1126480	explanation very very quickly which said that these were squid boat lights and in new zealand
1127040	1132240	there are these big japanese fishing fleets that go off the coast with these gigantic lights and you
1132240	1138160	often saw them as a kid and they were glowing on the horizon and they looked spooky and so the theory
1138160	1143760	that was pushed by the new zealand air force was that these were squid boats lights and the captain
1143760	1148480	the co-pilot of one plane and the captain the co-pilot of another plane even though they were flying
1148480	1154000	at 14 000 feet they were mistaken and those objects were below them and it was some kind of refraction
1154000	1161360	in the air blah blah blah blah blah it all gave a reasonable tinge of explanation that made everybody
1161360	1166400	in new zealand think oh that was just a bullshit story during the christmas season it's all over
1167680	1171680	for me though it was interesting because much much later when i became a journalist
1172960	1178000	i was working for the new zealand herald newspaper and i met sir robert muldoon who was the former
1178000	1183600	new zealand prime minister and he used to do these convivial little chats at christmas time where
1184640	1190320	a young reporter me had to drive up and interview him and talk to the former prime minister about
1190320	1195040	whatever he wanted to talk about and i decided i don't know why i knew he'd been the prime minister at
1195040	1201600	the time i decided to ask him what about that kaikoura ufo thing that happened when i was 16 and
1201600	1208720	by that time i think i was about 19 or 20 i can't remember anyway he chuckled and i remember he just
1208720	1216320	let something like yeah the americans wanted that one shut down pretty quickly whoa and that because
1216320	1222880	i love espionage stories and i love as a young new zealander i was always focused on books about
1222880	1228880	espionage and as you referred to earlier one of the biggest stories i did in my time in australia was
1228880	1235440	i revealed the existence exclusively of the echelon communications surveillance system which is what
1235440	1243440	the five eyes operate to intercept communications and for the first time ever um i got from an
1243440	1249200	intelligence service in australia an official admission that there was a system called echelon and
1249200	1254880	it was involved in communications surveillance and spying and so i was switched on to that issue
1254880	1260640	all my life i've always been really interested in spies and espionage and so it twigged my interest
1260640	1265920	that sir robert moldurne was describing this admission that there'd been some kind of american
1265920	1272000	intervention but he wouldn't go any further and then much much later when i was writing my book
1272960	1277600	i discovered that there'd been this release of the new zealand archives in about 2011
1277600	1286160	and it essentially revealed the detail of what went on inside the air force in new zealand to try
1286160	1291840	and fix this problem as fast as possible and it was quite clear these air force officers had been told
1292480	1298640	find a fucking solution as fast as possible we want this off the front page and it was quite clear
1298640	1303120	enormous amounts of pressure was being put on the chief of air staff the head of the air force
1303120	1308800	by the prime minister's office to make this one go away and hence the squid boat explanation
1309680	1314640	and then when i was writing my book i met quentin fogarty who'd been one of the reporters on the
1314640	1321040	plane who by complete chance his son ben was one of the chief cameramen at 60 minutes where i was
1321040	1326960	working as a reporter and so ben said to me my dad was the guy who was on that plane that night so i got
1326960	1333440	to meet his father another weird serendipity and another one of the reporters was a political
1333440	1340000	correspondent called dennis grant of great renown later on in um australia and dennis confirmed all
1340000	1347440	the story and um he introduced me to bruce mccabee who was the um atmospheric physicist who sadly recently
1347440	1354160	died and all of a sudden i realized that the story that i'd bought as a young teenage kid
1354160	1363680	that basically told me this was bullshit was actually completely untrue and there'd been a
1363680	1371920	really elaborate cover-up and that fascinated me and it was one of the because i actually started out
1371920	1379120	writing my book in about 2018 when i left 60 minutes i thought i wanted to do a book debunking
1379120	1386480	ufos i was arrogant and i had this assumption that all ufos were nonsense and it was only a matter
1386480	1392480	of time i'd read nick cook's um hunt for zero point and you know he'd implied very strongly that there
1392480	1398480	was some sort of secret us aerospace program we obviously have all heard all the rumors about the
1398480	1404400	aurora which or the tr3b and i just assumed it was some kind of black world american technology and
1404400	1409760	that a bit of dutiful digging would no doubt reveal this and somehow for some inescapable reason
1409760	1415200	i would discover it and make my name by revealing that the whole ufo story was complete nonsense
1416000	1423440	but the more i got into the story because of that kaikoura story everywhere i went everybody was
1423440	1430640	telling me this is real and so i had sources from the original echelon investigation i'd done and
1430640	1437200	from people i've met in afghanistan and iraq when i covered the war who were in senior levels in
1437200	1445040	intelligence and um defense and they facilitated introductions for me to people who privately when
1445040	1453520	we sat over a table in a bar said ross this is real yeah and that only really happened for me
1453520	1462480	more recently you know while i was writing my book and probably the biggest breakthrough moment for me
1462480	1473360	where i went holy heck this is real is when the um the technique i'd used to try and investigate this
1473360	1480240	was because of my knowledge of echelon and how easy it is to intercept digital communications
1480240	1487200	i decided i wouldn't approach anybody that i thought might know something about this other
1487200	1492320	than by using analog communication techniques i wouldn't even use phones because of course
1492320	1498000	there's a metadata and we knew about that because of the um snowden revelations that there was this
1498000	1503920	metadata trail that essentially reveals that you can be tracked and and they might not know the contents
1503920	1509200	of the phone conversation but they can certainly track a lot about your habits and your movements and who
1509200	1517680	you're talking to by looking at the metadata and so i wrote letters wow so i wrote i think about 160
1517680	1527200	170 letters at last count and a lot of it involved doing things like uh i'm a lawyer by training and so
1528000	1535920	as a young trainee lawyer i'd learned that a lot of stinky stuff happens in the discovery process and legal
