start	end	text
3130000	3133000	Annual surge, plus 400,000 vacationers.
3133000	3136000	Then there's the symbolism of the Big Dipper itself.
3136000	3146000	In Spielberg's Close Encounters of the Third Kind, the first UFOs to appear above Devil's Tower formed the shape of the Dipper in the sky.
3146000	3153000	Jacques Vallée noted that Betty Hill's abduction story also began with her seeing one too many stars in the Dipper.
3153000	3164000	Even Navy pilot Ryan Graves, who's very humble in his claims, has said that pilots reported UAPs emerging from the Dipper and even dogfighting near it in orbit.
3164000	3170000	Ancient Egyptian rituals used Dipper-shaped tools to send pharaohs into the afterlife.
3170000	3174000	Taoist sages would trace its stars in ascension rituals.
3174000	3184000	Ptolemy, one of the fathers of modern astronomy in 2nd century AD Alexandria, would also say that souls would ascend through Orion's belt.
3184000	3190000	Even the Thule Society saw the circumpolar stars as a point of origin for non-human intelligences.
3190000	3194000	And then look at modern super-experiencers like Chris Bledsoe.
3194000	3203000	Bledsoe believes that the non-human intelligence he is in contact with, which he has termed the Lady, is linked to the Dipper.
3203000	3208000	And that her companions call themselves, quote unquote, the Guardians.
3208000	3212000	Coincidentally, Guardians is the term now used by the US Space Force.
3212000	3221000	And the emblem of Space Delta-7, the Space Force's intelligence wing, shows a bear holding a key in front of the Big Dipper.
3221000	3224000	So we return to the central question.
3224000	3226000	Are these patterns just coincidence?
3226000	3229000	Are we connecting the dots in a crazy way?
3229000	3232000	Pareidolia, finding patterns where they don't exist.
3232000	3236000	Or does the pattern these disparate dots create suggest something deeper?
3236000	3250000	We return to Diana Pasolka in her discussions with the enigmatic Tyler D.
3250000	3253000	Timothy Taylor, the NASA mission controller.
3253000	3261000	One of the most curious aspects of Taylor's story is his claim that he receives downloads from an intelligence he believes is non-human.
3261000	3267000	These downloads appear as sudden flashes of insight, full mental blueprints or instructions.
3267000	3273000	He says they come to him through specific protocols and they've led to real patents and technologies.
3273000	3279000	They have also shaped how he approaches his ongoing work within the US space program.
3279000	3286000	Even if we take the most skeptical approach, assuming Taylor is simply a high ranking engineer with strange personal beliefs,
3286000	3290000	it still leaves us with a wild but undeniable fact.
3290000	3296000	Someone overseeing major NASA launches believes they are influenced by a non-human intelligence.
3296000	3301000	I'm fairly sure Tim Taylor is a known entity at Kennedy Space Center.
3301000	3305000	I personally tried to meet up with him once, but he had to go to Florida for a launch.
3305000	3313000	And finally, I've found this bizarre connection between Tim Taylor and mid-century anti-gravity inventor Thomas Townsend Brown.
3313000	3320000	Brown's daughter Linda reviewed Tim Taylor's book on Amazon before anybody knew who Tim Taylor was,
3320000	3326000	well before he was written about even pseudonymously in Diana Posulka's American Cosmic.
3326000	3335000	And then Tim Taylor apparently told Christopher Bledsoe's son Ryan that he was part of a secret time travel program in Nassau in the Bahamas,
3335000	3340000	and that Thomas Townsend Brown was the president of that group.
3340000	3346000	I know a ton about Thomas Townsend Brown, and I can tell you definitively he was obsessed with time travel.
3346000	3355000	He also spent an inordinate amount of time in the Bahamas with the inspiration for James Bond and Winston Churchill's super spy, William Stevenson.
3355000	3361000	And then there's Tim Taylor telling Posulka that he was part of the quote-unquote adjustment team,
3361000	3366000	an homage to Philip K. Dick's great book about a team of time travelers.
3366000	3372000	And if we're going to entertain this speculation for a second, then how would a secret time travel program actually work?
3372000	3376000	We know in general relativity that gravity and time are highly related.
3376000	3380000	So maybe you'd do an experiment like Thomas Townsend Brown's.
3380000	3385000	You might create a high-voltage environment that bends spacetime itself.
3385000	3393000	Or you might launch a very oddly timed rocket that happens to coincide with ancient traditional rituals.
3397000	3399000	Who knows? I doubt we'll ever know.
3399000	3402000	But even if you dismiss all of those crazy theories,
3402000	3406000	it is clear that the modern space program is not just a technical story.
3406000	3412000	It's a story about consciousness, belief, and the role of the human mind in space exploration.
3412000	3416000	This same theme shows up in other unexpected places.
3416000	3422000	Take James Ryder, former vice president of Lockheed Martin, and a director at Skunk Works.
3422000	3425000	In 2018, he gave a talk called The Garment of God.
3425000	3432000	In it, he emphasized the relationship between mysticism, consciousness, and technological progress.
3432000	3436000	In a separate lecture focused entirely on UAPs,
3436000	3439000	Ryder spoke openly about ritual, altered states,
3439000	3445000	and the overlap between ancient spiritual entities and modern contact experiences.
3445000	3451000	Dr. James Lakatsky, the DIA physicist involved in the OSAP program, made a similar point.
3451000	3454000	Within the U.S. government covert UFO program,
3454000	3459000	Lakatsky writes that the team gained access to a non-human craft and entered it.
3459000	3463000	The U.S. government has in its possession a craft of unknown origin,
3463000	3466000	and you are able to access the inside.
3466000	3468000	Is that correct?
3468000	3469000	Yes.
3469000	3472000	But elsewhere, he's taken things further.
3472000	3476000	Saying that if full human capabilities were known to us right now,
3476000	3478000	it is not something that we need to fear.
3478000	3481000	Our capabilities never have been fully revealed.
3481000	3483000	And we're still learning.
3483000	3485000	We've got a long way to evolve still.
3485000	3488000	Then there's Dr. Jeffrey Kripal,
3488000	3491000	Chair of Philosophy and Religious Studies at Rice University.
3491000	3493000	On the Danny Jones podcast,
3493000	3495000	he revealed that Charles Chase,
3495000	3499000	director of Lockheed's Revolutionary Projects organization,
3499000	3504000	once invited him to give a private talk to top engineers on one topic,
3504000	3505000	levitation.
3505000	3509000	Kripal spoke about shamans, saints, and monks from around the world
3509000	3514000	who claimed to float during intense spiritual or meditative states.
3514000	3517000	Apparently, Chase felt these accounts were worth studying.
3517000	3520000	He wanted the engineers at Skunk Works to hear about it.
3520000	3522000	And Chase wasn't alone.
3522000	3524000	Other senior Skunk Works figures,
3524000	3525000	Robert Weiss,
3525000	3526000	Steve Justice,
3526000	3527000	and Eric Schrock,
3527000	3529000	along with Air Force Research Lab Commander,
3529000	3530000	Neil McCaslin,
3530000	3534000	all advised Tom DeLonge and Peter Lavenda's Secret Machines Project.
3534000	3537000	These men weren't UFO YouTubers.
3537000	3542000	They were among the most technologically capable individuals in the defense sector.
3542000	3544000	It should come as no surprise, then,
3544000	3549000	that the core thesis of the book Secret Machines is that UAP are mystical machines.
3549000	3552000	According to both DeLonge and Lavenda,
3552000	3558000	these elite scientists frequently circled back to one concept in their conversations,
3558000	3559000	human consciousness.
3559000	3563000	So when experiencers say they fly the craft with their minds,
3563000	3566000	it might not be as far-fetched as it sounds.
3566000	3572000	It seems like people in the most elite circles of aerospace seem to entertain the same possibility.
3572000	3577000	When Diana Pasulka asked Taylor why he was interested in her work on religious studies,
3577000	3579000	his answer was simple.
3579000	3581000	The next development in my field,
3581000	3582000	rocket science,
3582000	3583000	will come from yours,
3583000	3586000	religion.
3590000	3594000	As the 20th century philosopher Henri Bergson put it,
3594000	3597000	the mystical summons up the mechanical.
3597000	3602000	The origins of the process of mechanization are more mystical than we might imagine.
3602000	3603000	He also said,
3603000	3607000	the eyes can only see what the mind is prepared to comprehend.
3609000	3614000	It seems like an inescapable conclusion that the history of rocket science and physics
3614000	3619000	is intimately connected to mystical traditions, the occult, and ancient mythology.
3619000	3623000	Whether it was Einstein dozing off as a patent clerk in Zurich,
3623000	3628000	or Dirac staring at the fire in Cambridge and downloading the Dirac equation,
3628000	3634000	or Wolfgang Pali receiving the architecture of the hydrogen atom in a dream,
3634000	3640000	or Heisenberg receiving the mathematical underpinnings of quantum leaps at Helgoland.
3640000	3646000	Throughout history, genius and inspiration have been described not as invention, but reception.
3646000	3656000	It may be something that extraterrestrial or non-human intelligence is sharing with us.
3656000	3660000	Or it may be the truth that is being protected by secrets.
3660000	3665000	As referenced by the first man to ever walk on the moon, Neil Armstrong.
3665000	3669000	We leave you much that is undone.
3669000	3673000	There are great ideas undiscovered.
3673000	3681000	Breakthroughs available to those who can remove one of truth's protective layers.
3681000	3688000	It was Neil Armstrong who asked to sit with my father and family.
3688000	3692000	And it turns out that he did talk with my father,
3692000	3698000	and they talked seriously about creating a new UFO research group.
3698000	3700000	Wow. Which was...
3700000	3705000	Which, well, I think became CUFOs because Neil was, he was fairly reclusive.
3705000	3708000	Not like Buzz Aldrin. He's not, didn't really enjoy the spotlight.
3708000	3714000	And especially in the early 70s, there was so much more stigma attached to the phenomenon
3714000	3717000	that he decided it's just not for me.
3717000	3722000	But for me, some of the most telling evidence are these things.
3722000	3727000	The fact that Neil Armstrong publicly sat with my father, who had...
3727000	3728000	A reputation.
3728000	3732000	Yeah, had good astronomical bona fides, but was known for UFOs at that time.
3732000	3733000	Yes.
3733000	3737000	He sat with him, and I know he talked to my dad about pursuing this.
3737000	3741000	So I don't know what he saw or what he think he may have seen.
3741000	3742000	Mm-hmm.
3742000	3747000	But he was a, you know, jet pilot, a test pilot.
3747000	3750000	And he decided that there was something going on.
3750000	3753000	And he wanted to work with my father to figure out what it was.
3753000	3754000	Wow.
3754000	3755000	—
3755000	3759000	—
3764000	3765000	Alchemist...
3765000	3766000	—
3766000	3767000	—
3767000	3768000	—
3768000	3769000	—
3784000	3790000	full picture, head over to the American Alchemy magazine we just launched on Substack. That's
3790000	3795680	where we deep dive into all sorts of crazy topics that we don't have time to fit into every video,
3795680	3801440	with weekly articles exploring all of the strange, forgotten, and conspiratorial corners of space,
3801440	3807680	history, and high weirdness. So join up today at our free or paid tiers on Substack.
3807680	3811280	I am including the full link in the description of this video.
3811280	3826960	And the first subscribers all get free American Alchemy hats.
