start	end	text
1599000	1601000	And it didn't just stop at mysticism.
1601000	1605000	The Nazis were also pioneers of actual rocket science.
1606000	1609000	One of the key figures was Hermann Oberth.
1609000	1617000	Born in Transylvania, inspired by sci-fi writer Jules Verne, Oberth began theorizing about spaceflight as a teenager.
1617000	1629000	In 1923, he published The Rocket into Planetary Space, a landmark book that laid out how a multi-stage rocket could escape Earth's gravity.
1630000	1632000	He was decades ahead of his time.
1632000	1639000	He envisioned orbiting telescopes, spacesuits, weather-controlling satellites, even missions to other planets.
1639000	1649000	His ideas sparked a movement, and when World War II began, Oberth was pulled into military work, building rockets for Germany and later for Italy.
1650000	1657000	After the war, Oberth became one of the few major scientists to publicly support the reality of UFOs.
1657000	1669000	After so many witnesses have seen the so-called flying saucers, their existence cannot longer be denied.
1669000	1675000	I believe that these flying objects come from another solar system.
1676000	1683000	In a 1954 lecture, he argued that these UFOs had been observed since at least the 1400s.
1683000	1690000	Oberth believed they were piloted by extraterrestrial visitors, monitoring Earth's nuclear sites and military tech.
1691000	1693000	In interviews, he even said,
1693000	1698000	We cannot take all of the credit for our record advancements in certain scientific fields.
1698000	1700000	We have been helped.
1700000	1702000	When asked by whom, he replied,
1702000	1704000	The people of the other worlds.
1704000	1715000	Later in life, Oberth was invited to watch the launch of Apollo 11 and the space shuttle Challenger.
1715000	1720000	But he wasn't part of the official Operation Paperclip transfer of Nazi scientists.
1720000	1725000	That honor fell to his most famous student, Werner Von Braun.
1725000	1728000	Before we jump in, I want to thank today's sponsor.
1728000	1730000	Hex-clad cookware.
1730000	1737000	AKA the pans I didn't know I needed until I ditched the warped, flaked mess I've been cooking with since college.
1737000	1738000	But here's what sold me.
1738000	1743000	Hex-clad pans are like if stainless steel and non-stick had a love child.
1743000	1745000	And then Gordon Ramsay adopted it.
1745000	1749000	No joke, he actually uses them at home and in his restaurants.
1749000	1752000	And as we all know, that guy doesn't suffer fools gladly.
1752000	1756000	So he probably has equally high standards for his cookware.
1756000	1757000	First meal I made?
1757000	1760000	A seared steak and some scrambled eggs.
1760000	1761000	No sticking.
1761000	1762000	No smoke alarm.
1762000	1767000	No soaking it overnight like it's some artifact from an archaeological dig.
1767000	1770000	They're oven safe up to 500 degrees Fahrenheit.
1770000	1772000	They're toxic free.
1772000	1775000	And they even come somehow with a lifetime warranty.
1775000	1778000	Which to me sounds like cookware immortality.
1778000	1779000	And the knives?
1779000	1781000	Japanese Damascus steel.
1781000	1783000	67 layers.
1783000	1790000	It's this kind of precision that makes you wonder if these were reverse engineered from material found at a UFO crash site.
1790000	1794000	So if you've got some sad pan haunting your kitchen, replace it.
1794000	1798000	For a limited time, get 10% off my exclusive link.
1798000	1801000	Hex-clad.com slash jesse.
1801000	1804000	Again, that's Hex-clad.com slash jesse.
1804000	1805000	Please use that link.
1805000	1809000	It shows a ton of support for the channel and you get a discount.
1809000	1811000	Now back to the episode.
1811000	1817000	Dr. Von Braun, were you embarrassed to come to London this time after being responsible for the V-weapons during the war?
1817000	1828000	I'm really happy to have this opportunity to express my personal sympathies to those in London who lost their loved ones in these V-weapon raids.
1828000	1831000	But then war is a dirty business.
1831000	1834000	And all I can say is that I'm happy that it's all over now.
1834000	1837000	Von Braun wasn't just a German rocket scientist.
1837000	1846000	He was the architect of the V-2 missile program, a major in the SS and one of the top minds in Hitler's war machine.
1846000	1850000	Like Parsons, Von Braun had dreamed of space since he was a boy.
1850000	1860000	But where Parsons was invoking goddesses in desert rituals, Von Braun was swearing loyalty to Himmler and building rockets with slave labor from concentration camps.
1860000	1871000	After the war, the U.S. swept Von Braun up in Operation Paperclip, a covert mission to extract Nazi scientists.
1871000	1878000	He was captured in Bavaria, where a young Henry Kissinger was actually helping run counterintelligence for the United States.
1878000	1882000	Von Braun's record was scrubbed and he was given a new job.
1882000	1885000	Build America's space program.
1885000	1887000	And that he did.
1887000	1896000	Von Braun became the public face of NASA, a media darling, the man behind the Saturn V rocket that took us to the moon.
1896000	1903000	But the overall size and weight of the rocket is mainly determined by the 11 tons weight of this top section.
1903000	1914000	This weight dictates the amount of fuel and the numbers of motors needed to produce enough power to equalize the gravitational pull of the Earth.
1914000	1924000	But behind the scenes, many of the ideas, the scientists, and even the weirdness of the Nazi space program had been brought into the American one.
1924000	1927000	As we'll see, the weirdness didn't vanish.
1927000	1929000	It just changed uniforms.
1929000	1936000	But before we get to NASA's more esoteric side, we need to check in with the other major player in the space race.
1936000	1959000	Before Parsons, NASA, or the Nazis, another conception of human purpose, one tied to our place in the universe, was emerging in late 19th century Russia.
1959000	1964000	Something we now call Russian cosmism.
1964000	1976000	It began with a librarian and philosopher named Nikolai Fyodorov, who believed the true task of humanity and Christianity was not to await resurrection, but to cause it.
1976000	1983000	He believed that one day, technology would allow us to resurrect every human who had ever lived.
1983000	1991000	And that once death was defeated, humanity's next task would be to colonize the cosmos.
1991000	2001000	Among those most influenced by Fyodorov and his ideas was a deaf, self-taught young man named Konstantin Tsiolkovsky.
2001000	2005000	He would become known as the father of Russian spaceflight.
2005000	2009000	Tsiolkovsky didn't just believe space travel was possible.
2009000	2011000	He believed it was necessary.
2011000	2018000	He saw humanity as part of a cosmic process, destined to leave Earth and populate the stars.
2018000	2024000	In 1903, he developed what we now call the Tsiolkovsky rocket equation.
2024000	2031000	The fundamental formula describing how a rocket accelerates based on its mass and exhaust velocity.
2031000	2039000	Like Oberth, he anticipated breakthroughs in rocketry and space exploration well before they were technologically feasible.
2039000	2042000	And here's where things get especially strange.
2042000	2049000	As Diana Pasolka points out in American Cosmic, Tsiolkovsky believed that non-human intelligences,
2049000	2055000	what he called ethereal beings, were communicating with us through celestial symbols.
2055000	2056000	He wrote,
2056000	2063000	We are made as the ethereal beings, existing beyond our dimensions of recognized reality.
2063000	2072000	These higher beings are in communication with us, reading our thoughts and sending us messages through celestial symbols,
2072000	2076000	which most of us do not even perceive, much less understand.
2076000	2086000	A genius is one who comprehends and channels these messages from higher beings into technologies, products and even art.
2086000	2093000	Tsiolkovsky seemed to believe that his rocket science, the very math that would take humans off Earth,
2093000	2097000	was received through this kind of cosmic transmission.
2097000	2104000	He may have seen himself not only as an engineer, but as a medium for an intelligence beyond human understanding.
2104000	2111000	Another example of someone who saw the spiritual dimension of science as fundamental to the work itself.
2111000	2120000	Even as the Soviet Union officially rejected religion, it opened the door to a different kind of cosmic mythology,
2120000	2128000	one in which ancient contact with extraterrestrials was treated not as fantasy, but as a legitimate scientific possibility.
2128000	2133000	These ideas were often framed in speculative or scientific language,
2133000	2145000	a political workaround that allowed Soviet thinkers to explore humanity's possible contact with advanced extraterrestrial civilizations without invoking the supernatural.
2145000	2153000	Figures like Alexander Kazantsev and Felix Ziegel proposed that alien visitors may have influenced early human development,
2153000	2159000	seeding myths and technologies that were later taken on by ancient cultures.
2159000	2167000	Unlike in the West, where such theories were typically fringe, in the USSR they were sometimes discussed in academic circles,
2167000	2173000	covered in state-run media, and even investigated by military and intelligence services.
2173000	2184000	This made paleocontact, as they called it, not just a conspiracy theory, but a semi-legitimate line of inquiry into humanity's cosmic origins.
2184000	2188000	But it was the Americans who won the space race when they made it to the moon.
2188000	2196000	And maybe, just maybe, that mission carried within it a hidden reverence for the esoteric dimensions of spaceflight
2196000	2201000	that men like Tsiolkovsky and Fyodorov had long envisioned.
2201000	2207000	Maybe the space race wasn't just a Cold War pissing contest, but a transcendental mission.
2207000	2212000	Which brings us to NASA, where the weird gets even weirder.
2224000	2231000	NASA was officially established on July 29th, 1958, by the National Aeronautics and Space Act.
2231000	2237000	On paper, this document laid out that NASA was supposed to be a civilian agency for space exploration,
2237000	2242000	devoted to quote-unquote peaceful purposes for the benefit of all mankind.
2242000	2246000	But that idealism is tempered in the very next paragraph.
2246000	2253000	The act makes clear that the general welfare and security of the United States requires such an organization.
2253000	2265000	And that any activities, peculiar to or primarily associated with weapons systems, military operations, or the defense of the United States, fall outside the civilian mandate.
2265000	2279000	In practice, that meant if NASA found anything deemed strategically sensitive, at all, a breakthrough in propulsion, a powerful new sensor, or even contact with non-human intelligence, it could be withheld indefinitely.
2279000	2283000	It's a reminder of something we've talked about before.
2283000	2287000	The echoes of the 1954 Atomic Energy Act.
2287000	2300000	If you read the definition of special nuclear material in the Public Atomic Energy Act of 1954, it basically states any material that releases any kind of atomic energy.
2300000	2302000	That would be retrieved crash material.
2302000	2304000	So it's kind of a sneaky way.
2304000	2305000	No, it is.
2305000	2314000	If you actually read the Atomic Energy Act, if something is not a nuke, but it has radiological energy coming off it, you know, alpha, beta decay, whatever.
2314000	2315000	Same secrecy.
2315000	2316000	Same secrecy.
2316000	2318000	How did the Nazi rocket scientists get in?
2318000	2326000	After Operation Paperclip, Werner Von Braun and his team were brought into the U.S. to work on ballistic missiles.
2326000	2334000	Many of them ended up in places like Fort Bliss in White Sands, where they were housed in military camps and worked under tight control.
2334000	2340000	Swastikas and Nazi memorabilia were reportedly on open display in some of these facilities.
2340000	2349000	FBI documents even showed that at one point Von Braun was caught sending classified documents to his Nazi counterparts in the USSR.
2349000	2352000	But it seemed like no disciplinary action was ever taken.
2352000	2362000	During this period Von Braun caught the attention of Walt Disney.
2362000	2367000	The two collaborated on a series of educational films about space exploration.
2367000	2377000	Von Braun features a lot in them, explaining the future of space exploration and the capabilities of imagined rockets and space stations.
2377000	2383000	One extended scene, a team of astronauts travel to the far side of the moon for the first time.
2383000	2391000	That's when a radar engineer yells out that some kind of radiation is being picked up on their sensors at 33 degrees.
2391000	2396000	Something that turns out to be a very constructed looking feature on the terrain of the moon.
2396000	2398000	Get some flares in that area, quick.
2398000	2417000	The film moves on without too much attention being paid to the set of ruins on the moon.
2417000	2421000	Almost like it was just included for those that would notice it.
2421000	2426000	Perhaps it was just a coincidence, an imaginative nod to the unknowns of space.
2426000	2429000	The coordinates, 33 degrees, are hard to ignore.
2429000	2434000	Especially given the prominence of that number in the Scottish Rite of Freemasonry.
2436000	2440000	There are a few Scottish Rite Masons you might have heard of.
2440000	2444000	And those that were awarded the highest honor of becoming a 33rd degree.
2444000	2451000	This includes the first American to orbit the Earth, John Glenn, as well as the President, Harry Truman.
2451000	2455000	And another astronaut we've already discussed, Buzz Aldrin.
2455000	2459000	James Webb, NASA Administrator, Scottish Rite Mason.
2459000	2463000	Kenneth Kleinecht, Director of Mercury, Gemini, and Apollo.
2463000	2465000	Also a Scottish Rite Mason.
2465000	2468000	We've also got Leroy Gordon Cooper Jr.
2468000	2470000	Who flew on the Mercury and Gemini programs.
2470000	2473000	And then you have Walter Shura Jr.
2473000	2475000	And Don Eisel, who flew on Apollo 7.
2475000	2479000	As well as Virgil Grissom, who flew on the Mercury program.
2479000	2483000	But sadly passed away in the training capsule fire for the first Apollo mission.
2483000	2486000	Thomas Patton Stafford flew Apollo 10.
2486000	2488000	All Freemasons.
2488000	2493000	Later, on Apollo 15, the eighth person to walk on the moon was also a Mason.
2493000	2494000	James Irwin.
2494000	2496000	And another man we've already mentioned earlier.
2496000	2502000	Edgar Mitchell, who spent more than nine hours walking on the moon's surface on Apollo 14.
2502000	2504000	Freemason.
2504000	2510000	So by the mid-1960s, the structure of NASA, and I mean the actual power structure,
2510000	2515000	was a strange cocktail of former SS officers, Freemasons, and occultists.
2515000	2519000	And then there's the Teos Cave story.
2519000	2520000	You know where I do want to go though?
2520000	2523000	You know, there are all the conspiracies that the moon landing was faked.
2523000	2528000	And then there's the UFO conspiracy that Neil Armstrong saw, like, UFOs on the moon or whatever.
2528000	2530000	I'm not proposing that. I don't necessarily think that that's true.
2530000	2539000	But the one possibly kind of funny piece of additional evidence would be that the second expedition Neil Armstrong did was in 1975.
2539000	2543000	And it was to a cave in Ecuador at the edge of the Amazon.
2543000	2545000	And it was called the Teos Cave.
2545000	2549000	And it was supposed to contain ancient alien metallic artifacts.
2549000	2560000	And so clearly, Neil Armstrong believed enough in the possibility of that thing to, like, go into the Amazon and risk his life and try to look for it.
2560000	2563000	And a BBC documentary crew followed him in there.
2563000	2588000	What we've seen throughout this video is that there's something more than a sterile materialist view of reality behind the engineering and physics of space exploration.
2588000	2592000	There seems to be a kind of ritual element to it.
2592000	2599000	And one of the clearest signs that NASA wasn't just about nuts and bolts science is something hiding in plain sight.
2599000	2601000	The mission patches.
2601000	2604000	Take the official Apollo program patch.
2604000	2606000	At first glance, it's simple.
2606000	2611000	The Earth, the moon, a path connecting them and a large letter A.
2611000	2612000	But look again.
2612000	2615000	Behind the A is the constellation Orion.
2615000	2620000	And the crossbar of the A is deliberately aligned with Orion's belt.
2620000	2624000	The three stars, Mintaka, Alnilam, and Alnitak.
2624000	2627000	In Greek myth, Orion is the hunter.
2627000	2631000	But to the ancient Egyptians, those three stars were Osiris.
2631000	2635000	God of the afterlife, death, and resurrection.
2635000	2639000	And in the patch, they're outlined in blue, given special emphasis.
2639000	2641000	Strange, right?
2641000	2646000	Especially for a mission named after Apollo, the Greek god of the sun.
2646000	2652000	Why name the mission after one deity but center its symbolism around an entirely different pantheon?
2652000	2655000	And which pantheon are we talking about here?
2655000	2657000	Was the big A for Apollo?
2657000	2661000	Or for Assar, the Egyptian name for Osiris?
2661000	2669000	In Egyptian myth, Osiris is murdered by his brother Set and resurrected by his wife Isis and their son Horus.
2669000	2672000	Who then defeats Set and restores cosmic order.
2672000	2677000	A myth of death, rebirth, and celestial destiny written into the sky.
2677000	2684000	NASA's primary launch pad at White Sands, where von Braun ran early tests, was Launch Pad 33.
2684000	2686000	Same thing at Kennedy Space Center.
2686000	2687000	There's only one runway.
2687000	2690000	And it isn't runway 1 or A.
2690000	2692000	It's runway 33.
2692000	2695000	Even key mission planners had surprising backgrounds.
2695000	2701000	Farouk El-Baz, who oversaw lunar science planning and helped select Apollo landing sites,
2701000	2704000	was nicknamed the king by the astronauts.
2704000	2707000	His father was a scholar of Egyptian religion.
2707000	2711000	And of course, NASA was never shy about a little syncretism.
2711000	2715000	They would mix and mash and pay homage to all sorts of ancient traditions.
2715000	2721000	Juno, the Roman queen of the gods, lent her name to one of the earliest launch vehicles.
2721000	2726000	Mercury, the Roman messenger god, was chosen for the first human spaceflight program.
2726000	2729000	Then came Gemini, the zodiac twins.
2729000	2734000	And finally, Apollo, the Greek sun god of light, knowledge, and rebirth.
2734000	2741000	One of the most intriguing aspects of the whole story is how the symbolism doesn't stop at names or patches.
2741000	2745000	It carries into the actual timing of the launches themselves.
2749000	2755000	Back in 1936, while Jack Parsons was still testing rockets in the Arroyo Seco,
2755000	2760000	his team managed their first successful liquid fuel test on Halloween night.
2760000	2764000	That date, October 31st, was originally Samhain,
2764000	2770000	a pagan festival marking the midpoint between the autumn equinox and the winter solstice.
2770000	2776000	Over 20 years later, Explorer 1, the first U.S. satellite built by JPL,
2776000	2781000	was launched on January 31st, 1958.
2781000	2784000	That day is known in the Christian calendar as Candlemas,
2784000	2787000	but in the pagan tradition as Imbolc.
2787000	2792000	The odds of the U.S. space program being bookended by Samhain and Candlemas,
2792000	2798000	two cross-quarter days with deep ritual significance in European pagan tradition, are striking.
2798000	2804000	Even if not consciously planned by the engineers, the timing seems to follow an occult template.
2804000	2809000	Samhain as a symbolic gateway, and Candlemas as a moment of rebirth.
2809000	2812000	Together, they framed the dawn of American spaceflight.
2812000	2814000	But we're just getting started.
2814000	2817000	This alignment with sacred dates was not a one-off.
2817000	2821000	During the Apollo era, launch planners sometimes chose dates
2821000	2824000	that aligned with celestial or symbolic turning points.
2824000	2830000	One of the clearest examples was Apollo 8, the first crude orbit of the moon.
2830000	2835000	It launched on December 21st, 1968, the winter solstice,
2835000	2840000	the day the sun is symbolically reborn after the longest night of the year.
2840000	2845000	Apollo 8 marked the first time humans left Earth's gravitational field.
2845000	2850000	And from lunar orbit, the crew delivered the famous Genesis reading on Christmas Eve.
2850000	2854000	In the beginning, God created the heaven and the earth.
2854000	2858000	And the earth was without form, and void.
2858000	2861000	And darkness was upon the face of the deep.
2861000	2865000	And the Spirit of God moved upon the face of the waters.
2865000	2869000	And God said, let there be light.
2869000	2871000	And there was light.
2871000	2874000	And God saw the light, that it was good.
2874000	2877000	God divided the light from the darkness.
2877000	2880000	But was it just convenient scheduling?
2880000	2883000	Or was some deeper archetypal pattern playing out?
2883000	2886000	A subconscious script of death and resurrection?
2886000	2888000	I'm going to give a little warning here.
2888000	2890000	What I'm going to lay out next is highly speculative.
2890000	2892000	I'm not saying I definitely believe it.
2892000	2894000	And it might sound a little bit out there.
2894000	2896000	Let's take Apollo 11 as an example.
2896000	2906000	Launched on July 16th, 1969, it coincided with the 24th anniversary of the Trinity Atomic Test.
2906000	2908000	The dawn of the nuclear age.
2908000	2914000	But the moon landing itself on July 20th happened under the astrological sign of Aquarius.
2914000	2918000	Symbol of the water bearer and bringer of knowledge.
2918000	2922000	Aquarius is often linked with enlightenment and radical change.
2922000	2929000	And it's tempting to think that the moon landing, timed as it was, might have been more than a technological milestone.
2929000	2933000	It could have been seen as a ritual passage into a new cosmic age.
2933000	2936000	The so-called Age of Aquarius.
2936000	2941000	Remember, Aldrin poured wine into a silver chalice during his private communion ceremony on the moon.
2941000	2946000	Humanity, in a sense, poured itself into another world.
2946000	2950000	What's especially fascinating is that these symbolic alignments haven't gone away.
2950000	2953000	They've continued into the 21st century.
2953000	2958000	In a presentation, former CIA officer John Ramirez described one particular case.
2958000	2962000	The 2005 launch of NRL 16.
2962000	2964000	The mission patch was strange.
2964000	2971000	It showed a pelican, a sun, several pentagrams, a silhouette of Bigfoot and palm trees.
2971000	2979000	Ramirez said that the pelican caught his attention because it matched the aviary codename of CIA scientist Ron Pandolfi.
2979000	2984000	Pandolfi has been a mysterious figure long tied to the UFO topic.
2984000	2993000	He has worked on exotic physics, was connected to the Jasons and Mitre Corporation, and was part of the CIA's Office of Scientific and Weapons Research.
2993000	2997000	A lot of people say that Pandolfi works the CIA's Weird Desk.
2997000	3004000	According to Ramirez, Pandolfi was directly involved in this NRL 16 launch.
3004000	3009000	The launch itself happened on 1250 AM on April 30th, 2005.
3009000	3018000	This happens to be the same day of Walbur Gisnacht, the traditional pagan holiday tied to the idea of gates opening between worlds.
3018000	3028000	The vehicle carried a payload named Prometheus, launched on a Titan IV rocket, and headed northeast towards the constellation of the Big Dipper.
3028000	3036000	This alignment has uncanny parallels to a ritual described in the 1977 grimoire known as the Necronomicon.
3036000	3048000	According to the text, the best time to perform the ceremony of walking, a kind of spiritual journey to the stars, is when the great bear hangs by its tail in the sky.
3048000	3057000	The ritual is said to work best around midnight, facing north, with specific emphasis on the northeast, the direction the Big Dipper rises.
3057000	3066000	The number five is the sacred, and the launch occurred at 050, five years into the millennium, on a patch covered in five pentagrams.
3066000	3067000	One.
3067000	3080000	Some researchers, like Peter Lavenda, have suggested that figures close to these launches encouraged people like Tom DeLonge to study Greek mythology.
3080000	3086000	Especially the story of Prometheus, to better understand the UFO phenomena.
3086000	3091000	That name, of course, matched the payload on the NRL-16.
3091000	3095000	After the launch, the remaining Titan IV rockets were retired.
3095000	3100000	One went to the National Museum of the U.S. Air Force at Wright-Patterson Air Force Base.
3100000	3107000	The other went to McMinnville, Oregon, the site of one of the most famous UFO photographs ever taken in 1950.
3107000	3111000	All slightly schizo-coincidences? Maybe.
3111000	3120000	But Lavenda has said that he's personally received letters from inside the U.S. military, praising the Necronomicon for being quote-unquote spot-on.
3120000	3124000	Including some from officers in Strategic Air Command.
3124000	3128000	For years, his book was even a bestseller at Fort Benning.
3128000	3130000	In just a few minutes, we're going to be left.
