start	end	text
0	6420	I just got back from Peru where I saw one of the craziest things I've ever seen in my life.
6780	14660	What am I referring to? I just might have seen a dead alien or an alien-human hybrid or an entirely
14660	20980	new branch of hominid or an ancient human mutilated in a bizarre way to imitate what looks like a
20980	27800	gray alien. I'm of course talking about these ancient Peruvian tridactyl three-fingered and
27800	44420	three-toed mummies. I can't wait for you to see these things because they're absolutely insane
44420	48660	and the facts around them and the region they were found in are just as trippy.
50260	55500	But you're probably already thinking, Jesse, these were already proven to be a complete hoax.
55500	62000	Why are you platforming this ridiculous topic? To you, I urge you to earnestly contend with these
62000	69460	mind-bending facts. Top forensic experts in Peru, Mexico, and the United States have all investigated
69460	74800	these bodies. After thorough investigation, they all think that these beings were probably once
74800	80660	alive. They even looked for deliberate mutilation of the fingers and toes, which they found no
80660	87420	evidence of. There's data to show that some of these bodies can be interpreted to be perhaps
87420	93520	living organisms. It's not that they cut off one finger or the other finger. The bodies are real.
93860	98480	You don't think they were constructed at all? No, it would be very difficult. You need to be the best
98480	106340	surgeon in the world to do that in Replicate. Catastrophic disclosure is happening in Latin America.
106340	112500	Thanks to our amazing friend, Michael Mazzola, who's coming out with an epic documentary on the
112500	117560	mummies later this summer. That documentary is going to be called This Is Not A Hoax. And please
117560	123600	pre-order his book, Catastrophic Disclosure, which I am linking in the description. We got a front row
123600	130380	seat to this entire thing. We were able to go to Peru and see three of the most interesting tridactyl beings,
130380	137960	Montserrat, Sebastian, and Santiago. One of my best friends and fellow UFO freak, Amar Kandil from the
137960	143200	massive and very inspirational YouTube channel Yes Theory, decided to join me on this trip.
143380	148600	There's a mutation in one of those genes that could cause changes in digit development.
148860	151540	It has a fetus inside the body. Oh my god.
151540	157300	And the hand and the feats of these features are also tridactyl.
157300	165880	Never in the eight years I've been researching have I mentioned or said the word extraterrestrial.
165880	170300	Never we are talking about humanoid species.
170300	174300	Just from an anthropology perspective, that should be the most fascinating thing.
174300	179300	Graphic evidence of tridactyly exists all over planet Earth.
179300	182300	Everything came from a single place.
182300	192300	This name comes from the word in the Nazca language. Laboratory where cloning and hybridization were done.
192300	199300	These bodies connect. They connect with technology. But if I want to use the technology for reverse engineering,
199300	203300	then I prefer to hide the bodies and use it for war, right?
203300	212300	We have caught the Peruvian government and Ministry of Culture in multiple instances of bad faith acting around this case.
212300	216300	For some reason, they don't want this case to see the light of day.
216300	220300	I put a lawsuit against them for $300 million.
220300	222300	I repeat, that one is fake.
222300	227300	I'm doing something real and important and I'm not a liar.
227300	237300	And if you watch this entire episode and wait until the end, you'll see how we're using state-of-the-art ancient DNA analysis techniques
237300	241300	to definitively tell you the beings that we're looking at.
241300	244300	Maybe we can solve this mystery once and for all.
260300	265300	Before the Incans, ancient Peru was home to other more mysterious cultures.
265300	272300	The Paracas until 100 BC and the Nazca people from 100 to 800 CE.
272300	279300	The Nazca region in southern Peru is named after these Nazca people because it's where they primarily lived.
279300	285300	It's currently over a thousand square miles and contains only around 80,000 people.
285300	289300	Nazca culture historically has been known for a few different things.
289300	295300	Unique religious practices often involving ritual offerings, trophy heads, and shamanic rites.
296300	300300	Polychrome pottery with highly stylized mythological motifs.
300300	302300	And of course, mythological cave art.
305300	314300	One of the most prominent archaeological sites is a petroglyph of what can be interpreted as a tridactyl.
314300	319300	Three-fingered and toed beings are everywhere.
319300	324300	Just look at this Nazca cave art and these woven fabrics.
333300	337300	Then, of course, you have these massive geoglyphs known as the Nazca Lines.
337300	343300	Large-scale drawings spanning up to 30 miles long, etched directly into the desert floor.
343300	352300	When you go to Nazca, when you see these drawings from the ground, they are not so hard to be made.
352300	358300	The only thing that will be controversial is for whom they made these drawings.
358300	359300	Why?
359300	364300	Okay, because the only thing for sure is that these drawings were made to be seen from the sky.
364300	376300	They only make sense 150 to 500 meters in the air, which is far higher than any of the closest vantage points on the ground.
376300	385300	So unless you have some aerial flying object, the line configurations and the figures they depict are literally incomprehensible to you.
385300	392300	Anybody who says that this can be appreciated in its full form, the way we're standing right now, they're out to lunch.
392300	395300	To see the finished product is only from up there.
395300	407300	Eric Von Daniken, author of Chariots of the Gods, thought that they were tributes to ancient alien astronauts, an extraterrestrial group that seeded human civilization.
407300	412300	I have no idea if Daniken is right, and I don't really have any hard evidence to believe he is.
412300	421300	But you have to admit, one of these Nazca lines looks kind of like an astronaut.
421300	426300	And another in Chile depicts a being with three fingers.
428300	430300	Nonetheless, the question remains.
430300	440300	Why would humans build megalithic structures up to 30 miles long that only make sense a few hundred meters in the air, higher than the highest local peak?
440300	448300	Why are there no excavation roads leading up to the main carvings, which presumably would have been necessary given all of the displaced Earth?
448300	451300	Even if they were using modern civil engineering techniques?
451300	456300	And then finally, why are there frequent UFO sightings in this area?
456300	480300	The final thing that the Nazca and Paracas people practiced were cranial deformation, or skull elongation rituals.
480300	493300	Cranial deformation is a deliberate reshaping of the skull using wooden boards, cloth bindings, or head frames, often done to infants, resulting in permanently elongated conical or flattened skulls.
493300	498300	These rituals conferred status onto the recipients of the elongation.
498300	502300	It often represented an initiation into a priestly class.
502300	504300	It denoted nobility.
504300	509300	And in many cases, it also seemed to be an attempt to imitate the gods.
509300	517300	Well, and also across cultures, how they have cranial deformation techniques to mimic the quote-unquote gods that are present.
517300	524300	I mean, Eknaton, who was the first king to call for monotheism in Egypt, he had a weird…
524300	525300	The sun god.
525300	526300	Yeah, yeah.
526300	530300	And where does the skull elongation come from? We don't really know.
530300	531300	Yeah.
531300	533300	We don't know why it arrived right then.
533300	534300	So it's like this little period of time…
534300	535300	That's really tricky.
535300	537300	…where the skull elongation shows up.
537300	539300	Why does it show up?
539300	559300	Okay, so that's the backdrop in which in 2015, a gravedigger named Leandro happened upon a cave with these tridactyl, three-fingered, three-toed, very gray alien-looking mummies.
559300	577300	I was walking along the edge and tripped on the wall and then it fell apart and I could see this cave full of diatoms.
577300	589300	I started to dig, to dig and dig, and big clumps began to emerge that when they melted revealed that they were heads and parts of the bodies.
589300	599300	The cave contained over 200 body parts, isolated heads, limbs, and appendages, and in many cases, entire intact bodies.
599300	606300	All of the bodies and parts were covered in diatomaceous earth, a desiccant that dried them out and preserved them.
606300	613300	And technically, they aren't actually mummies. Many of them still have their organs fully intact inside the bodies.
613300	621300	The bodies have a range of carbon dating from 700 years ago to 1800 years ago, mostly overlapping with the Nazca period.
621300	627300	There are three different dominant body types in the pile of 200 bodies and parts.
627300	633300	Number one, the S-types, these small winged creatures that we're not going to focus too much on in this episode.
633300	637300	Number two, the J-types, or as they're sometimes called, reptilians.
637300	642300	These are skinny, two to three feet tall, oddly geometric or boxy bodies.
642300	647300	And their faces look like the aliens in close encounters of the third kind.
647300	652300	Some even have eggs inside their bellies. We have 25 to 30 of these.
652300	658300	The mummies I personally think are most interesting are called the M-types, or hominids.
658300	662300	These look like hominid four to five foot beings.
662300	666300	Their organs, tendons, cartilage, and bones fully intact.
666300	676300	How many, how many bodies?
676300	678300	Oh my god.
678300	684300	Before we move on, a word from our sponsors.
684300	688300	This was the hardest documentary we've ever had to make.
688300	694300	On the way from Lima, Peru to Mexico City, I got sick as a dog.
694300	700300	Hold on, let me, let me blow up my nose. It's getting bad. I wish I was in better shape.
700300	704300	I always travel with Element Electrolytes. They are my favorite hydration brand.
704300	710300	Just the basics. Sodium, magnesium, potassium that you can mix into water or any drink.
710300	712300	No sugar, nothing extra.
712300	718300	On flights, in hotels, and right before interviews, when I thought I'd need to rest and call it in for the day
718300	722300	I was exhausted and packing up phlegm. Sorry for the visuals.
722300	727300	I'd hit a packet of Element and it would give me some clean, no jitters, pure energy.
727300	733300	I still use the product daily. In fact, during this three hour monologue that we're editing into this documentary,
733300	738300	I mix this little packet into this mountain valley water and I drink it.
738300	739300	And it keeps me going.
739300	745300	It works if you're fasting and need electrolytes, before and after workouts, and while researching for long hours.
745300	750300	It's also just great if you want to avoid that slow dehydrated crash. Half the time I'm tired,
750300	753300	it's because I'm not drinking enough water and I don't have enough electrolytes.
753300	760300	I'm also not a daily coffee drinker, so it's kind of become my go-to healthy solution for energy and vitality.
760300	764300	So get your free Element sample pack with any purchase.
764300	771300	Again, that's a free sample pack with any purchase at drinkelement.com slash alchemy.
771300	775300	That's drinklmnt.com slash alchemy.
775300	778300	Also try the new Element Sparkling.
778300	781300	It's a bold 16 ounce can of sparkling electrolyte water.
781300	786300	It tastes like your favorite soda, but it's dramatically healthier for you and it hydrates you.
786300	792300	Our second amazing sponsor for this video also literally saved my ass after Peru.
792300	797300	That's of course Ways to Well, founded by my good friend Brigham Bueller.
797300	799300	I just couldn't kick whatever I got in South America.
799300	802300	Brigham and his team threw the kitchen sink at it.
802300	809300	They gave me intravenous stem cells, nebulized stem cells that I literally inhaled to repair my lungs,
809300	814300	vitamin IVs, hyperbaric chamber, and red light therapy, all for free.
814300	822300	I am convinced I wouldn't have been able to go on the Joe Rogan experience if it weren't for Brigham and his team resuscitating me.
822300	826300	And I can literally say I wouldn't have been on JRE because Brigham made that introduction.
826300	834300	If that's not enough, Ways to Well gave my father, who suffers from dementia, free stem cells and helped my mom with her vertigo.
834300	836300	Okay, so how does any of this apply to you?
836300	844300	Ways to Well does extensive blood work, measuring 75 plus biomarkers, giving you access to custom formulated supplements,
844300	848300	even more peptides and prescriptions based on that blood work.
848300	852300	They even have an AI app that's literally an alien called Allen,
852300	857300	which is a custom large language model healthcare assistant diving deep into your biomarkers.
857300	860300	So this couldn't be a better fit for American Alchemy fans.
860300	865300	Use code JESSE to get 10% off your blood work today.
865300	868300	This is one of the most important things you could do for your health.
868300	871300	If you're interested in supplements, they sell some of the best ones.
871300	875300	They are custom formulated, pure and clean with no junk fillers, no GMOs.
875300	878300	They're third party tested for potency and purity.
878300	884300	Just go to ways to well.com and use code JESSE at checkout for a big discount.
884300	885300	I can't thank Ways to Well enough.
885300	888300	I truly think they're going to revolutionize healthcare.
888300	891300	Please check them out and give their blood work and supplements a try.
891300	893300	Now back to these crazy mummies.
893300	894300	So let's go.
894300	895300	Now back to these crazy mummies.
923300	938900	One, two, three, it's not that the code of one finger, or the other finger, no, there
938900	940100	are three.
940100	947500	That's a CT scan, yeah, there's no way, you can't fake that, I mean, I don't need
947500	954940	to be a forensics expert to say that if that's a real image, there's no way that that's fake.
977500	1002500	Dude, look at the fingers, look at the fingers here, that's like the realest, oh my god.
1002500	1013480	At this point, you are probably convinced that these aren't art pieces glued together,
1013480	1016960	like Flavio Estrada and the Peruvian Ministry of Culture claim.
1016960	1021380	They seem a whole lot like organisms that are anatomically self-consistent.
1021380	1028380	Just look at the image reconstructions from the CAT scans.
1028380	1049860	If you have great independent researchers like Gonzalo Chavez, who helped set up Tridactyls.org,
1049860	1052380	pointing out that the DICOM files made public.
1052380	1057760	If you look at these CAT scans around even the J-types, the reptilians, you can see capillaries
1057760	1060540	nourishing the eggs inside one of their bodies.
1060540	1064900	I don't even know if the most advanced synthetic biology going on in the United States can fake
1064900	1072360	some of this stuff, let alone a Wauquero named Leandro who lives behind a chicken coop in Peru.
1072360	1078140	We will link all of the medical imaging done on all of these beings on Tridactyls.org,
1078140	1082980	which contains all of the DICOM files with CAT scans and other data, so you can look at
1082980	1087260	all of this stuff yourself.
1087260	1092440	We feel that some of the entities are worthy of further investigation.
1092440	1098340	John McDowell, who is president of the American Forensics Association for a year and just won
1098340	1104060	the highest award in the country for forensics, the Grandwall Award, says this.
1104060	1111240	There is evidence, there is data to show that some of these bodies, these entities, can be
1111240	1117440	interpreted to be perhaps living organisms.
1117440	1120040	McDowell saw the bodies in person.
1120040	1126140	He was joined by Jim Caruso, the chief medical examiner for Denver and a forensic pathologist.
1126140	1132320	A former medical officer in the Navy for decades, Caruso has dozens of peer-reviewed scientific
1132320	1139960	papers and has personally performed over 300 autopsies.
1139960	1144540	Another person who isn't a stranger to autopsies is Dr. David Ruiz.
1144540	1148380	He's the president of the Peruvian Society of Legal Medicine.
1148380	1151140	So he's kind of the equivalent of McDowell in Peru.
1151140	1158220	I have been president of the Peruvian Society of Legal Medicine, right?
1158220	1161140	It's equivalent to McDowell.
1161140	1169140	As a doctor, as you call it, a conventional doctor, we see scans and MRIs and images all
1169140	1170140	of them.
1170140	1177740	I mean, we realize when there is something, something real or something, something unreal.
1177740	1183860	He takes things even farther than McDowell, confidently claiming that these are non-human but very real
1183860	1184860	beings.
1184860	1191520	And that the traductiles have been visiting us for thousands of years.
1191520	1196300	We invite the scientists of the world, the professors, the professionals from different universities
1196300	1199200	to be a little more interested in knowing this.
1199200	1206080	Never in the eight years I've been researching have I mentioned or said the word extraterrestrial.
1206080	1207220	Never.
1207220	1211280	We are talking about humanoid species.
1211280	1217520	We are talking about perhaps a hominid like us, a three-fingered hominid.
1217520	1225280	The word extraterrestrials has been used by the scientists who do not want to investigate.
1225280	1231260	The archaeologists who resist accepting this and try to discredit it.
1231260	1236920	They call them fake extraterrestrial mommies.
1236920	1241980	And then you have chief of the medical division for the Mexican Navy, Jose Zalce.
1241980	1247280	He joins Ruiz, but he goes even farther than him, saying not only are the bodies definitely
1247280	1248940	real organisms.
1248940	1255280	He speculates that the beings are so genetically dissimilar to humans that they might be extraterrestrial.
1255280	1267280	In the big bodies like Maria, the DNA showed us that there were around 70% known DNA.
1267280	1275280	But there were 30, 30% completely different.
1275280	1280280	You're probably already thinking, Jesse, these were already proven to be a complete hoax.
1280280	1283280	Why are you platforming this ridiculous topic?
1283280	1287280	Well, the only reason you think that these are a hoax is because a journalist.
1287280	1291280	Remember the guy who was talking about UFO sightings around the Nazca lines?
1291280	1298280	A guy named Manuel Caceres made wooden figurines that he glued together, dedicated to the Nazca
1298280	1300280	mummies, to sell to tourists.
1300280	1306280	These little trinkets, pieces of touristic art, meant to resemble the real mummies.
1306280	1310280	These were confiscated at the Lima airport in 2023.
1310280	1313280	I repeat, that one is fake.
1313280	1314280	It's craftsmanship.
1314280	1316280	Constructed, built.
1316280	1320280	In early 2024, Reuters published this about the Nazca mummies.
1320280	1322280	They're not extraterrestrials.
1322280	1330280	They're dolls made from animal bones from this planet, joined together with modern synthetic glue, said Flavio Estrada.
1330280	1337280	But that ridiculous conflation between these wooden figurines and these real anatomically consistent whole bodies
1337280	1342280	was reported on by Reuters and other esteemed legacy publications.
1342280	1348280	And it's the sole reason so many people in the Western world are so sure this story is fake.
1348280	1351280	It's at that point that the story became a laughing stock.
1351280	1352280	Here we are.
1352280	1353280	Oh, I love this.
1353280	1354280	I love these.
1354280	1355280	There we go.
1355280	1356280	Two of them.
1356280	1357280	What is that?
1357280	1358280	I don't know.
1358280	1359280	Jesse, man.
1359280	1360280	Bro.
1360280	1362280	Shit's getting real, bro.
1362280	1367280	The real story is that this grave digger, Leandro, found the bodies in 2015.
1367280	1370280	So this must have been completely full of bodies.
1370280	1371280	It's all filled.
1371280	1373280	You have the walls on top of the bodies.
1373280	1374280	It's all filled.
1374280	1375280	It's all filled.
1376280	1379280	Leandro does shamanic tours in the local region.
1379280	1384280	He lives behind a chicken coop and is linked with some interesting local organizations.
1384280	1390280	In 2016, he met a French explorer of ancient Incan lost cities named Thierry Amin.
1390280	1397280	Yamin is an explorer from another era, a real-life Indiana Jones, in this case, trying to find El Dorado.
1397280	1405280	Yamin and his Inkari Institute have been spearheading a lot of research around these three-fingered beings, or as they're known, Tridactyls, since that time.
1405280	1422280	So right now they're showing us the moment, the exact moment they discovered that she was pregnant when they were doing the scans, because it happens live.
1422280	1424280	So that's what they're showing us right now.
1424280	1438280	Perhaps one of the wildest revelations, Montserrat, one of these Tridactyl M-type hominid-like beings, might also have a fetus inside of it that is a three-fingered Tridactyl being.
1438280	1445280	This would imply a genetic match and phenotypic inheritance between a baby and a mother.
1453280	1462280	So if you had the tomography, the x-rays, the 3D reconstruction, you had all of that, say take out the 3D reconstructions, you just had the raw measurement data that you got.
1462280	1463280	Yes.
1463280	1479280	If you sent that to a normal doctor, you know, who is used to evaluating the health of a fetus in a womb of any mother, would they say, oh, that baby only has three fingers?
1479280	1480280	Yes.
1480280	1481280	Wow.
1481280	1482280	Yes.
1482280	1485280	They would be able to spot it, a conventional doctor.
1485280	1490280	The doctor has the curiosity to be very careful.
1490280	1491280	Yes.
1491280	1496280	He would say, this baby has three fingers in their hands and in their feet.
1496280	1499280	So it would be easy for a conventional doctor to spot.
1499280	1500280	Yes.
1500280	1501280	Wow.
1501280	1505280	She, when passed away, was pregnant.
1505280	1509280	She had an eye like a prominent belly.
1509280	1512280	And of course the amniotic fluid is water.
1512280	1515280	And that is lost more.
1515280	1518280	That is why it looks like her hands are in the air.
1518280	1522280	But she was holding her belly.
1522280	1524280	Oh, that's what I was looking at.
1524280	1525280	Oh, I see, I see.
1525280	1527280	And it was just like, mmm.
1527280	1529280	Oh, it's so sad.
1529280	1538600	Now another simple explanation would be that these beings went through typical ancient
1538600	1543600	skull elongation rituals, along with maybe some more unique hand and feet mutilation
1543600	1544600	procedures.
1544600	1549100	But the CAT scans don't really look like the hands were mutilated, and the skulls don't
1549100	1553200	seem to have the stress fractures typical of head binding rituals.
1553200	1561960	If you had a closer look, you can see in the skull the line who makes the pressure to deform
1561960	1563520	the skull.
1563520	1564840	You can see it in the skull.
1564840	1566400	Ah, you can see it.
1566400	1573720	You can see where the humans put something to deform the skull.
1573720	1587480	In the school of Maria, if you saw the tomographies, you can't see any line of artificial deformation.
1587480	1592040	And are we noticing that the skull is also big?
1592040	1595160	Okay, so they are born big then.
1595160	1598680	It's not like a manipulation over the skull.
1598680	1604920	Now if that's not weird enough, there's a genetic mutation that dictates digit differences,
1604920	1607880	anomalous numbers of fingers and toes.
1607880	1611000	This genetic mutation does that in humans.
1611000	1617400	This mutation was apparently found in the NCBI database holding the genetic data on these
1617400	1619880	Peruvian Nazca mummies.
1619880	1623640	Just listen to bioinformatics expert Elena Hardy on what she found.
1623640	1630200	One of the things I did find that I kind of stumbled across was I actually went to falsify
1630200	1636120	the hypothesis that there was a genetic mutation that could cause changes in digit development,
1636120	1636680	right?
1636680	1637720	So I went into the literature.
1637720	1641320	I found a list of like 50 genes involved in the pathway.
1641320	1644040	Sonic hedgehog is the one that everybody has heard of, right?
1644040	1646440	This is one of the sonic hedgehog pathways.
1646440	1654920	There's a mutation in one of those genes called GLI3 where a similar kind of mutation is associated
1654920	1657240	in the literature with polysyndactyly.
1657240	1661800	So like the fusion of fingers or extra digits.
1663080	1665080	And so that's really interesting.
1665080	1670600	It doesn't have anything to do with tridactyly, but it's like not a super common mutation.
1670600	1674280	You know, it's like you wouldn't, it was enough to make me go, huh.
1674280	1679000	And wasn't there a study of like a Chinese family that has this group as well?
1679000	1679640	Yeah.
1679640	1683480	Some of the members of that family who have that mutation have everything from like
