start	end	text
1683480	1687960	developmental disabilities to these digits, like disorders of digit development.
1687960	1693720	And this was like a mutation that comes from like one side, like either the mother or the father.
1694840	1699880	And so you can have this effect with just one side of the family passing on this gene.
1699880	1701880	You don't need two copies of it, right?
1701880	1703720	There, there are other like mutations, right?
1703720	1707480	Isn't there like, there's some tribe in Africa with like ostrich feet?
1707480	1712440	There are these mutations that are maybe even rendered adaptive in certain environments
1712440	1714040	and they sort of persist over time.
1714600	1718760	And so it could just be that, which would be remarkable unto itself.
1720840	1725960	I don't think this obscure genetic mutation is even widely known in the genetics community.
1725960	1731160	And it's definitely not known by the Wakiro grave diggers who dug up the bodies in the first place.
1731160	1736040	So if you could replicate the finding of that mutation, that would be a big deal.
1736040	1740600	At this point, I don't think the question is, are these beings real or fake?
1740600	1744440	They are clearly real beings.
1753400	1755480	Seeing the mummies in person was wild.
1755480	1758840	But I had been hearing so much about this guy behind this story.
1759400	1762520	Jaime Masan, the supposed charlatan, hoaxer.
1762520	1763800	Jesse, don't go to Peru.
1763800	1765240	You're going to ruin your brand.
1765240	1766760	Jaime is a known hoaxer.
1766760	1769160	I can't tell you how many texts I've gotten like that.
1769160	1772280	I needed to meet the man myself and see what he was all about.
1773800	1775400	I honestly loved Jaime.
1775400	1777480	Jaime is independently very wealthy.
1777480	1781240	He lives in one of the most beautiful houses on the border of a national park
1781240	1783000	right outside Mexico City.
1783000	1787000	And is on a quest to prove that extraterrestrial life is real.
1787000	1789480	When we finish, I'll show you the spear.
1789480	1790520	I can't wait.
1790520	1791160	So excited.
1792120	1793640	My friend, you feel it.
1793640	1794040	You feel it?
1794040	1794680	You feel it off?
1794680	1797080	This is not fucking real.
1797080	1798680	This is something else.
1798680	1800360	This is so crazy.
1800360	1805400	A few days before visiting Jaime, he happened to have recovered an aluminum object,
1805400	1810120	of which he had over four minutes of video flying around Buga, Colombia.
1810120	1814520	The object appears to drop below the trees and get retrieved on the forest floor.
1814520	1817880	And he said it weighs two kilos, four pounds.
1817880	1820120	And then now weighs 10 kilos.
1820120	1823720	Jaime is a bit more sure of this Buga sphere than I am.
1823720	1825160	The sphere is fascinating.
1825160	1829880	It seems to be made of an aluminum alloy, three times the hardness of aerospace-grade aluminum.
1829880	1832680	They claim it exhibits electromagnetic anomalies.
1832680	1837720	I think there are some decent debunks here, and my brain was already fully broken by the mummies.
1837720	1842440	So write a comment if you have any hot takes on the Buga sphere, and we'll do a follow-up episode on it.
1842440	1847880	But the point is, while I don't agree with Jaime on everything, I love his energy.
1847880	1851800	And I think he is actually inviting real scientific scrutiny on these things.
1851800	1857240	He can speak in absolutes, and isn't always nuanced as I might shake out on certain UFO cases.
1857240	1866200	He doesn't like to engage in lofty theoretical conversations about this stuff.
1866200	1869000	I'm more interested in weird science and abstract theory.
1869000	1873640	But I didn't sense any cynicism or intellectual disingenuousness from him.
1873640	1879080	If anything, I found him to be a boldly stated amateur explorer of a bygone era,
1879080	1881560	just trying to show the public what he's seen.
1881560	1885240	He genuinely believes that the Nazca beings are extraterrestrial.
1885240	1889080	And I found him to be extremely generous, not territorial,
1889080	1891640	and very open with all of his findings.
1891640	1894600	He took the tomography scans of this ball,
1894600	1898200	and then gave us the password to look at the results the same day.
1903880	1908200	So generous of Jaime to just give us the login and password.
1908200	1910040	If I find out, help me.
1910040	1910520	We will.
1912200	1914360	He clearly just wants the truth out.
1914360	1917720	And he doesn't care if it's out on his platform or others.
1917720	1925000	I think the time has come to accept that we have been visited for a long, long time.
1925000	1927000	Why do people say you're a hoaxer?
1927000	1929480	Because I have the balls to present things.
1930200	1933800	You know, it's so easy to be in the back and criticize everything.
1934760	1937640	If you have the courage to present things,
1937640	1940360	then you are going to risk yourself.
1941240	1943720	You are going to expose yourself.
1943720	1949320	Anybody credible in the scientific community, would you guys like to invite them to Mexico City?
1949320	1953800	And I mean, if you want this to be recognized by humanity,
1953800	1955320	anybody should come.
1955320	1957880	And I think the best experts are welcome.
1958440	1963320	I don't want to welcome anyone who comes here just with an idea to destroy the thing,
1963320	1966280	to construct, to find, you know.
1966280	1968760	It doesn't have to tell us what we want to hear.
1969480	1971400	They want to find out the truth.
1971400	1974200	If they are looking for the truth, you are welcome.
1974200	1974840	Anyone.
1979000	1980280	Now I know what you're thinking.
1980280	1983160	Maybe these people just want their 15 seconds of fame.
1983640	1986440	But if you really think about these people's credentials,
1986440	1988920	they have more to lose than to gain.
1988920	1992760	They're all fairly well off financially, and they're very credentialed.
1992760	1997960	Jaime is now suing the Peruvian government for $300 million for defamation
1997960	2000600	because of their claim that he's pushing a hoax.
2000600	2007800	I really have to remember, I put a lawsuit against them for $300 million.
2007800	2008600	Wow.
2008600	2011400	Have you invested any personal money to keep...
2011400	2012360	I cannot tell you.
2012360	2012920	Okay.
2012920	2013640	I cannot tell you.
2014600	2017000	But, uh, but yeah.
2017000	2020040	The Peruvian government was completely against this case,
2020040	2023000	especially up until September 2024,
2023000	2027160	when they've started to tacitly endorse research at the University of Ica
2027160	2029800	that might actually indicate that these bodies are real.
2029800	2035240	The point is, until then, Ruiz could have faced serious backlash for his involvement with the case.
2035240	2039240	Just look at what the Peruvian Ministry of Culture did to Joyce Mantilla
2039240	2041800	during one of the press conferences around the bodies.
2041800	2053160	While we were down there, they raided the press conference.
2053160	2059240	I don't know if you heard or saw about that, but they brought in federal police, federal prosecutors,
2059240	2065400	and the Ministry of Culture actually took over the microphone while he was up on the dais getting ready to speak.
2065400	2071720	I asked my buddy Pavel from the great podcast Tzico Activo what his take was.
2071720	2073800	Pavel, thank you so much for being here.
2073800	2080040	You've been covering this for years, uh, well before it's even started to be kind of more destigmatized.
2080040	2085480	Next, he's thoroughly documented the Peruvian Ministry of Culture's slow shift on the Nazca Mummy's case.
2085480	2091480	The concessions they're now starting to make, they seem to be walking back their early hardline denials.
2091480	2098920	When Jaime started doing the whole lawsuit stuff, that forced the Peruvian Ministry of Culture
2098920	2102520	and the Peruvian government to take this a little more seriously.
2102520	2108280	And just listen to what happened to Zalce when he was working for the Mexican Navy,
2108280	2110200	when he got involved with the Mummies.
2110200	2121880	I spent around five days in jail because they said I was a liar and I was putting in risk
2121880	2126200	the honorability of the whole system of the Navy.
2126200	2131320	He said to me, please do not continue the investigation of the Mummies.
2131320	2139400	And I say, I can stop doing that because I believe I'm doing something real and important
2139960	2146600	and I'm not a liar. So I have to demonstrate to the world that it was real.
2149080	2152200	But what about the cave or tunnel where these bodies were found?
2152920	2157320	Michael Mazzola admits that Leandra may have taken him to the wrong location.
2157320	2171880	And there are plenty of financial incentives to keep this cave's location under wraps.
2171880	2176520	My theory is he's been showing people this cave to make money.
2176520	2182120	He charges about three grand a visit for a tour to go see this cave.
2182120	2183880	We did not participate.
2183880	2184520	Yeah, good.
2186440	2191080	The cave that he's brought people to did not hold these bodies.
2191080	2193160	There's no way. The cave's too small.
2193160	2202760	A few different anonymous sources revealed to me that the actual source of these bodies
2202760	2205480	is a large subterranean tunnel system.
2205480	2210360	These sources, some of whom don't even know each other, didn't want to reveal their identities
2210360	2214200	publicly due to fear of retribution from the local cartels.
2214200	2216760	And to be honest, I found them very believable.
2216760	2220600	I also think that made a lot of sense from a self-preservation standpoint.
2220600	2224680	So while I don't always love anonymous sources making bold claims,
2224680	2226200	I have to respect that.
2226200	2230040	There are also a lot of people in and around these tunnel systems
2230040	2233640	that say they see and hear weird things at night.
2233640	2236280	Strange noises coming out of the tunnels,
2236280	2241000	beings that don't seem to walk like humans, and other anomalous observations.
2241000	2243960	So we might just have a live situation on our hands.
2243960	2247320	And what about so-called Lazarus species?
2247320	2252520	Species that the academic consensus thought were extinct and then get rediscovered.
2252520	2254520	Some of them are millions of years old.
2254520	2259080	One example people speculate about is the Orang Pendek in Indonesia.
2259080	2261480	There's a thing called the Orang Pendek.
2261480	2262280	Have you ever heard of that?
2262280	2263000	No, what is that?
2263000	2266360	They think, I believe it's Indonesia and maybe Vietnam,
2267240	2271240	where people talk about these little tiny hairy people that live in the jungle.
2271240	2271960	Whoa!
2271960	2278280	And so these Flores things, there's a few biologists that believe these things are still alive.
2279080	2279720	Interesting.
2279720	2282280	They think even on the island of Flores, they might still be alive.
2283640	2287320	And again, the Nazca region is over a thousand square miles
2287320	2291240	and currently contains only 80,000 or so people.
2291240	2295720	It's the perfect place for a groundbreaking discovery like this to have occurred.
2296680	2300680	This also isn't the only subterranean tunnel system in the world.
2300680	2304040	There are subterranean tunnel systems all over the world.
2304040	2308360	Some are ancient, like these ones in modern Turkey documented by the great Graham Hancock.
2308360	2313320	This is quite a famous phenomenon in Turkey that there are huge cities.
2313320	2318120	They look like ant farms on an enormous scale that are dug out under the earth.
2319240	2325560	Hundreds and hundreds of rooms that huge efforts were put into digging deep beneath the earth and creating these shelters.
2326520	2330760	We have this concept of this coming from another planet, but it might not be from another planet.
2330760	2331080	Yeah.
2331080	2335640	It might be from here, like the underground, those tunnels and caverns in Turkey,
2335640	2339560	where they have this immense underground civilization or city rather.
2339560	2343400	And it almost felt like maybe they were hiding out from a cataclysm or something.
2343400	2343720	Right.
2343720	2344920	And that's what they think it was.
2344920	2345160	Yeah.
2345160	2350520	So imagine if there's some break off civilization where they lived, I mean,
2350520	2354200	we're talking hundreds of thousands of years ago, but they're different than us.
2354840	2356760	And, you know, sometimes they come visit.
2361400	2366520	But there are weirder ones surrounded by rumors of weird inhabitants or artifacts.
2366520	2370680	Take the Teos cave system at the edge of the Ecuadorian Amazon.
2370680	2376120	There is a legend attached to these caves, which involves a metal library made of gold.
2377960	2381720	It supposedly contains an ancient alien metallic library.
2382280	2387960	The existence of this library gained so much traction in elite circles that Neil Armstrong,
2387960	2392120	that's right, the Neil Armstrong, who was the first man to walk on the moon,
2392120	2397880	was so interested in it that he took a BBC film crew looking for it in 1976.
2398440	2403000	Why would Neil Armstrong look for aliens on Earth after going to the moon?
2403000	2405720	That's a question for another American Alchemy episode.
2405720	2410920	But it shows at the very least that he had confidence that he might find something interesting there.
2410920	2415640	There are also deep underground military bases across the United States.
2415640	2422280	And sometimes one's rumored to house other beings at S-4 Area 51 or Dolce, New Mexico.
2422280	2427080	These represent the more out there myths in ufology from Phil Schneider, Bob Lazar,
2427080	2433560	and Dan Barish involving an American space program that is co-run with the alien beings themselves.
2433560	2437160	We went to another part of the facility, went to another building.
2437160	2439080	In that building, we went into an elevator.
2439080	2444920	We took an elevator down, which that was the first odd thing is that it felt like we went down
2445800	2448920	significantly further than like you would think you would.
2449480	2451320	I mean, it was just awkward. It just stood out.
2451320	2454040	But even if you don't believe any of those stories,
2454040	2459720	there's a ton of real documentation of deep underground military bases across the United States
2459720	2462680	from hardcore researchers like the great Richard Sauter.
2464760	2470680	But listen to what Thierry had to say about the general region that the mummies were likely found in.
2470680	2480680	And there is a little book published in 2004 by a local author from Nazca
2480680	2484680	that talked about various sites in the Nazca area.
2484680	2495000	And it precisely talks about this area and mentions the name of the site where the discovery was made.
2495800	2501960	And it says that this name comes from the word such in the Nazca language.
2501960	2508120	And in conclusion, it means laboratory where cloning and hybridization were done.
2514680	2525960	Now, how did they appear? There is no precedent. There isn't. There are no three-thought hominids.
2526840	2532840	However, upon finding that their DNA may have been mixed with genetic technology,
2532840	2542360	if you go back 1,800 years, it's crazy. It is likely that a civilization more advanced than ours
2543640	2550040	made that genetic mix. And it is likely its creators are probably from elsewhere.
2550040	2564840	So were these beings laboratory experiments? Evidence of a hidden hand guiding Darwinian evolution?
2567560	2573080	And here's where things get weirder. Many of these M-type or hominid beings contain implants.
2573080	2577480	And it's pulling up the neck. It's squeezing.
2578360	2583080	This is the x-ray. This is the neck x-ray. But here is a cervical traumatic injury.
2583080	2588520	But the injury has been before they put that. It's not because of the plate.
2588520	2593080	So the plate could have been to, like, repair or correct.
2593080	2598680	These metal implants contain osmium and cadmium, which are extremely rare earth metals.
2598680	2607160	Osmium is so rare that it's 1,500 times rarer than gold and 2,500 times rarer than silver.
2607160	2612680	Only about 100 kilograms to 1 ton of osmium is extracted globally every year.
2613240	2617080	For reference, 100 kilograms is roughly the weight of a newborn elephant.
2617080	2622040	And a small car like a Honda Civic weighs around a ton. It's an extremely rare element.
2622040	2626760	But perhaps the weirdest thing about osmium and cadmium is that they were only officially
2626760	2631960	discovered by the Western world in the 19th century. But they're being found on implants
2631960	2637960	in bodies that carbon date to over 1,000 years ago. The rare metal implants have organic tissues
2637960	2643880	fused to them in the bodies, indicating that the beings were alive when the implants were placed.
2643880	2650040	This process of organic tissue fusing is called osseointegration. I decided to have a little fun
2650040	2656920	and ask ChatGPT how hypothetically osmium would be used as medical implants. It did say that osmium,
2656920	2663400	if oxidized, could be toxic. But underground, oxygen is much lower. So something like osmium
2663400	2669640	would oxidize way less quickly. But then it came up with the idea that osmium would make a great brain
2669640	2677000	machine interface material. I sat down with population geneticist Alan Isararas, who had his own theory
2677000	2682440	about the metal implants inside these beings. There's this thing called bioelectricity that can
2682440	2690600	sort of modulate where genes get expressed, at which location really precisely. And so maybe,
2690600	2696360	like, if I'm trying to be, like, really exotic, like, maybe these things are modulating some sort
2696360	2702200	of gene expression to make the beings into what they are. That's fascinating. Maybe there's a chance
2702200	2710840	they're, like, minimally genetically altered. And the rest of the alteration is at another layer
2710840	2717560	of the phenotype, which is, could be this bioelectricity layer. Interestingly,
2717560	2721800	osmium and cadmium have also been found on meteorites from space.
2726920	2730760	After we left Mexico City, another hearing took place there.
2730760	2736760	This time with an American congressman present, Representative Eric Burleson from Missouri.
2736760	2742120	According to Burleson, UFO whistleblower David Grush told him that the beings in Nazca
2742120	2746040	resembled things that Grush had seen in classified settings.
2746040	2751400	Whenever I spoke with David Grush, who was the whistleblower from the Pentagon that studied
2751400	2757400	this stuff, I was actually probably not going to go because I thought that there's no way that that's
2757400	2765480	real. And he recommended that I do because he said that based on the physiology of what
2766200	2770360	he's seen in some of these mummies, not all of them, some of them are faked,
2770360	2776840	but some of the mummies that exist in Peru, that based on the physiology, they are congruent with what
2776840	2781240	he has seen in briefings in his former role.
2784120	2789480	And remember the beings in Virginia, Brazil, and James Fox's amazing movie, Moment of Contact?
2790200	2791960	They also had three fingers.
2791960	2806840	There are also very credible American UFO crash retrieval cases that have occurred,
2806840	2808840	you guessed it, in Peru.
2810040	2815960	Just look at the insane story of UFO whistleblower Jonathan Waygant, documented by my buddy UAP
2815960	2820280	Gerb. Waygant was part of a UFO crash retrieval team in Peru.
2821080	2824200	At one point it looked half like green and half purple.
2824200	2830920	Waygant, Allen and Adkins observed a huge ship embedded at a 45 degree angle into the rocky cliff face.
2831480	2837240	This is the craft. This is pretty crude two-dimensional drawing, but this is jungle here.
2837800	2843160	This is the craft and it was embedded in the rock like this.
2843160	2847000	Although no lights were visible from behind the hatch, Waygant did observe
2847000	2851960	what appeared to be a four-fingered arm hanging limply from the open hatch.
2851960	2855720	And listen to what Dr. David Ruiz had to say about these beings,
2855720	2858920	our interview taking a hard left turn.
2858920	2865320	One of the governments most interested in hiding things is the one that does the most reverse
2865320	2871960	engineering. And those have been all the things that happened during the Cold War era.
2871960	2878600	These bodies connect, they connect with technology. If I accept the bodies, I will accept the technology.
2880280	2886600	But if I want to use the technology for reverse engineering and have supremacy over planet Earth,
2887400	2894600	then I prefer to hide the bodies, do hidden reverse engineering, and use it for war, right?
2894600	2903560	Okay, but before we get too excited, there are some real issues around this case.
2903560	2909400	Number one, the provenance. This was found by a grave robber, a walkero that probably does some other
2909400	2911240	somewhat dishonest things for a living.
2911240	2917160	They're likely the result of grave robbers taking these ancestral burial, these individuals,
2917160	2921880	from their burial sites and then using them to make and sell these things on the open market.
2922280	2927560	See, the tough thing about the involvement of these walkeros and the global cartels they're associated
2927560	2933720	with is that their involvement is simple. They want to make money. But what their involvement means
2933720	2940200	is not. If the underlying bodies were real or fake, they'd want to make knockoffs and maximize profits by
2940200	2946920	selling new bodies to elites all over the world on the black market, no matter what. If the bodies were real,
2946920	2952120	they'd sell the bodies and make knockoffs resembling the real ones. And if the bodies were fake but
2952120	2958200	looked real, they'd also sell them. So I'm sure these black market sales are happening. And that fact
2958200	2964280	alone should give anyone making bold claims around this case a healthy dose of humility. But I'm just
2964280	2971320	not sure that fact adds any signal to the noise. This crime syndicate involvement is the part of the case
2971320	2977800	I was most afraid of discussing. It's awkward and adds a real element of danger for anyone covering
2977800	2982760	it. But at the end of the day, if you're a walkero and you're watching this, don't be mad at me.
2982760	2987720	All I'm saying is I'm genuinely not sure what's going on. And the price of these things are probably
2987720	2996280	going up as we speak. If this is art, if someone made this, I need to buy one. I've heard seven
2996280	3003320	figures, seven figures. I've heard a lot of money. She's the lease. You know, it's a long hike up one
3003320	3009560	of these small mountains into a cave that I'm convinced has nothing to do with the location.
3009560	3014920	And so initially he was saying, Hey, I found this underground citadel, like almost like a temple.
3014920	3019320	And they were in there and they were inside a stone sarcophagi. That was the initial story.
3019880	3025000	Then it changed to, no, they were found in this cave. Do you trust him? Did you get it good?
3025000	3031160	Not even a little bit. Not even a little bit. He tried to charge me $1,500 just to interview him.
3031160	3033640	So this must have been completely full of bodies.
3033640	3044440	It was, all was full. All up to the ceiling. Yeah, all, all was full. So he needed to, like,
3044440	3049320	carry it. And as it's bland, that with the hand, it's very soft.
3049320	3056120	So you can use it. No, no, no, no use any tool. He didn't use any tool.
3056120	3075480	As you can see from the cave itself, it looks like it can barely fit one person inside of it,
3075480	3081400	let alone 200 body parts, appendages, heads, and full intact bodies. Number two,
3081400	3087080	one of the isolated heads that look exactly like one of the J-type bodies seems to have
3087080	3093640	alpaca proteins all over it. A proteomics expert who I interviewed but chose to remain anonymous,
3093640	3099080	given the controversies around the case and nascent nature of his findings, said this to me.
3099080	3103960	There was an early hypothesis that these could be an alpaca brain case. And there's a published paper
3103960	3110600	about CT showing CT scan data, showing these morphological similarities to an alpaca brain case.
3111400	3118040	I ran proteomic analysis on these, got back these peptide sequences, which reflect the DNA sequences.
3118040	3123720	Then I used a pipeline from a paper published in Nature two or three years ago about species
3123720	3128920	identification of ancient bone sample. And I ran these, all of these bone samples from the
3128920	3134280	skull through this pipeline and they all came back identified as alpaca bone.
3134280	3138680	Whether it's the attached parts, the main body of the skull, all of it came back as alpaca bone.
3138680	3145080	Number three, UFO researcher Steve Mara told me that two different finger bones of one of the M-types,
3145080	3151640	Maria, were genetically tested in Sri Lanka. He said that one of the phalange bones came back male,
3151640	3156840	the other came back female. If that's true, that obviously throws a wrench in things if you're
3156840	3162440	looking for an anatomically consistent singular organism. Ancient DNA is very tricky and they've
